信息来源,搜索条件,物料名称,产品分类,生产商,供应商,生产日期,批号,项目分类,检测项目,单位,检测结果,限量值,判定,发布单位,发布日期,备注
食品伙伴网,,双乙酰酒石酸单双甘油酯,食品添加剂-->食品添加剂,Kerry(NL)BV Zwijndrecht ,南京福旺食品有限公司 ,2021-04-09,,,,,,,合格,国内监督抽查(江苏市场监管局),2021-04-09,/
食品伙伴网,,聚二甲基硅氧烷乳液（消泡剂）,食品添加剂-->食品添加剂,南京金钥匙生物科技有限公司 ,清江浦区正通食品添加剂经营部 ,2021-04-09,,,,,,,合格,国内监督抽查(江苏市场监管局),2021-04-09,/
食品伙伴网,,食品添加剂 磷酸二氢钙,食品添加剂-->食品添加剂,江苏德邦多菱健康科技有限公司 ,江苏德邦多菱健康科技有限公司 ,2021-04-09,,,,,,,合格,国内监督抽查(江苏市场监管局),2021-04-09,/
食品伙伴网,,维生素C（食品添加剂）,食品添加剂-->食品添加剂,东北制药集团股份有限公司 ,南京紫乐饮料工业有限公司 ,2021-04-09,,,,,,,合格,国内监督抽查(江苏市场监管局),2021-04-09,/
食品伙伴网,,食品添加剂  维生素C,食品添加剂-->食品添加剂,山东天力药业有限公司 ,南京紫乐饮料工业有限公司 ,2021-04-09,,,,,,,合格,国内监督抽查(江苏市场监管局),2021-04-09,/
食品伙伴网,,聚二甲基硅氧烷乳液,食品添加剂-->食品添加剂,南京金钥匙生物科技有限公司 ,南京小洋人生物科技发展有限公司 ,2021-04-09,,,,,,,合格,国内监督抽查(江苏市场监管局),2021-04-09,/
食品伙伴网,,食品添加剂 焦糖色,食品添加剂-->食品添加剂,潍坊恒泰食品有限公司 ,淮安市浦楼酱醋食品有限公司 ,2021-04-09,,,,,,,合格,国内监督抽查(江苏市场监管局),2021-04-09,/
食品伙伴网,,蔗糖脂肪酸酯S-11,食品添加剂-->食品添加剂,浙江合糖科技有限公司 ,南京小洋人生物科技发展有限公司 ,2021-04-09,,,,,,,合格,国内监督抽查(江苏市场监管局),2021-04-09,/
食品伙伴网,,食品添加剂D-异抗坏血酸钠,食品添加剂-->食品添加剂,郑州拓洋实业有限公司 ,南京小洋人生物科技发展有限公司 ,2021-04-09,,,,,,,合格,国内监督抽查(江苏市场监管局),2021-04-09,/
食品伙伴网,,食品添加剂 5’-呈味核苷酸二钠（又名呈味核苷酸二钠）,食品添加剂-->食品添加剂,希杰（沈阳）生物科技有限公司 ,淮安市浦楼酱醋食品有限公司 ,2021-04-09,,,,,,,合格,国内监督抽查(江苏市场监管局),2021-04-09,/
食品伙伴网,,六偏磷酸钠,食品添加剂-->食品添加剂,湖北兴发化工集团股份有限公司 ,南京小洋人生物科技发展有限公司 ,2021-04-09,,,,,,,合格,国内监督抽查(江苏市场监管局),2021-04-09,/
食品伙伴网,,硬脂酸镁,食品添加剂-->食品添加剂,安徽山河药用辅料股份有限公司 ,南京圣诺生物科技实业有限公司 ,2021-04-09,,,,,,,合格,国内监督抽查(江苏市场监管局),2021-04-09,/
食品伙伴网,,粉末食品用鸡肉香精,食品添加剂-->食品添加剂,潍坊市美源食品配料有限公司 ,潍坊市美源食品配料有限公司 ,2021-04-07,,,,,,,合格,国内监督抽查(山东市场监管局),2021-04-07,
食品伙伴网,,碳酸钠(食品添加剂),食品添加剂-->食品添加剂,河南博欣调味品有限公司（分装） ,张店商家明珠百货商店 ,2021-04-07,,,,,,,合格,国内监督抽查(山东市场监管局),2021-04-07,
食品伙伴网,,食品添加剂 复配酸度调节剂,食品添加剂-->食品添加剂,青州市恒宇食品厂 ,高青县广青路圆源缘超市 ,2021-04-07,,,,,,,合格,国内监督抽查(山东市场监管局),2021-04-07,
食品伙伴网,,鸡骨髓香膏,食品添加剂-->食品添加剂,青岛一海香食品配料有限公司 ,青岛市城阳区盛大洋食品添加剂商店 ,2021-04-07,,,,,,,合格,国内监督抽查(山东市场监管局),2021-04-07,
食品伙伴网,,大卫吉利丁明胶片,食品添加剂-->食品添加剂,青海益洁生物工程有限公司 ,潍坊瑞吉食品有限公司 ,2021-04-07,,,,,,,合格,国内监督抽查(山东市场监管局),2021-04-07,
食品伙伴网,,食用碱面（复配酸度调节乳化剂）,食品添加剂-->食品添加剂,青岛建航味精有限公司 ,青岛胶州北方国贸商业发展有限公司 ,2021-04-07,,,,,,,合格,国内监督抽查(山东市场监管局),2021-04-07,
食品伙伴网,,食品添加剂 复配酸度调节剂,食品添加剂-->食品添加剂,济南宝硕食品科技有限公司 ,平度市永盛佳超市二店 ,2021-04-07,,,,,,,合格,国内监督抽查(山东市场监管局),2021-04-07,
食品伙伴网,,馒头改良剂,食品添加剂-->食品添加剂,安琪酵母股份有限公司 ,上海盒马网络科技有限公司青岛第三分公司 ,2021-04-07,,,,,,,合格,国内监督抽查(山东市场监管局),2021-04-07,
食品伙伴网,,香兰素香精,食品添加剂-->食品添加剂,江苏新星食品添加剂有限公司 ,日照市东港区华宇食品添加剂经营部 ,2021-04-07,,,,,,,合格,国内监督抽查(山东市场监管局),2021-04-07,
食品伙伴网,,复配膨松乳化消泡剂,食品添加剂-->食品添加剂,枣庄市坛丰食品添加剂有限公司 ,曹县信誉食品添加剂销售店 ,2021-04-07,,,,,,,合格,国内监督抽查(山东市场监管局),2021-04-07,
食品伙伴网,,食品添加剂丙酸钠,食品添加剂-->食品添加剂,青岛九泰生物科技有限公司 ,南京益生源生物科技有限公司 ,2021-04-09,,,标签-食品添加剂,,标签中未标注成分或配料表且未提供说明书,符合GB 29924规定要求,不合格,国内监督抽查(江苏市场监管局),2021-04-09,网抽平台名称：杭州阿里巴巴广告有限公司；网点网址：https://njysy666666.1688.com/page/creditdetail.htm?spm=a2615.2177701.autotrace-sellerinfo.4.2afd60efB4bZZ8
食品伙伴网,,食品添加剂  脱氢乙酸钠,食品添加剂-->食品添加剂,南通奥凯生物技术开发有限公司 ,南京西丽食品有限公司 ,2021-04-09,,,,,,,合格,国内监督抽查(江苏市场监管局),2021-04-09,/
食品伙伴网,,红曲红 TR型,食品添加剂-->食品添加剂,广东天益生物科技有限公司 ,江苏淮安双汇食品有限公司 ,2021-04-09,,,,,,,合格,国内监督抽查(江苏市场监管局),2021-04-09,/
食品伙伴网,,食品添加剂 碳酸氢钠（小苏打）,食品添加剂-->食品添加剂,桐柏博源新型化工有限公司 ,通用磨坊食品（南京）有限公司 ,2021-04-09,,,,,,,合格,国内监督抽查(江苏市场监管局),2021-04-09,/
食品伙伴网,,食品添加剂 脱氢乙酸钠,食品添加剂-->食品添加剂,南通奥凯生物技术开发有限公司 ,江苏凯德亚食品有限公司 ,2021-04-09,,,,,,,合格,国内监督抽查(江苏市场监管局),2021-04-09,/
食品伙伴网,,山梨糖醇液（食品添加剂）,食品添加剂-->食品添加剂,诸城东晓生物科技有限公司 ,江苏凯德亚食品有限公司 ,2021-04-09,,,,,,,合格,国内监督抽查(江苏市场监管局),2021-04-09,/
食品伙伴网,,冻顶乌龙茶味香精,食品添加剂-->食品添加剂,南昌馨朵美生物科技有限公司 ,南昌馨朵美生物科技有限公司 ,2021-04-19,,,,,,,合格,国内监督抽查(江西市场监管局),2021-04-19,
食品伙伴网,,能量味香精,食品添加剂-->食品添加剂,南昌馨朵美生物科技有限公司 ,南昌馨朵美生物科技有限公司 ,2021-04-19,,,,,,,合格,国内监督抽查(江西市场监管局),2021-04-19,
食品伙伴网,,复配膨松剂食品添加剂泡打粉,食品添加剂-->食品添加剂,天津市鸿禄食品有限公司 ,南昌市天虹商场有限公司朝阳洲天虹购物中心 ,2021-04-19,,,,,,,合格,国内监督抽查(江西市场监管局),2021-04-19,
食品伙伴网,,无铝害双效泡打粉复配膨松剂,食品添加剂-->食品添加剂,安琪酵母股份有限公司 ,南昌市天虹商场有限公司朝阳洲天虹购物中心 ,2021-04-19,,,,,,,合格,国内监督抽查(江西市场监管局),2021-04-19,
食品伙伴网,,食品添加剂明胶,食品添加剂-->食品添加剂,江西福美泰生物技术有限公司 ,江西福美泰生物技术有限公司 ,2021-04-19,,,,,,,合格,国内监督抽查(江西市场监管局),2021-04-19,
食品伙伴网,,蒜油香精,食品添加剂-->食品添加剂,江西昌华轩食品科技有限公司 ,江西昌华轩食品科技有限公司 ,2021-04-19,,,,,,,合格,国内监督抽查(江西市场监管局),2021-04-19,
食品伙伴网,,SDS711苹果香精,食品添加剂-->食品添加剂,江西省华宝孔雀食品科技发展有限公司 ,江西省华宝孔雀食品科技发展有限公司 ,2021-04-19,,,,,,,合格,国内监督抽查(江西市场监管局),2021-04-19,
食品伙伴网,,24029蜂蜜香精,食品添加剂-->食品添加剂,江西省华宝孔雀食品科技发展有限公司 ,江西省华宝孔雀食品科技发展有限公司 ,2021-04-19,,,,,,,合格,国内监督抽查(江西市场监管局),2021-04-19,
食品伙伴网,,复配甜味剂,食品添加剂-->食品添加剂,江西穗洪生物科技有限公司 ,江西穗洪生物科技有限公司 ,2021-04-19,,,,,,,合格,国内监督抽查(江西市场监管局),2021-04-19,
食品伙伴网,,飘香鸡肉精油（食品用香精）,食品添加剂-->食品添加剂,江西味元食品有限公司 ,江西味元食品有限公司 ,2021-04-19,,,,,,,合格,国内监督抽查(江西市场监管局),2021-04-19,
食品伙伴网,,酸奶味香精,食品添加剂-->食品添加剂,南昌馨朵美生物科技有限公司 ,南昌馨朵美生物科技有限公司 ,2021-04-19,,,,,,,合格,国内监督抽查(江西市场监管局),2021-04-19,
食品伙伴网,,乳酸奶味香精,食品添加剂-->食品添加剂,南昌馨朵美生物科技有限公司 ,南昌馨朵美生物科技有限公司 ,2021-04-19,,,,,,,合格,国内监督抽查(江西市场监管局),2021-04-19,
食品伙伴网,,复配乳化增稠剂配方十,食品添加剂-->食品添加剂,南昌泰康食品科技有限公司 ,南昌泰康食品科技有限公司 ,2021-04-19,,,,,,,合格,国内监督抽查(江西市场监管局),2021-04-19,
食品伙伴网,,复配乳化增稠剂配方八,食品添加剂-->食品添加剂,南昌泰康食品科技有限公司 ,南昌泰康食品科技有限公司 ,2021-04-19,,,,,,,合格,国内监督抽查(江西市场监管局),2021-04-19,
食品伙伴网,,复配增稠剂Ⅰ（果酸奶专用型）,食品添加剂-->食品添加剂,南昌市新华食品科技研究所 ,南昌市新华食品科技研究所 ,2021-04-19,,,,,,,合格,国内监督抽查(江西市场监管局),2021-04-19,
食品伙伴网,,复配抗氧化剂Ⅰ（抗晒护色型）,食品添加剂-->食品添加剂,南昌市新华食品科技研究所 ,南昌市新华食品科技研究所 ,2021-04-19,,,,,,,合格,国内监督抽查(江西市场监管局),2021-04-19,
食品伙伴网,,活性白土（食品添加剂）,食品添加剂-->食品添加剂,乐平市元昶膨润土有限公司 ,乐平市元昶膨润土有限公司 ,2021-04-19,,,砷(As),,＞3mg/kg,3mg/kg,不合格,国内监督抽查(江西市场监管局),2021-04-19,
食品伙伴网,,菲律宾芒果味香精,食品添加剂-->食品添加剂,南昌馨朵美生物科技有限公司 ,南昌馨朵美生物科技有限公司 ,2021-04-19,,,,,,,合格,国内监督抽查(江西市场监管局),2021-04-19,
食品伙伴网,,复配甜味剂,食品添加剂-->食品添加剂,上饶市食品工业研究所 ,上饶市食品工业研究所 ,2021-04-19,,,,,,,合格,国内监督抽查(江西市场监管局),2021-04-19,
食品伙伴网,,复配乳化稳定剂（配方一）,食品添加剂-->食品添加剂,江西食芬好生物科技有限公司 ,江西食芬好生物科技有限公司 ,2021-04-19,,,,,,,合格,国内监督抽查(江西市场监管局),2021-04-19,
食品伙伴网,,复配乳化稳定剂（配方一）,食品添加剂-->食品添加剂,江西食芬好生物科技有限公司 ,江西食芬好生物科技有限公司 ,2021-04-19,,,,,,,合格,国内监督抽查(江西市场监管局),2021-04-19,
食品伙伴网,,复配乳化稳定剂（配方一）,食品添加剂-->食品添加剂,江西食芬好生物科技有限公司 ,江西食芬好生物科技有限公司 ,2021-04-19,,,,,,,合格,国内监督抽查(江西市场监管局),2021-04-19,
食品伙伴网,,安赛蜜,食品添加剂-->食品添加剂,安徽金禾实业股份有限公司 ,江苏金生缘食品科技有限公司 ,2021-04-09,,,,,,,合格,国内监督抽查(江苏市场监管局),2021-04-09,/
食品伙伴网,,柠檬酸钠,食品添加剂-->食品添加剂,潍坊英轩实业有限公司 ,江苏金生缘食品科技有限公司 ,2021-04-09,,,,,,,合格,国内监督抽查(江苏市场监管局),2021-04-09,/
食品伙伴网,,一水柠檬酸,食品添加剂-->食品添加剂,潍坊英轩实业有限公司 ,江苏金生缘食品科技有限公司 ,2021-04-09,,,,,,,合格,国内监督抽查(江苏市场监管局),2021-04-09,/
食品伙伴网,,食品添加剂 碳酸钙（重质）,食品添加剂-->食品添加剂,郑州瑞普生物工程有限公司 ,南京福旺食品有限公司 ,2021-04-09,,,,,,,合格,国内监督抽查(江苏市场监管局),2021-04-09,/
食品伙伴网,,食用小苏打（食品添加剂 碳酸氢钠）,食品添加剂-->食品添加剂,山东凯龙化工科技发展有限公司 ,盱眙佳乐乳业食品有限公司 ,2021-04-09,,,,,,,合格,国内监督抽查(江苏市场监管局),2021-04-09,/
食品伙伴网,,食品添加剂  植物炭黑,食品添加剂-->食品添加剂,上海染料研究所有限公司 ,南京圣诺生物科技实业有限公司 ,2021-04-09,,,,,,,合格,国内监督抽查(江苏市场监管局),2021-04-09,/
食品伙伴网,,食品添加剂  5’-呈味核苷酸二钠（又名呈味核苷酸二钠）,食品添加剂-->食品添加剂,希杰（聊城）生物科技有限公司 ,南京华味食品有限公司 ,2021-04-09,,,,,,,合格,国内监督抽查(江苏市场监管局),2021-04-09,/
食品伙伴网,,抗结剂  食品添加剂 二氧化硅,食品添加剂-->食品添加剂,天津龙华诚信粉体技术有限公司 ,南京华味食品有限公司 ,2021-04-09,,,,,,,合格,国内监督抽查(江苏市场监管局),2021-04-09,/
食品伙伴网,,食品添加剂 柠檬酸钙,食品添加剂-->食品添加剂,如皋市江北添加剂有限公司 ,如皋市江北添加剂有限公司 ,2021-04-09,,,,,,,合格,国内监督抽查(江苏市场监管局),2021-04-09,/
食品伙伴网,,食品添加剂 丙酸钙,食品添加剂-->食品添加剂,如皋市江北添加剂有限公司 ,如皋市江北添加剂有限公司 ,2021-04-09,,,,,,,合格,国内监督抽查(江苏市场监管局),2021-04-09,/
食品伙伴网,,食品添加剂复配着色剂,食品添加剂-->食品添加剂,山东凯贝食品有限公司 ,济宁市腾飞食品添加剂有限责任公司 ,2021-05-11,,,,,,,合格,国内监督抽查(山东市场监管局),2021-05-11,
食品伙伴网,,复配酶制剂抗氧化剂,食品添加剂-->食品添加剂,山东五丰生物科技有限公司 ,平原县恒新食品添加剂门市部 ,2021-05-11,,,,,,,合格,国内监督抽查(山东市场监管局),2021-05-11,
食品伙伴网,,复配水分保持剂,食品添加剂-->食品添加剂,济南天仙食品添加剂销售有限公司 ,平原县东盛食品餐饮配料商行 ,2021-05-11,,,,,,,合格,国内监督抽查(山东市场监管局),2021-05-11,
食品伙伴网,,复配食品添加剂,食品添加剂-->食品添加剂,淄博云龙明胶有限公司 ,兰陵县杜天娇商行 ,2021-05-11,,,,,,,合格,国内监督抽查(山东市场监管局),2021-05-11,
食品伙伴网,,食品添加剂复配酸度调节剂,食品添加剂-->食品添加剂,济南宝硕食品科技有限公司 ,昌邑市新村街敬文超市 ,2021-05-11,,,,,,,合格,国内监督抽查(山东市场监管局),2021-05-11,
食品伙伴网,,食品添加剂复配酸度调节剂,食品添加剂-->食品添加剂,济南宝硕食品科技有限公司 ,嘉祥澳琦超市有限公司 ,2021-05-11,,,,,,,合格,国内监督抽查(山东市场监管局),2021-05-11,
食品伙伴网,,复配酸度调节剂（食用纯碱）,食品添加剂-->食品添加剂,青岛灵鸟食品有限公司 ,市中区鑫场百货商店 ,2021-05-11,,,,,,,合格,国内监督抽查(山东市场监管局),2021-05-11,
食品伙伴网,,食品添加剂食品用香精,食品添加剂-->食品添加剂,日照市大厨三宝餐饮配料有限公司 ,潍坊顺天喜食品科技有限公司 ,2021-05-11,,,,,,,合格,国内监督抽查(山东市场监管局),2021-05-11,
食品伙伴网,,青花椒鸡膏,食品添加剂-->食品添加剂,青岛香巴尔食品配料有限公司 ,市中区宏发燕鲍翅行 ,2021-05-11,,,,,,,合格,国内监督抽查(山东市场监管局),2021-05-11,
食品伙伴网,,食用碱面（复配酸度调节乳化剂）,食品添加剂-->食品添加剂,青岛建航味精有限公司 ,济南天桥大润发商业有限公司 ,2021-05-11,,,,,,,合格,国内监督抽查(山东市场监管局),2021-05-11,
食品伙伴网,,食品添加剂复配酸度调节剂食用小苏打,食品添加剂-->食品添加剂,济南宝硕食品科技有限公司 ,奎文区梨园古月生活超市 ,2021-05-11,,,,,,,合格,国内监督抽查(山东市场监管局),2021-05-11,
食品伙伴网,,聚二甲基硅氧烷乳液TC-028,食品添加剂-->食品添加剂,上海润其新材料科技有限公司 ,苏州上好佳食品有限公司 ,2021-04-09,,,,,,,合格,国内监督抽查(江苏市场监管局),2021-04-09,/
食品伙伴网,,食品添加剂 双乙酸钠,食品添加剂-->食品添加剂,连云港市通源生物科技有限公司 ,连云港市通源生物科技有限公司 ,2021-04-09,,,,,,,合格,国内监督抽查(江苏市场监管局),2021-04-09,/
食品伙伴网,,食品添加剂 氮气,食品添加剂-->食品添加剂,常熟鲁花食用油有限公司 ,常熟鲁花食用油有限公司 ,2021-04-09,,,,,,,合格,国内监督抽查(江苏市场监管局),2021-04-09,/
食品伙伴网,,食品添加剂 茶多酚,食品添加剂-->食品添加剂,江苏德和生物科技有限公司 ,江苏德和生物科技有限公司 ,2021-04-09,,,,,,,合格,国内监督抽查(江苏市场监管局),2021-04-09,/
食品伙伴网,,食品添加剂 二氧化硅,食品添加剂-->食品添加剂,扬中格拉斯白炭黑化工有限公司 ,扬中格拉斯白炭黑化工有限公司 ,2021-04-09,,,,,,,合格,国内监督抽查(江苏市场监管局),2021-04-09,/
食品伙伴网,,色得宝复配漂白剂,食品添加剂-->食品添加剂,天津市科顿生物科技有限公司 ,南京松冠生物科技有限公司 ,2021-05-28,,,,,,,合格,国内监督抽查(江苏市场监管局),2021-05-28,/
食品伙伴网,,鲜师傅复配漂白剂,食品添加剂-->食品添加剂,天津市科顿生物科技有限公司 ,南京松冠生物科技有限公司 ,2021-05-28,,,,,,,合格,国内监督抽查(江苏市场监管局),2021-05-28,/
食品伙伴网,,曲酒香精,食品添加剂-->食品添加剂,阳江市白云香化有限公司 ,徐州亿添佳生物科技有限公司 ,2021-05-28,,,,,,,合格,国内监督抽查(江苏市场监管局),2021-05-28,/
食品伙伴网,,鲜奶粉末香精,食品添加剂-->食品添加剂,阳江市阳东区中大食品配料有限公司 ,徐州亿添佳生物科技有限公司 ,2021-05-28,,,,,,,合格,国内监督抽查(江苏市场监管局),2021-05-28,/
食品伙伴网,,香兰素香精,食品添加剂-->食品添加剂,阳江市阳东区中大食品配料有限公司 ,徐州亿添佳生物科技有限公司 ,2021-05-28,,,,,,,合格,国内监督抽查(江苏市场监管局),2021-05-28,/
食品伙伴网,,香兰素香精,食品添加剂-->食品添加剂,江苏新星食品添加剂有限公司 ,徐州亿添佳生物科技有限公司 ,2021-05-28,,,,,,,合格,国内监督抽查(江苏市场监管局),2021-05-28,/
食品伙伴网,,猪肉香精,食品添加剂-->食品添加剂,青岛瑞香源食品有限公司 ,徐州亿添佳生物科技有限公司 ,2021-05-28,,,,,,,合格,国内监督抽查(江苏市场监管局),2021-05-28,/
食品伙伴网,,草莓粉末香精,食品添加剂-->食品添加剂,深圳市晨馨香精香料有限公司 ,江苏穆瑞生物科技有限公司 ,2021-05-28,,,,,,,合格,国内监督抽查(江苏市场监管局),2021-05-28,/
食品伙伴网,,复配抗氧化剂,食品添加剂-->食品添加剂,江西新欣食品发展有限公司 ,江苏穆瑞生物科技有限公司 ,2021-05-28,,,,,,,合格,国内监督抽查(江苏市场监管局),2021-05-28,/
食品伙伴网,,芝士粉末香精,食品添加剂-->食品添加剂,深圳市晨馨香精香料有限公司 ,江苏新百利生物工程有限公司 ,2021-05-28,,,,,,,合格,国内监督抽查(江苏市场监管局),2021-05-28,/
食品伙伴网,,什锦水果粉末香精,食品添加剂-->食品添加剂,深圳市晨馨香精香料有限公司 ,江苏新百利生物工程有限公司 ,2021-05-28,,,,,,,合格,国内监督抽查(江苏市场监管局),2021-05-28,/
食品伙伴网,,复配增稠剂食品添加剂,食品添加剂-->食品添加剂,滕州市香凝生物工程有限责任公司 ,江苏新百利生物工程有限公司 ,2021-05-28,,,,,,,合格,国内监督抽查(江苏市场监管局),2021-05-28,/
食品伙伴网,,焦磷酸钠,食品添加剂-->食品添加剂,湖北兴发化工集团股份有限公司 ,江苏燕科生物工程有限公司 ,2021-05-28,,,,,,,合格,国内监督抽查(江苏市场监管局),2021-05-28,/
食品伙伴网,,食品添加剂焦糖色,食品添加剂-->食品添加剂,河南新乡科兴添加剂有限责任公司 ,南京鑫越源生物科技有限公司 ,2021-05-28,,,,,,,合格,国内监督抽查(江苏市场监管局),2021-05-28,/
食品伙伴网,,食品添加剂桂花粉末香精,食品添加剂-->食品添加剂,深圳市晨馨香精香料有限公司 ,江苏新百利生物工程有限公司 ,2021-05-28,,,,,,,合格,国内监督抽查(江苏市场监管局),2021-05-28,/
食品伙伴网,,食品添加剂木瓜蛋白酶,食品添加剂-->食品添加剂,南宁庞博生物工程有限公司 ,江苏新百利生物工程有限公司 ,2021-05-28,,,,,,,合格,国内监督抽查(江苏市场监管局),2021-05-28,/
食品伙伴网,,复配乳化增稠剂,食品添加剂-->食品添加剂,河南添天美食品有限公司 ,江苏普新生物科技有限公司 ,2021-05-28,,,,,,,合格,国内监督抽查(江苏市场监管局),2021-05-28,/
食品伙伴网,,真菌α-淀粉酶FA-10000/FA-10001,食品添加剂-->食品添加剂,东莞泛亚太生物科技有限公司 ,江苏海福食品有限公司 ,2021-05-28,,,,,,,合格,国内监督抽查(江苏市场监管局),2021-05-28,/
食品伙伴网,,脂肪酶,食品添加剂-->食品添加剂,江苏一鸣生物股份有限公司 ,江苏海福食品有限公司 ,2021-05-28,,,,,,,合格,国内监督抽查(江苏市场监管局),2021-05-28,/
食品伙伴网,,食品添加剂焦亚硫酸钠,食品添加剂-->食品添加剂,上海嘉定马陆化工厂有限公司 ,南京龙力佳农业发展有限公司 ,2021-05-28,,,,,,,合格,国内监督抽查(江苏市场监管局),2021-05-28,/
食品伙伴网,,双斧牌食粉,食品添加剂-->食品添加剂,佛山市禾夫食品有限公司 ,香格里拉大酒店（南京）有限公司 ,2021-05-28,,,,,,,合格,国内监督抽查(江苏市场监管局),2021-05-28,/
食品伙伴网,,食品添加剂明胶片（又名吉利丁片）,食品添加剂-->食品添加剂,青海益洁生物工程有限公司 ,香格里拉大酒店（南京）有限公司 ,2021-05-28,,,,,,,合格,国内监督抽查(江苏市场监管局),2021-05-28,/
食品伙伴网,,食品添加剂豆腐王,食品添加剂-->食品添加剂,安徽省兴宙医药食品有限公司 ,润州区胡可食品经营部 ,2021-05-28,,,,,,,合格,国内监督抽查(江苏市场监管局),2021-05-28,/
食品伙伴网,,复配膨松剂（双效泡打粉）,食品添加剂-->食品添加剂,桂林市红星化工有限责任公司 ,润州区胡可食品经营部 ,2021-05-28,,,,,,,合格,国内监督抽查(江苏市场监管局),2021-05-28,/
食品伙伴网,,食品添加剂明胶,食品添加剂-->食品添加剂,威海银河生物技术有限公司 ,镇江市宏友肴庄肉制品加工有限公司 ,2021-05-28,,,,,,,合格,国内监督抽查(江苏市场监管局),2021-05-28,/
食品伙伴网,,柠檬酸钠（食品添加剂）,食品添加剂-->食品添加剂,潍坊英轩实业有限公司制造 ,健力宝（镇江）饮料有限公司 ,2021-05-28,,,,,,,合格,国内监督抽查(江苏市场监管局),2021-05-28,/
食品伙伴网,,食品添加剂明胶,食品添加剂-->食品添加剂,河南博洋生物科技有限公司 ,镇江宴春酒楼有限公司食品分公司 ,2021-05-28,,,,,,,合格,国内监督抽查(江苏市场监管局),2021-05-28,/
食品伙伴网,,复配稳定剂护色宝,食品添加剂-->食品添加剂,广州市安心生物制品有限公司 ,江苏杰诺食品配料有限公司 ,2021-05-28,,,,,,,合格,国内监督抽查(江苏市场监管局),2021-05-28,/
食品伙伴网,,桂花粉末香精,食品添加剂-->食品添加剂,深圳市晨馨香精香料有限公司 ,江苏佰业生物科技有限公司 ,2021-05-28,,,,,,,合格,国内监督抽查(江苏市场监管局),2021-05-28,/
食品伙伴网,,牛奶粉末香精,食品添加剂-->食品添加剂,深圳市晨馨香精香料有限公司 ,江苏佰业生物科技有限公司 ,2021-05-28,,,,,,,合格,国内监督抽查(江苏市场监管局),2021-05-28,/
食品伙伴网,,红枣粉末香精,食品添加剂-->食品添加剂,深圳市晨馨香精香料有限公司 ,江苏佰业生物科技有限公司 ,2021-05-28,,,,,,,合格,国内监督抽查(江苏市场监管局),2021-05-28,/
