信息来源,搜索条件,物料名称,产品分类,生产商,供应商,生产日期,批号,项目分类,检测项目,单位,检测结果,限量值,判定,发布单位,发布日期,备注
食品伙伴网,,复配甜味剂DZM-100（原蛋白糖）,食品添加剂-->食品添加剂,郑州大昌甜味剂有限公司 ,海州区洪门社区亿人食品添加剂批发部 ,2022-04-12,,,,,,,合格,国内监督抽查(江苏市场监管局),2022-04-12,
食品伙伴网,,复配增稠剂,食品添加剂-->食品添加剂,滕州市香凝生物工程有限责任公司 ,涟水维哲商店 ,2022-04-12,,,,,,,合格,国内监督抽查(江苏市场监管局),2022-04-12,
食品伙伴网,,复配水分保持剂02（幸福牌嫩肉粉）,食品添加剂-->食品添加剂,烟台通世食品添加剂有限公司 ,涟水维哲商店 ,2022-04-12,,,,,,,合格,国内监督抽查(江苏市场监管局),2022-04-12,
食品伙伴网,,面包•压面专用改良剂,食品添加剂-->食品添加剂,广州点榜食品有限公司 ,涟水维哲商店 ,2022-04-12,,,,,,,合格,国内监督抽查(江苏市场监管局),2022-04-12,
食品伙伴网,,复配消泡剂（食品添加剂）,食品添加剂-->食品添加剂,南京金钥匙生物科技有限公司 ,涟水维哲商店 ,2022-04-12,,,,,,,合格,国内监督抽查(江苏市场监管局),2022-04-12,
食品伙伴网,,猪肉香精（拌和型粉末）,食品添加剂-->食品添加剂,青岛瑞香源食品有限公司 ,涟水维哲商店 ,2022-04-12,,,,,,,合格,国内监督抽查(江苏市场监管局),2022-04-12,
食品伙伴网,,复配着色剂(大红色),食品添加剂-->食品添加剂,广东添之彩食用色素科技有限公司 ,镇江凯越食品商贸有限公司 ,2022-04-12,,,,,,,合格,国内监督抽查(江苏市场监管局),2022-04-12,
食品伙伴网,,复配着色剂(橙黄色),食品添加剂-->食品添加剂,广东添之彩食用色素科技有限公司 ,镇江凯越食品商贸有限公司 ,2022-04-12,,,,,,,合格,国内监督抽查(江苏市场监管局),2022-04-12,
食品伙伴网,,JX-乙基增香剂,食品添加剂-->食品添加剂,青岛瑞可莱食品配料有限公司 ,镇江凯越食品商贸有限公司 ,2022-04-12,,,,,,,合格,国内监督抽查(江苏市场监管局),2022-04-12,
食品伙伴网,,复配消泡剂,食品添加剂-->食品添加剂,丹阳市皇塘镇卓华食品机械制造厂 ,丹阳市开发区顺意调味品批发商行 ,2022-04-12,,,,,,,合格,国内监督抽查(江苏市场监管局),2022-04-12,
食品伙伴网,,食品添加剂（着色剂）,食品添加剂-->食品添加剂,普宁市烹源食品有限公司 ,丹阳市开发区顺意调味品批发商行 ,2022-04-12,,,,,,,合格,国内监督抽查(江苏市场监管局),2022-04-12,
食品伙伴网,,超浓缩鲜香粉［食品用香精］,食品添加剂-->食品添加剂,青岛香巴尔食品配料有限公司 ,高新区浒关分区王友荣南北货经营部 ,2022-04-12,,,,,,,合格,国内监督抽查(江苏市场监管局),2022-04-12,
食品伙伴网,,甜味香精甜味剂蛋白糖（香精）,食品添加剂-->食品添加剂,松田生物科技（江苏）有限公司 ,高新区浒关分区王友荣南北货经营部 ,2022-04-12,,,,,,,合格,国内监督抽查(江苏市场监管局),2022-04-12,
食品伙伴网,,消泡王超浓缩精品复配食品添加剂豆制品专用消泡剂,食品添加剂-->食品添加剂,常州市三蜂食品添加剂有限公司 ,高新区浒关分区茂铭南北货经营部 ,2022-04-12,,,,,,,合格,国内监督抽查(江苏市场监管局),2022-04-12,
食品伙伴网,,复配酸度调节剂（食品添加剂）,食品添加剂-->食品添加剂,昆山臻乐门食品有限公司第一分公司 ,苏州工业园区娄葑镇斜塘莲花超市 ,2022-04-12,,,,,,,合格,国内监督抽查(江苏市场监管局),2022-04-12,
食品伙伴网,,狮威牌吉士粉食品添加剂（复配着色剂）,食品添加剂-->食品添加剂,普宁市烹源食品有限公司 ,张家港市锦丰镇青草巷以琳南北货批发部 ,2022-04-12,,,,,,,合格,国内监督抽查(江苏市场监管局),2022-04-12,
食品伙伴网,,复配酸度调节剂（食用碱）,食品添加剂-->食品添加剂,安琪酵母（济宁）有限公司 ,山东九州商业集团有限公司连锁超市东关店 ,2022-04-21,,,,,,,合格,国内监督抽查(山东市场监管局),2022-04-21,
食品伙伴网,,复配面粉处理剂馒头粉（复配食品添加剂）,食品添加剂-->食品添加剂,山东四和生物科技有限公司 ,山东四和生物科技有限公司 ,2022-04-21,,,,,,,合格,国内监督抽查(山东市场监管局),2022-04-21,
食品伙伴网,,食用碱,食品添加剂-->食品添加剂,青岛建航味精有限公司 ,临沂家家悦超市有限公司罗庄武校店 ,2022-04-21,,,,,,,合格,国内监督抽查(山东市场监管局),2022-04-21,
食品伙伴网,,骨汤,食品添加剂-->食品添加剂,江西味元食品有限公司 ,漳州市芗城区诚泓食品添加剂商行 ,2022-04-22,,,菌落总数,,2.9×10⁵CFU/g,30000CFU/g,不合格,国内监督抽查(福建市场监管局),2022-04-22,
食品伙伴网,,复配水分保持剂-品质向上胶K-777（粘性）,食品添加剂-->食品添加剂,厦门市顶芳食品有限公司 ,厦门市湖里区味门调味品店 ,2022-04-22,,,,,,,合格,国内监督抽查(福建市场监管局),2022-04-22,
食品伙伴网,,复配水分保持剂-品质向上胶K-666（脆性）,食品添加剂-->食品添加剂,厦门市顶芳食品有限公司 ,厦门市湖里区味门调味品店 ,2022-04-22,,,,,,,合格,国内监督抽查(福建市场监管局),2022-04-22,
食品伙伴网,,复配增稠剂品质向上胶B高效增筋剂,食品添加剂-->食品添加剂,厦门市顶芳食品有限公司 ,厦门市湖里区味门调味品店 ,2022-04-22,,,,,,,合格,国内监督抽查(福建市场监管局),2022-04-22,
食品伙伴网,,脱氢乙酸钠,食品添加剂-->食品添加剂,青岛大伟生物工程有限公司 ,厦门市湖里区味门调味品店 ,2022-04-22,,,,,,,合格,国内监督抽查(福建市场监管局),2022-04-22,
食品伙伴网,,山梨酸钾,食品添加剂-->食品添加剂,青岛大伟生物工程有限公司 ,厦门市湖里区味门调味品店 ,2022-04-22,,,,,,,合格,国内监督抽查(福建市场监管局),2022-04-22,
食品伙伴网,,天柱山梨酸钾,食品添加剂-->食品添加剂,南通醋酸化工股份有限公司 ,厦门市湖里区味门调味品店 ,2022-04-22,,,,,,,合格,国内监督抽查(福建市场监管局),2022-04-22,
食品伙伴网,,食用小苏打,食品添加剂-->食品添加剂,漳州岛久食品添加剂有限公司 ,龙岩夏商百货有限公司新罗中山西路分店 ,2022-04-22,,,,,,,合格,国内监督抽查(福建市场监管局),2022-04-22,
食品伙伴网,,"牛肉粉
末香精
（特供1号）",食品添加剂-->食品添加剂,湖南省溢味佳生物科技有限公司 ,湖南省溢味佳生物科技有限公司 ,2022-04-24,,,,,,,合格,国内监督抽查(湖南市场监管局),2022-04-24,
食品伙伴网,,鸡肉粉末香精,食品添加剂-->食品添加剂,湖南省溢味佳生物科技有限公司 ,"湖南省溢味佳
生物科技有限公司 ",2022-04-24,,,,,,,合格,国内监督抽查(湖南市场监管局),2022-04-24,
食品伙伴网,,"蒜香调
味粉1
＃",食品添加剂-->食品添加剂,湖南省天味食品配料有限公司 ,"湖南省天味食
品配料有限公司 ",2022-04-24,,,,,,,合格,国内监督抽查(湖南市场监管局),2022-04-24,
食品伙伴网,,豆干专用粉,食品添加剂-->食品添加剂,湖南省天味食品配料有限公司 ,"湖南省天味食
品配料有限公司 ",2022-04-24,,,,,,,合格,国内监督抽查(湖南市场监管局),2022-04-24,
食品伙伴网,,"奶味粉
末香精
（食品添加剂）",食品添加剂-->食品添加剂,湖南曼尼食品科技有限公司 ,湖南曼尼食品科技有限公司 ,2022-04-24,,,,,,,合格,国内监督抽查(湖南市场监管局),2022-04-24,
食品伙伴网,,复配酸度调节剂(食用纯碱),食品添加剂-->食品添加剂,青岛灵鸟食品有限公司 ,山东贵诚集团购物中心有限公司贵诚超市光明店 ,2022-04-19,,,,,,,合格,国内监督抽查(山东市场监管局),2022-04-19,
食品伙伴网,,肉香型乙基增香剂（拌和型粉末）,食品添加剂-->食品添加剂,青岛鑫润锋食品有限公司 ,龙口市东江長元食品原料店 ,2022-04-19,,,,,,,合格,国内监督抽查(山东市场监管局),2022-04-19,
食品伙伴网,,食用碱,食品添加剂-->食品添加剂,青岛建航味精有限公司 ,烟台福山区振华商厦有限公司福山购物广场店 ,2022-04-19,,,,,,,合格,国内监督抽查(山东市场监管局),2022-04-19,
食品伙伴网,,食品添加剂复配酸度调节剂,食品添加剂-->食品添加剂,青岛威利食品科技有限公司 ,海阳市道森超市 ,2022-04-19,,,,,,,合格,国内监督抽查(山东市场监管局),2022-04-19,
食品伙伴网,,豆脑王,食品添加剂-->食品添加剂,临沂银豆食品科技有限公司 ,巨野县宏通食品门市部 ,2022-04-19,,,,,,,合格,国内监督抽查(山东市场监管局),2022-04-19,
食品伙伴网,,香兰素香精,食品添加剂-->食品添加剂,江苏新星食品添加剂有限公司 ,文登利昌商行 ,2022-04-19,,,,,,,合格,国内监督抽查(山东市场监管局),2022-04-19,
食品伙伴网,,食用碱食品添加剂复配酸度调节乳化剂,食品添加剂-->食品添加剂,青岛建航味精有限公司 ,山东金都百货股份有限公司城东分公司 ,2022-04-19,,,,,,,合格,国内监督抽查(山东市场监管局),2022-04-19,
食品伙伴网,,小苏打,食品添加剂-->食品添加剂,青岛建航味精有限公司 ,烟台市家家悦超市有限公司牟平天隆店 ,2022-04-19,,,,,,,合格,国内监督抽查(山东市场监管局),2022-04-19,
食品伙伴网,,食品用香精,食品添加剂-->食品添加剂,日照市大厨三宝餐饮配料有限公司 ,蓬莱市紫荆山街道顺唯调味品批发商店 ,2022-04-19,,,,,,,合格,国内监督抽查(山东市场监管局),2022-04-19,
食品伙伴网,,食品用香精,食品添加剂-->食品添加剂,日照市大厨三宝餐饮配料有限公司 ,蓬莱市紫荆山街道顺唯调味品批发商店 ,2022-04-19,,,,,,,合格,国内监督抽查(山东市场监管局),2022-04-19,
食品伙伴网,,新意牛奶香粉（牛奶粉末香精）,食品添加剂-->食品添加剂,上海昕宜食品辅料有限公司 ,日照市东港区华宇食品添加剂经营部 ,2022-04-19,,,,,,,合格,国内监督抽查(山东市场监管局),2022-04-19,
食品伙伴网,,复配酸度调节剂（食用纯碱）,食品添加剂-->食品添加剂,青岛灵鸟食品有限公司 ,临沂九州东诚商业管理有限公司连锁超市慧谷领御店 ,2022-04-21,,,,,,,合格,国内监督抽查(山东市场监管局),2022-04-21,
食品伙伴网,,食品添加剂复配酸度调节剂,食品添加剂-->食品添加剂,济南宝硕食品科技有限公司 ,肥城市武记干货批发中心 ,2022-04-21,,,,,,,合格,国内监督抽查(山东市场监管局),2022-04-21,
食品伙伴网,,复配酸度调节剂（食用纯碱）,食品添加剂-->食品添加剂,青岛灵鸟食品有限公司 ,莒南县乐尚超市有限公司洙边店 ,2022-04-21,,,,,,,合格,国内监督抽查(山东市场监管局),2022-04-21,
食品伙伴网,,小苏打,食品添加剂-->食品添加剂,青岛建航味精有限公司 ,临沂家家悦超市有限公司华强领秀城店 ,2022-04-21,,,,,,,合格,国内监督抽查(山东市场监管局),2022-04-21,
食品伙伴网,,一滴香食品用香精,食品添加剂-->食品添加剂,青岛瑞潽旺食品配料有限公司 ,临沂商场丽燕食品添加剂商行 ,2022-04-21,,,,,,,合格,国内监督抽查(山东市场监管局),2022-04-21,
食品伙伴网,,入骨鸭香膏（食品用香精）,食品添加剂-->食品添加剂,平度市高泰克食品配料厂 ,滕州市嘉誉亿冠源食品添加剂批发部 ,2022-04-19,,,,,,,合格,国内监督抽查(山东市场监管局),2022-04-19,
食品伙伴网,,乙基增香剂（拌合型粉末）,食品添加剂-->食品添加剂,青岛瑞香源食品有限公司 ,滨州市沾化区腾达食品添加剂商店 ,2022-04-19,,,,,,,合格,国内监督抽查(山东市场监管局),2022-04-19,
食品伙伴网,,爆烤鸭香膏(食品用香精),食品添加剂-->食品添加剂,青岛润生源食品配料有限公司 ,张店金晶大道海盛水产市场乾坤干调经营部 ,2022-04-19,,,,,,,合格,国内监督抽查(山东市场监管局),2022-04-19,
食品伙伴网,,浓缩鲜香粉,食品添加剂-->食品添加剂,青岛六禾谷食品配料有限公司 ,菏泽市定陶区徐镇食品部 ,2022-04-19,,,,,,,合格,国内监督抽查(山东市场监管局),2022-04-19,
食品伙伴网,,猪肉味香精,食品添加剂-->食品添加剂,青岛千泉食品配料有限公司 ,菏泽市定陶区徐镇食品部 ,2022-04-19,,,,,,,合格,国内监督抽查(山东市场监管局),2022-04-19,
食品伙伴网,,复配着色剂柠檬黄,食品添加剂-->食品添加剂,广东添之彩食用色素科技有限公司 ,巨野县宏通食品门市部 ,2022-04-19,,,,,,,合格,国内监督抽查(山东市场监管局),2022-04-19,
食品伙伴网,,豆腐王内酯,食品添加剂-->食品添加剂,临沂银豆食品科技有限公司 ,巨野县宏通食品门市部 ,2022-04-19,,,,,,,合格,国内监督抽查(山东市场监管局),2022-04-19,
食品伙伴网,,复配发酵面制品面粉处理剂,食品添加剂-->食品添加剂,郑州海韦力食品工业有限公司 ,曲阜市文博食品调味品 ,2022-04-19,,,,,,,合格,国内监督抽查(山东市场监管局),2022-04-19,
食品伙伴网,,特醇乙基增香剂（搅拌型粉末）,食品添加剂-->食品添加剂,青岛鑫润锋食品有限公司 ,曲阜市美味食品添加剂销售中心 ,2022-04-19,,,,,,,合格,国内监督抽查(山东市场监管局),2022-04-19,
食品伙伴网,,复配膨松乳化剂,食品添加剂-->食品添加剂,山东五丰生物科技有限公司 ,曲阜市文博食品调味品 ,2022-04-19,,,,,,,合格,国内监督抽查(山东市场监管局),2022-04-19,
食品伙伴网,,人合复配甜味剂（复配食品添加剂）,食品添加剂-->食品添加剂,济南人合食品科技有限公司天桥分公司 ,曲阜市文博食品调味品 ,2022-04-19,,,,,,,合格,国内监督抽查(山东市场监管局),2022-04-19,
食品伙伴网,,S5001香蕉油香精,食品添加剂-->食品添加剂,泰州盛康生物科技有限公司 ,曲阜市美味食品添加剂销售中心 ,2022-04-19,,,,,,,合格,国内监督抽查(山东市场监管局),2022-04-19,
食品伙伴网,,特香料AAA（拌合型粉末）,食品添加剂-->食品添加剂,青岛柏慧园食品配料有限公司 ,淄川商城桂连干鲜调味品商行 ,2022-04-19,,,,,,,合格,国内监督抽查(山东市场监管局),2022-04-19,
食品伙伴网,,1236猪肉香精(膏状香精),食品添加剂-->食品添加剂,济宁奥可特食品有限公司 ,昌邑市丽丽食品添加剂商店 ,2022-04-19,,,,,,,合格,国内监督抽查(山东市场监管局),2022-04-19,
食品伙伴网,,蛋白糖,食品添加剂-->食品添加剂,青岛瑞潽旺食品配料有限公司 ,青岛瑞潽旺食品配料有限公司 ,2022-04-19,,,,,,,合格,国内监督抽查(山东市场监管局),2022-04-19,
食品伙伴网,,复配水分保持剂（型号：P－1）,食品添加剂-->食品添加剂,青岛宝立通食品有限公司 ,青岛宝立通食品有限公司 ,2022-04-19,,,,,,,合格,国内监督抽查(山东市场监管局),2022-04-19,
食品伙伴网,,复配小麦粉稳定剂（大饼柔软剂）,食品添加剂-->食品添加剂,河南瑞之琪食品有限公司 ,巴彦淖尔市临河区金鑫双翼食品添加剂经销部 ,2022-05-05,,,,,,,合格,国内监督抽查(内蒙古市场监管局),2022-05-05,
食品伙伴网,,好搭档面包改良剂,食品添加剂-->食品添加剂,安琪酵母股份有限公司 ,巴彦淖尔市临河区金鑫双翼食品添加剂经销部 ,2022-05-05,,,,,,,合格,国内监督抽查(内蒙古市场监管局),2022-05-05,
食品伙伴网,,复配增稠剂,食品添加剂-->食品添加剂,滕州市通达海藻工程技术有限责任公司 ,巴彦淖尔市临河区金鑫双翼食品添加剂经销部 ,2022-05-05,,,,,,,合格,国内监督抽查(内蒙古市场监管局),2022-05-05,
食品伙伴网,,食用小苏打（复配膨松剂）,食品添加剂-->食品添加剂,漳州市勇鑫食品有限公司 ,泉州市中闽百汇购物有限公司漳州分公司 ,2022-05-06,,,,,,,合格,国内监督抽查(福建市场监管局),2022-05-06,
食品伙伴网,,复配酸度调节剂,食品添加剂-->食品添加剂,山东圣琪生物有限公司 ,漳州新华都百货有限责任公司金峰店 ,2022-05-06,,,,,,,合格,国内监督抽查(福建市场监管局),2022-05-06,
食品伙伴网,,复配酸度调节剂,食品添加剂-->食品添加剂,山东圣琪生物有限公司 ,漳州新华都百货有限责任公司金峰店 ,2022-05-06,,,,,,,合格,国内监督抽查(福建市场监管局),2022-05-06,
食品伙伴网,,复配膨松剂,食品添加剂-->食品添加剂,漳州市勇鑫食品有限公司 ,漳州市芗城区左花便利店 ,2022-05-06,,,,,,,合格,国内监督抽查(福建市场监管局),2022-05-06,
食品伙伴网,,复配酸度调节剂,食品添加剂-->食品添加剂,山东圣琪生物有限公司 ,漳州市芗城区闰超超市 ,2022-05-06,,,,,,,合格,国内监督抽查(福建市场监管局),2022-05-06,
食品伙伴网,,食用碱面,食品添加剂-->食品添加剂,郑州君发科技有限公司 ,漳州市芗城区闰超超市 ,2022-05-06,,,,,,,合格,国内监督抽查(福建市场监管局),2022-05-06,
食品伙伴网,,复配乳化稳定剂（SP1181-1）,食品添加剂-->食品添加剂,厦门唯康食品科技有限公司 ,厦门唯康食品科技有限公司 ,2022-05-06,,,,,,,合格,国内监督抽查(福建市场监管局),2022-05-06,
食品伙伴网,,食用小苏打,食品添加剂-->食品添加剂,漳州市勇鑫食品有限公司 ,漳州新华都百货有限责任公司 ,2022-05-06,,,,,,,合格,国内监督抽查(福建市场监管局),2022-05-06,
食品伙伴网,,复配乳化稳定剂（HBST02）,食品添加剂-->食品添加剂,厦门唯康食品科技有限公司 ,厦门唯康食品科技有限公司 ,2022-05-06,,,,,,,合格,国内监督抽查(福建市场监管局),2022-05-06,
食品伙伴网,,复配乳化稳定剂（SM3105）,食品添加剂-->食品添加剂,厦门唯康食品科技有限公司 ,厦门唯康食品科技有限公司 ,2022-05-06,,,,,,,合格,国内监督抽查(福建市场监管局),2022-05-06,
食品伙伴网,,复配乳化增稠剂（CZR2006）,食品添加剂-->食品添加剂,厦门馥诚食品科技有限公司 ,厦门馥诚食品科技有限公司 ,2022-05-06,,,,,,,合格,国内监督抽查(福建市场监管局),2022-05-06,
食品伙伴网,,青花椒精油(油溶性香精)(食品用香精),食品添加剂-->食品添加剂,重庆华萃生物技术股份有限公司 ,重庆华萃生物技术股份有限公司 ,2022-05-06,,,,,,,合格,国内监督抽查(重庆市场监管局),2022-05-06,
食品伙伴网,,辣椒精（油溶）,食品添加剂-->食品添加剂,味滋美（江苏）食品有限公司 ,清江浦区刘柏兰调味品经营部 ,2022-05-11,,,,,,,合格,国内监督抽查(江苏市场监管局),2022-05-11,
食品伙伴网,,复配面包膨松剂（超柔1号）,食品添加剂-->食品添加剂,颖路祺食品科技（天津）有限公司 ,巴彦淖尔市临河区金鑫双翼食品添加剂经销部 ,2022-05-05,,,,,,,合格,国内监督抽查(内蒙古市场监管局),2022-05-05,
食品伙伴网,,复配水分保持剂Ⅱ（复合磷酸盐）,食品添加剂-->食品添加剂,徐州海成食品添加剂有限公司 ,淮安市清河区盛元食品添加剂经营部 ,2022-05-11,,,,,,,合格,国内监督抽查(江苏市场监管局),2022-05-11,
食品伙伴网,,复配增稠剂,食品添加剂-->食品添加剂,苏州高峰生物科技有限公司 ,苏州高峰生物科技有限公司 ,2022-05-11,,,,,,,合格,国内监督抽查(江苏市场监管局),2022-05-11,
食品伙伴网,,LemonFlavorNATWonfSRS柠檬香精WI970,食品添加剂-->食品添加剂,蓝太平洋香精（苏州）有限公司 ,蓝太平洋香精（苏州）有限公司 ,2022-05-11,,,,,,,合格,国内监督抽查(江苏市场监管局),2022-05-11,
食品伙伴网,,肉味增香剂（食品用香精）,食品添加剂-->食品添加剂,重庆市馥荟食品有限公司 ,重庆市馥荟食品有限公司 ,2022-05-13,,,,,,,合格,国内监督抽查(重庆市场监管局),2022-05-13,
食品伙伴网,,复配水分保持剂（型号：UK－1）,食品添加剂-->食品添加剂,青岛宝立通食品有限公司 ,青岛宝立通食品有限公司 ,2022-04-19,,,,,,,合格,国内监督抽查(山东市场监管局),2022-04-19,
食品伙伴网,,护色剂（复配食品添加剂）,食品添加剂-->食品添加剂,哈尔滨亿达食品原料有限公司 ,成武县信誉化工食品添加剂门市 ,2022-04-21,,,,,,,合格,国内监督抽查(山东市场监管局),2022-04-21,
食品伙伴网,,复配增稠稳定剂34,食品添加剂-->食品添加剂,济南泉康生物科技有限公司章丘分公司 ,济南泉康生物科技有限公司章丘分公司 ,2022-04-21,,,,,,,合格,国内监督抽查(山东市场监管局),2022-04-21,
食品伙伴网,,鲜香鸡膏食品用香精,食品添加剂-->食品添加剂,青岛瑞潽旺食品配料有限公司 ,临沂商场丽燕食品添加剂商行 ,2022-04-21,,,,,,,合格,国内监督抽查(山东市场监管局),2022-04-21,
食品伙伴网,,食用小苏打,食品添加剂-->食品添加剂,济南宝硕食品科技有限公司 ,兰陵县易购多超市 ,2022-04-21,,,,,,,合格,国内监督抽查(山东市场监管局),2022-04-21,
食品伙伴网,,"复配葡
萄淀粉酶",食品添加剂-->食品添加剂,湖南鸿鹰生物科技有限公司 ,湖南鸿鹰生物科技有限公司 ,2022-04-24,,,,,,,合格,国内监督抽查(湖南市场监管局),2022-04-24,
食品伙伴网,,"新标准
外甜
（复配甜味剂）",食品添加剂-->食品添加剂,长沙汇凯华明生物科技有限公司 ,长沙汇凯华明生物科技有限公司 ,2022-04-24,,,,,,,合格,国内监督抽查(湖南市场监管局),2022-04-24,
食品伙伴网,,熟草莓味香精,食品添加剂-->食品添加剂,长沙元品香精有限公司 ,长沙元品香精有限公司 ,2022-04-24,,,,,,,合格,国内监督抽查(湖南市场监管局),2022-04-24,
食品伙伴网,,食品添加剂复配防腐剂,食品添加剂-->食品添加剂,宁城县杜乐酸菜鲜加工厂 ,正蓝旗上都镇老六生鲜大卖场 ,2022-04-25,,,,,,,合格,国内监督抽查(内蒙古市场监管局),2022-04-25,
食品伙伴网,,复配酶制剂面包•压面专用改良剂,食品添加剂-->食品添加剂,广州点榜食品有限公司 ,张家港市锦丰镇百安心食品批发部 ,2022-04-12,,,,,,,合格,国内监督抽查(江苏市场监管局),2022-04-12,
食品伙伴网,,复配小麦粉面粉处理剂,食品添加剂-->食品添加剂,郑州昆仑生物科技有限公司 ,邳州市朝文商店 ,2022-04-12,,,,,,,合格,国内监督抽查(江苏市场监管局),2022-04-12,
食品伙伴网,,牛奶味香精,食品添加剂-->食品添加剂,昆山园林香精香料有限公司 ,合肥瑶海区天之友食品商行 ,2022-05-30,,,,,,,合格,国内监督抽查(安徽市场监管局),2022-05-30,
食品伙伴网,,TN30551烤红薯香精,食品添加剂-->食品添加剂,天宁香料（江苏）有限公司 ,合肥瑶海区天之友食品商行 ,2022-05-30,,,,,,,合格,国内监督抽查(安徽市场监管局),2022-05-30,
食品伙伴网,,TN7060535-1水晶香芋粉末香精,食品添加剂-->食品添加剂,天宁香料（江苏）有限公司 ,合肥瑶海区天之友食品商行 ,2022-05-30,,,,,,,合格,国内监督抽查(安徽市场监管局),2022-05-30,
食品伙伴网,,TN7170501抹茶粉末香精,食品添加剂-->食品添加剂,天宁香料（江苏）有限公司 ,合肥瑶海区天之友食品商行 ,2022-05-30,,,,,,,合格,国内监督抽查(安徽市场监管局),2022-05-30,
食品伙伴网,,复配增稠剂,食品添加剂-->食品添加剂,河南双城食品有限公司 ,合肥瑶海区诚之信化工经营部 ,2022-05-30,,,,,,,合格,国内监督抽查(安徽市场监管局),2022-05-30,
食品伙伴网,,复配增稠剂,食品添加剂-->食品添加剂,河南双城食品有限公司 ,合肥瑶海区诚之信化工经营部 ,2022-05-30,,,,,,,合格,国内监督抽查(安徽市场监管局),2022-05-30,
食品伙伴网,,复配稳定剂(食品添加剂),食品添加剂-->食品添加剂,吉林省春润生物科技有限公司 ,合肥康庆威食品配料有限公司 ,2022-05-30,,,,,,,合格,国内监督抽查(安徽市场监管局),2022-05-30,
食品伙伴网,,复配稳定剂,食品添加剂-->食品添加剂,吉林省春润生物科技有限公司 ,合肥康庆威食品配料有限公司 ,2022-05-30,,,,,,,合格,国内监督抽查(安徽市场监管局),2022-05-30,
食品伙伴网,,β-胡萝卜素粉剂,食品添加剂-->食品添加剂,随州市世力达生物科技有限公司 ,合肥长江批发市场恒泰食品添加剂商行 ,2022-05-30,,,,,,,合格,国内监督抽查(安徽市场监管局),2022-05-30,
食品伙伴网,,肉宝增香王(食品用香精),食品添加剂-->食品添加剂,北京北方霞光食品添加剂有限公司房山分厂 ,合肥康庆威食品配料有限公司 ,2022-05-30,,,,,,,合格,国内监督抽查(安徽市场监管局),2022-05-30,
