信息来源,搜索条件,物料名称,产品分类,生产商,供应商,生产日期,批号,项目分类,检测项目,单位,检测结果,限量值,判定,发布单位,发布日期,备注
食品伙伴网,,百肉香(膏体状),食品添加剂-->食品添加剂,青岛金百合调味香料有限公司 ,肥城市武记干货批发中心 ,2021-06-15,,,,,,,合格,国内监督抽查(山东市场监管局),2021-06-15,
食品伙伴网,,烧饼伴侣馒头改良剂（烧饼专用）,食品添加剂-->食品添加剂,安琪酵母股份有限公司 ,沂水县千百汇食品添加剂总汇 ,2021-06-15,,,,,,,合格,国内监督抽查(山东市场监管局),2021-06-15,
食品伙伴网,,复配小麦粉稳定剂,食品添加剂-->食品添加剂,河南瑞之琪食品有限公司 ,沂水县千百汇食品添加剂总汇 ,2021-06-15,,,,,,,合格,国内监督抽查(山东市场监管局),2021-06-15,
食品伙伴网,,香蕉油香精,食品添加剂-->食品添加剂,连云港惠源食品配料有限公司 ,沂水县千百汇食品添加剂总汇 ,2021-06-15,,,,,,,合格,国内监督抽查(山东市场监管局),2021-06-15,
食品伙伴网,,牛肉香精(拌合型粉末）,食品添加剂-->食品添加剂,青岛海润隆食品添加剂有限公司 ,济宁市腾飞食品添加剂有限责任公司 ,2021-06-15,,,,,,,合格,国内监督抽查(山东市场监管局),2021-06-15,
食品伙伴网,,食品添加剂明胶,食品添加剂-->食品添加剂,山东汶泽生物科技有限公司 ,泰安市科宇商贸有限公司 ,2021-06-15,,,,,,,合格,国内监督抽查(山东市场监管局),2021-06-15,
食品伙伴网,,鸡肉骨精膏,食品添加剂-->食品添加剂,平度市高泰克食品配料厂 ,东营区诚信食品销售部 ,2021-06-15,,,,,,,合格,国内监督抽查(山东市场监管局),2021-06-15,
食品伙伴网,,鸡肉香精(拌和型粉末),食品添加剂-->食品添加剂,青岛瑞可莱食品配料有限公司 ,平度市天然香食品店 ,2021-06-15,,,,,,,合格,国内监督抽查(山东市场监管局),2021-06-15,
食品伙伴网,,猪肉香精(拌和型粉末),食品添加剂-->食品添加剂,青岛瑞可莱食品配料有限公司 ,平度市天然香食品店 ,2021-06-15,,,,,,,合格,国内监督抽查(山东市场监管局),2021-06-15,
食品伙伴网,,复配肉制品增稠剂(滚揉斩拌型),食品添加剂-->食品添加剂,青岛德慧海洋生物科技有限公司 ,平度市天然香食品店 ,2021-06-15,,,,,,,合格,国内监督抽查(山东市场监管局),2021-06-15,
食品伙伴网,,复配型增稠剂食品添加剂,食品添加剂-->食品添加剂,滕州市通达海藻工程技术有限责任公司 ,平度市天然香食品店 ,2021-06-15,,,,,,,合格,国内监督抽查(山东市场监管局),2021-06-15,
食品伙伴网,,春宇食品添加剂食品用香精,食品添加剂-->食品添加剂,日照市大厨三宝餐饮配料有限公司 ,博兴县博昌街道办事处金龙调味品店 ,2021-06-15,,,,,,,合格,国内监督抽查(山东市场监管局),2021-06-15,
食品伙伴网,,罗拔臣明胶,食品添加剂-->食品添加剂,联合利华（中国）有限公司从化分公司 ,芝罘区飞鹏百货商行 ,2021-06-15,,,,,,,合格,国内监督抽查(山东市场监管局),2021-06-15,
食品伙伴网,,透骨增香剂-AA（拌合型粉末）,食品添加剂-->食品添加剂,青岛瑞香源食品有限公司 ,芝罘区思会调料商行 ,2021-06-15,,,,,,,合格,国内监督抽查(山东市场监管局),2021-06-15,
食品伙伴网,,明胶片（食品添加剂）,食品添加剂-->食品添加剂,河北豪东生物科技有限公司 ,烟台茂鑫食品有限公司 ,2021-06-15,,,,,,,合格,国内监督抽查(山东市场监管局),2021-06-15,
食品伙伴网,,骨髓浸膏（鸡味）,食品添加剂-->食品添加剂,青岛圣菲莱食品配料有限公司 ,菏泽成功化工有限公司 ,2021-06-15,,,,,,,合格,国内监督抽查(山东市场监管局),2021-06-15,
食品伙伴网,,嫩肉王（拌和型粉末）,食品添加剂-->食品添加剂,青岛香海盛食品配料有限公司 ,夏津县强强食品添加剂销售部 ,2021-06-15,,,,,,,合格,国内监督抽查(山东市场监管局),2021-06-15,
食品伙伴网,,复配酸度调节剂(食用纯碱),食品添加剂-->食品添加剂,青岛灵鸟食品有限公司 ,鱼台县佳客多购物广场有限公司 ,2021-06-15,,,,,,,合格,国内监督抽查(山东市场监管局),2021-06-15,
食品伙伴网,,食用碱（食品添加剂复配酸度调节剂）,食品添加剂-->食品添加剂,青岛威力食用化工有限公司 ,宁阳县康华商城 ,2021-06-15,,,,,,,合格,国内监督抽查(山东市场监管局),2021-06-15,
食品伙伴网,,食品添加剂复配酸度调节剂,食品添加剂-->食品添加剂,济南宝硕食品科技有限公司 ,青岛佳爱家商贸有限公司 ,2021-06-15,,,,,,,合格,国内监督抽查(山东市场监管局),2021-06-15,
食品伙伴网,,复配膨松剂（香甜泡打粉）,食品添加剂-->食品添加剂,桂林可胜食品有限公司 ,莒南县溯扬百货批发部 ,2021-06-04,,,,,,,合格,国内监督抽查(山东市场监管局),2021-06-04,
食品伙伴网,,花生油香精,食品添加剂-->食品添加剂,泰州盛康生物科技有限公司 ,兰陵县保红综合商行 ,2021-06-04,,,,,,,合格,国内监督抽查(山东市场监管局),2021-06-04,
食品伙伴网,,明胶片（食品添加剂）,食品添加剂-->食品添加剂,河北豪东生物科技有限公司 ,临沂商城益百家智能便利店 ,2021-06-04,,,,,,,合格,国内监督抽查(山东市场监管局),2021-06-04,
食品伙伴网,,明胶片（食品添加剂）,食品添加剂-->食品添加剂,河北豪东生物科技有限公司 ,浙嘉行（山东）商贸有限公司 ,2021-06-04,,,,,,,合格,国内监督抽查(山东市场监管局),2021-06-04,
食品伙伴网,,食品用香精,食品添加剂-->食品添加剂,日照市大厨三宝餐饮配料有限公司 ,威海疆峰食品有限公司 ,2021-06-15,,,,,,,合格,国内监督抽查(山东市场监管局),2021-06-15,
食品伙伴网,,牛肉香精,食品添加剂-->食品添加剂,青岛金百合调味香料有限公司 ,临淄区辛店大胡干货水产调味店 ,2021-06-15,,,,,,,合格,国内监督抽查(山东市场监管局),2021-06-15,
食品伙伴网,,驴味增香膏(膏体状),食品添加剂-->食品添加剂,青岛金百合调味香料有限公司 ,临淄区辛店大胡干货水产调味店 ,2021-06-15,,,,,,,合格,国内监督抽查(山东市场监管局),2021-06-15,
食品伙伴网,,食用小苏打（复配酸度调节剂）,食品添加剂-->食品添加剂,青岛建航味精有限公司 ,青岛润泰事业有限公司烟台分公司 ,2021-06-15,,,,,,,合格,国内监督抽查(山东市场监管局),2021-06-15,
食品伙伴网,,黄原胶,食品添加剂-->食品添加剂,鄂尔多斯市中轩生化股份有限公司 ,南京同建食品科技有限公司 ,2021-06-30,,,,,,,合格,国内监督抽查(江苏市场监管局),2021-06-30,/
食品伙伴网,,黄原胶-食品添加剂,食品添加剂-->食品添加剂,鄂尔多斯市中轩生化股份有限公司 ,梁溪区坤清食品商行 ,2021-06-30,,,,,,,合格,国内监督抽查(江苏市场监管局),2021-06-30,/
食品伙伴网,,一水柠檬酸（99.5%≤含量≤100.5%）,食品添加剂-->食品添加剂,中粮生化能源（榆树）有限公司 ,南京同建食品科技有限公司 ,2021-06-30,,,,,,,合格,国内监督抽查(江苏市场监管局),2021-06-30,/
食品伙伴网,,碳酸钠（食用碱）,食品添加剂-->食品添加剂,连云港碱业有限公司 ,南京同建食品科技有限公司 ,2021-06-30,,,,,,,合格,国内监督抽查(江苏市场监管局),2021-06-30,/
食品伙伴网,,食品添加剂5’-呈味核苷酸二钠（又名呈味核苷酸二钠）,食品添加剂-->食品添加剂,希杰（聊城）生物科技有限公司 ,扬州绿都化工食用品有限责任公司 ,2021-06-30,,,,,,,合格,国内监督抽查(江苏市场监管局),2021-06-30,/
食品伙伴网,,一水柠檬酸,食品添加剂-->食品添加剂,潍坊英轩实业有限公司 ,南京万邦食品原料中心 ,2021-06-30,,,,,,,合格,国内监督抽查(江苏市场监管局),2021-06-30,/
食品伙伴网,,D-异抗坏血酸钠,食品添加剂-->食品添加剂,江西省德兴市百勤异VC钠有限公司 ,扬州绿都化工食用品有限责任公司 ,2021-06-30,,,,,,,合格,国内监督抽查(江苏市场监管局),2021-06-30,/
食品伙伴网,,食品添加剂5’-呈味核苷酸二钠（又名呈味核苷酸二钠）,食品添加剂-->食品添加剂,希杰（聊城）生物科技有限公司 ,南京市六合区志高食品经营部 ,2021-06-30,,,,,,,合格,国内监督抽查(江苏市场监管局),2021-06-30,/
食品伙伴网,,食品添加剂碳酸氢钠（小苏打）,食品添加剂-->食品添加剂,桐柏海晶碱业有限责任公司 ,南京市建邺区姜东亮食品添加剂经营部 ,2021-06-30,,,,,,,合格,国内监督抽查(江苏市场监管局),2021-06-30,/
食品伙伴网,,食品添加剂卫星牌糖精钠,食品添加剂-->食品添加剂,天津北方食品有限公司 ,南京市建邺区姜东亮食品添加剂经营部 ,2021-06-30,,,,,,,合格,国内监督抽查(江苏市场监管局),2021-06-30,/
食品伙伴网,,甜蜜素,食品添加剂-->食品添加剂,天津维多科技发展有限公司 ,南京市建邺区姜东亮食品添加剂经营部 ,2021-06-30,,,,,,,合格,国内监督抽查(江苏市场监管局),2021-06-30,/
食品伙伴网,,红曲红,食品添加剂-->食品添加剂,广东天益生物科技有限公司 ,梁溪区坤清食品商行 ,2021-06-30,,,,,,,合格,国内监督抽查(江苏市场监管局),2021-06-30,/
食品伙伴网,,D-异抗坏血酸钠,食品添加剂-->食品添加剂,江西省德兴市百勤异VC钠有限公司 ,梁溪区坤清食品商行 ,2021-06-30,,,,,,,合格,国内监督抽查(江苏市场监管局),2021-06-30,/
食品伙伴网,,甜蜜素,食品添加剂-->食品添加剂,方大添加剂（阳泉）有限公司 ,梁溪区坤清食品商行 ,2021-06-30,,,,,,,合格,国内监督抽查(江苏市场监管局),2021-06-30,/
食品伙伴网,,碳酸钠（食用碱）,食品添加剂-->食品添加剂,连云港碱业有限公司 ,梁溪区坤清食品商行 ,2021-06-30,,,,,,,合格,国内监督抽查(江苏市场监管局),2021-06-30,/
食品伙伴网,,麦芽糊精,食品添加剂-->食品添加剂,秦皇岛骊骅淀粉股份有限公司 ,南京同建食品科技有限公司 ,2021-06-30,,,,,,,合格,国内监督抽查(江苏市场监管局),2021-06-30,/
食品伙伴网,,食品添加剂5’-呈味核苷酸二钠（又名呈味核苷酸二钠）,食品添加剂-->食品添加剂,希杰（聊城）生物科技有限公司 ,崇安区长顺副食品商行 ,2021-06-30,,,,,,,合格,国内监督抽查(江苏市场监管局),2021-06-30,/
食品伙伴网,,食品添加剂复配膨松剂,食品添加剂-->食品添加剂,上海早苗食品有限公司 ,南京维利康食品有限公司 ,2021-06-30,,,,,,,合格,国内监督抽查(江苏市场监管局),2021-06-30,/
食品伙伴网,,柠檬酸钠（99.0％≤含量≤100.5％）,食品添加剂-->食品添加剂,马鞍山中粮生物化学有限公司 ,南京克莉丝汀食品有限公司 ,2021-06-30,,,,,,,合格,国内监督抽查(江苏市场监管局),2021-06-30,/
食品伙伴网,,双效泡打粉复配膨松剂,食品添加剂-->食品添加剂,安琪酵母股份有限公司 ,润州区胡可食品经营部 ,2021-06-30,,,,,,,合格,国内监督抽查(江苏市场监管局),2021-06-30,/
食品伙伴网,,一水柠檬酸,食品添加剂-->食品添加剂,中粮生化能源（榆树）有限公司 ,南京同建食品科技有限公司 ,2021-06-30,,,,,,,合格,国内监督抽查(江苏市场监管局),2021-06-30,/
食品伙伴网,,红曲红,食品添加剂-->食品添加剂,广东科隆生物科技有限公司 ,淮安市清河区传喜调味品经营部 ,2021-06-30,,,,,,,合格,国内监督抽查(江苏市场监管局),2021-06-30,/
食品伙伴网,,乐豆豆腐王,食品添加剂-->食品添加剂,安徽省兴宙医药食品有限公司 ,常州市凌家塘田丰食品添加剂经营部 ,2021-06-30,,,,,,,合格,国内监督抽查(江苏市场监管局),2021-06-30,/
食品伙伴网,,方大甜蜜素（甜味剂）,食品添加剂-->食品添加剂,方大添加剂（阳泉）有限公司 ,常州市凌家塘田丰食品添加剂经营部 ,2021-06-30,,,,,,,合格,国内监督抽查(江苏市场监管局),2021-06-30,/
食品伙伴网,,乙基麦芽酚,食品添加剂-->食品添加剂,上海爱普食品工业有限公司分公司 ,扬州四季青科技开发有限公司 ,2021-06-30,,,,,,,合格,国内监督抽查(江苏市场监管局),2021-06-30,/
食品伙伴网,,乙酰磺胺酸钾（安赛蜜）,食品添加剂-->食品添加剂,安徽维多食品配料有限公司 ,扬州四季青科技开发有限公司 ,2021-06-30,,,,,,,合格,国内监督抽查(江苏市场监管局),2021-06-30,/
食品伙伴网,,食品添加剂5’-呈味核苷酸二钠（又名呈味核苷酸二钠）,食品添加剂-->食品添加剂,希杰（聊城）生物科技有限公司 ,扬州四季青科技开发有限公司 ,2021-06-30,,,,,,,合格,国内监督抽查(江苏市场监管局),2021-06-30,/
食品伙伴网,,黄原胶,食品添加剂-->食品添加剂,鄂尔多斯市中轩生化股份有限公司 ,梁溪区国小豪食品商行 ,2021-06-30,,,,,,,合格,国内监督抽查(江苏市场监管局),2021-06-30,/
食品伙伴网,,食品添加剂丙酸钙,食品添加剂-->食品添加剂,南通奥凯生物技术开发有限公司 ,梁溪区国小豪食品商行 ,2021-06-30,,,,,,,合格,国内监督抽查(江苏市场监管局),2021-06-30,/
食品伙伴网,,方大甜蜜素,食品添加剂-->食品添加剂,方大添加剂（阳泉）有限公司 ,常州市凌家塘海云食品添加剂经营部 ,2021-06-30,,,,,,,合格,国内监督抽查(江苏市场监管局),2021-06-30,/
食品伙伴网,,食品添加剂豆腐王葡萄糖酸-δ-内酯,食品添加剂-->食品添加剂,江苏环宇康力科技有限公司 ,南京同建食品科技有限公司 ,2021-06-30,,,,,,,合格,国内监督抽查(江苏市场监管局),2021-06-30,/
食品伙伴网,,乙基麦芽酚香精（肉香型）,食品添加剂-->食品添加剂,厦门市顶味兴业香料发展有限公司 ,淮安市清河区传喜调味品经营部 ,2021-06-30,,,,,,,合格,国内监督抽查(江苏市场监管局),2021-06-30,/
食品伙伴网,,豆洛洛豆腐王,食品添加剂-->食品添加剂,江西新黄海食品有限公司 ,常州市凌家塘田丰食品添加剂经营部 ,2021-06-30,,,,,,,合格,国内监督抽查(江苏市场监管局),2021-06-30,/
食品伙伴网,,爱普牌焦糖色,食品添加剂-->食品添加剂,山东爱普食品工业有限公司 ,淮安市清河区传喜调味品经营部 ,2021-06-30,,,,,,,合格,国内监督抽查(江苏市场监管局),2021-06-30,/
食品伙伴网,,甜蜜素,食品添加剂-->食品添加剂,金城化学（江苏）有限公司 ,常州市凌家塘田丰食品添加剂经营部 ,2021-06-30,,,,,,,合格,国内监督抽查(江苏市场监管局),2021-06-30,/
食品伙伴网,,复配膨松剂（双效泡打粉）,食品添加剂-->食品添加剂,桂林市红星化工有限责任公司 ,南京市江宁区从琴食品添加剂销售中心 ,2021-06-30,,,,,,,合格,国内监督抽查(江苏市场监管局),2021-06-30,/
食品伙伴网,,食品添加剂5’-呈味核苷酸二钠（又名呈味核苷酸二钠）,食品添加剂-->食品添加剂,希杰（聊城）生物科技有限公司 ,南京市江宁区从琴食品添加剂销售中心 ,2021-06-30,,,,,,,合格,国内监督抽查(江苏市场监管局),2021-06-30,/
食品伙伴网,,甜蜜素,食品添加剂-->食品添加剂,天津维多科技发展有限公司 ,清江浦区威宇食品添加剂经营部 ,2021-06-30,,,,,,,合格,国内监督抽查(江苏市场监管局),2021-06-30,/
食品伙伴网,,食品添加剂复配膨松剂（中原油炸专用）,食品添加剂-->食品添加剂,郑州君发科技有限公司　 ,清江浦区威宇食品添加剂经营部 ,2021-06-30,,,,,,,合格,国内监督抽查(江苏市场监管局),2021-06-30,/
食品伙伴网,,卧式切肉机,食品相关产品-->食品机械设备,广州市力进食品机械有限公司 ,/ ,2021-12-16,,,外部导线用接线端子,,,,不合格,国内监督抽查(国家市场监管总局),2021-12-16,
食品伙伴网,,经典型电脑表电热食品烘炉（商用箱式电烤炉）,食品相关产品-->食品机械设备,广东省泓锋烘焙设备有限公司 ,/ ,2021-12-16,,,接地措施,,,,不合格,国内监督抽查(国家市场监管总局),2021-12-16,
食品伙伴网,,灶皇商用大功率电磁炉（电磁灶）,食品相关产品-->食品机械设备,佛山市顺德区灶皇厨卫电器有限公司 ,/ ,2021-12-16,,,对触及带电部件的防护,,,,不合格,国内监督抽查(国家市场监管总局),2021-12-16,
食品伙伴网,,电热平扒炉,食品相关产品-->食品机械设备,广州市厨美锐西厨设备有限公司 ,/ ,2021-12-16,,,对触及带电部件的防护,,,,不合格,国内监督抽查(国家市场监管总局),2021-12-16,
食品伙伴网,,节能低耗型和面机,食品相关产品-->食品机械设备,瑞安市凯峰机械有限公司 ,/ ,2021-12-16,,,接地措施,,,,不合格,国内监督抽查(国家市场监管总局),2021-12-16,
食品伙伴网,,HS20升双动双速和面机,食品相关产品-->食品机械设备,杭州萧山凯兴食品机械有限公司 ,/ ,2021-12-16,,,接地措施,,,,不合格,国内监督抽查(国家市场监管总局),2021-12-16,
食品伙伴网,,BX-320S高刚度自动切片机,食品相关产品-->食品机械设备,石家庄博鑫肉食机械有限公司 ,/ ,2021-12-16,,,内部布线,,,,不合格,国内监督抽查(国家市场监管总局),2021-12-16,
食品伙伴网,,双动和面机,食品相关产品-->食品机械设备,唐山聚业机械设备制造有限公司 ,/ ,2021-12-16,,,接地措施,,,,不合格,国内监督抽查(国家市场监管总局),2021-12-16,
食品伙伴网,,压力锅,食品相关产品-->食品机械设备,广东美满集团廉江市世纪电器有限公司 ,/ ,2021-12-16,,,泄压压力,,,,不合格,国内监督抽查(国家市场监管总局),2021-12-16,
食品伙伴网,,俏俏娘柠檬洗洁精,食品相关产品-->洗涤剂/消毒剂,杭州小蝌蚪生物科技有限公司 ,/ ,2021-12-16,,,菌落总数,,,,不合格,国内监督抽查(国家市场监管总局),2021-12-16,
食品伙伴网,,时尚型开水器,食品相关产品-->食品机械设备,广东顺德团星节能设备有限公司 ,/ ,2021-12-16,,,接地措施,,,,不合格,国内监督抽查(国家市场监管总局),2021-12-16,
食品伙伴网,,电热平扒炉,食品相关产品-->食品机械设备,广州市厨美锐西厨设备有限公司 ,/ ,2021-12-16,,,对触及带电部件的防护,,,,不合格,国内监督抽查(国家市场监管总局),2021-12-16,
食品伙伴网,,电汤粥炉,食品相关产品-->食品机械设备,广州市领创节能厨具有限公司 ,/ ,2021-12-16,,,接地措施,,,,不合格,国内监督抽查(国家市场监管总局),2021-12-16,
食品伙伴网,,电扒炉,食品相关产品-->食品机械设备,广州康邦厨房设备有限公司 ,/ ,2021-12-16,,,对触及带电部件的防护,,,,不合格,国内监督抽查(国家市场监管总局),2021-12-16,
食品伙伴网,,卧式切肉机,食品相关产品-->食品机械设备,广州市力进食品机械有限公司 ,/ ,2021-12-16,,,外部导线用接线端子,,,,不合格,国内监督抽查(国家市场监管总局),2021-12-16,
食品伙伴网,,洁超洗洁精,食品相关产品-->洗涤剂/消毒剂,蚌埠市淮上区洁超日用品厂 ,/ ,2021-12-16,,,总活性物含量,,,,不合格,国内监督抽查(国家市场监管总局),2021-12-16,
食品伙伴网,,商用饮水机,食品相关产品-->食品机械设备,广东伍壹实业有限公司 ,/ ,2021-12-16,,,接地措施,,,,不合格,国内监督抽查(国家市场监管总局),2021-12-16,
食品伙伴网,,ASL食品电烘炉（商用箱式电烤炉）,食品相关产品-->食品机械设备,佛山市南海辉麦厨房设备有限公司 ,/ ,2021-12-16,,,接地措施,,,,不合格,国内监督抽查(国家市场监管总局),2021-12-16,
食品伙伴网,,商用电煮锅,食品相关产品-->食品机械设备,佛山市顺德区杏坛蓝泉厨具五金厂 ,/ ,2021-12-16,,,输入功率和电流,,,,不合格,国内监督抽查(国家市场监管总局),2021-12-16,
食品伙伴网,,电热炸炉,食品相关产品-->食品机械设备,瑞安市威鑫利食品机械有限公司 ,/ ,2021-12-16,,,接地措施,,,,不合格,国内监督抽查(国家市场监管总局),2021-12-16,
食品伙伴网,,商用电磁炉,食品相关产品-->食品机械设备,广东顺德伊派餐饮设备有限公司 ,/ ,2021-12-16,,,电源连接和外部软线,,,,不合格,国内监督抽查(国家市场监管总局),2021-12-16,
食品伙伴网,,经典型电脑表电热食品烘炉（商用箱式电烤炉）,食品相关产品-->食品机械设备,广东省泓锋烘焙设备有限公司 ,/ ,2021-12-16,,,接地措施,,,,不合格,国内监督抽查(国家市场监管总局),2021-12-16,
食品伙伴网,,商用饮水机,食品相关产品-->食品机械设备,广东伍壹实业有限公司 ,/ ,2021-12-16,,,接地措施,,,,不合格,国内监督抽查(国家市场监管总局),2021-12-16,
食品伙伴网,,红外线食品电热烘炉,食品相关产品-->食品机械设备,广东万佳粤丰食品机械有限公司 ,/ ,2021-12-16,,,接地措施,,,,不合格,国内监督抽查(国家市场监管总局),2021-12-16,
食品伙伴网,,商用电磁炉,食品相关产品-->食品机械设备,尚朋堂（广州）电器有限公司 ,/ ,2021-12-16,,,接地措施,,,,不合格,国内监督抽查(国家市场监管总局),2021-12-16,
食品伙伴网,,商用电磁灶,食品相关产品-->食品机械设备,佛山市顺德区韩泰电器有限公司 ,/ ,2021-12-16,,,非正常工作,,,,不合格,国内监督抽查(国家市场监管总局),2021-12-16,
食品伙伴网,,灶皇商用大功率电磁炉（电磁灶）,食品相关产品-->食品机械设备,佛山市顺德区灶皇厨卫电器有限公司 ,/ ,2021-12-16,,,对触及带电部件的防护,,,,不合格,国内监督抽查(国家市场监管总局),2021-12-16,
食品伙伴网,,D-异抗坏血酸钠,食品添加剂-->食品添加剂,江西省德兴市百勤异VC钠有限公司 ,南京市建邺区姜东亮食品添加剂经营部 ,2021-06-30,,,,,,,合格,国内监督抽查(江苏市场监管局),2021-06-30,/
食品伙伴网,,复配增稠剂,食品添加剂-->食品添加剂,北京嘉瑞富德食品科技有限公司 ,北京嘉瑞富德食品科技有限公司 ,2021-06-18,,,,,,,合格,国内监督抽查(北京市场监管局),2021-06-18,
食品伙伴网,,牛奶香精,食品添加剂-->食品添加剂,北京维维亚尼食用香精有限公司 ,北京维维亚尼食用香精有限公司 ,2021-06-18,,,,,,,合格,国内监督抽查(北京市场监管局),2021-06-18,
食品伙伴网,,芒果香精,食品添加剂-->食品添加剂,北京维维亚尼食用香精有限公司 ,北京维维亚尼食用香精有限公司 ,2021-06-18,,,,,,,合格,国内监督抽查(北京市场监管局),2021-06-18,
食品伙伴网,,山楂香精,食品添加剂-->食品添加剂,北京维维亚尼食用香精有限公司 ,北京维维亚尼食用香精有限公司 ,2021-06-18,,,,,,,合格,国内监督抽查(北京市场监管局),2021-06-18,
食品伙伴网,,牛肉香精,食品添加剂-->食品添加剂,北京翰祺食品配料有限公司 ,北京翰祺食品配料有限公司 ,2021-06-18,,,,,,,合格,国内监督抽查(北京市场监管局),2021-06-18,
食品伙伴网,,脂溶性维生素复配营养强化剂,食品添加剂-->食品添加剂,哈尔滨拜仑斯特临床营养有限公司 ,哈尔滨拜仑斯特临床营养有限公司 ,2021-06-25,,,,,,,合格,国内监督抽查(黑龙江市场监管局),2021-06-25,
食品伙伴网,,铁元素复配营养强化剂,食品添加剂-->食品添加剂,哈尔滨拜仑斯特临床营养有限公司 ,哈尔滨拜仑斯特临床营养有限公司 ,2021-06-25,,,,,,,合格,国内监督抽查(黑龙江市场监管局),2021-06-25,
食品伙伴网,,肉制品护色剂,食品添加剂-->食品添加剂,大连国太食品有限责任公司 ,哈尔滨市道外区营润调料商行 ,2021-06-25,,,,,,,合格,国内监督抽查(黑龙江市场监管局),2021-06-25,
食品伙伴网,,馒头改良剂（复配发酵面制品酶制剂抗氧化剂）,食品添加剂-->食品添加剂,安琪酵母股份有限公司 ,哈尔滨市道里区华远食品原料商店 ,2021-06-25,,,,,,,合格,国内监督抽查(黑龙江市场监管局),2021-06-25,
食品伙伴网,,"食品添加剂
（复配皮蛋加工助剂A）",食品添加剂-->食品添加剂,荆州市禾盛食品科技有限公司 ,荆州市禾盛食品科技有 限公司 ,2021-06-28,,,,,,,合格,国内监督抽查(湖北市场监管局),2021-06-28,/
食品伙伴网,,"食品添加剂
（复配皮蛋加工助剂N）",食品添加剂-->食品添加剂,荆州市禾盛食品科技有限公司 ,荆州市禾盛食品科技有 限公司 ,2021-06-28,,,,,,,合格,国内监督抽查(湖北市场监管局),2021-06-28,/
食品伙伴网,,"牛奶香粉
（粉末香精）",食品添加剂-->食品添加剂, ,醴陵湘旺食品制 造有限公司 ,2021-06-30,,,,,,,合格,国内监督抽查(湖南市场监管局),2021-06-30,
食品伙伴网,,甜蜜素,食品添加剂-->食品添加剂,互惠（江门）食用添加剂有限公司 ,南京市江宁区健鹰食品添加剂经营部 ,2021-06-30,,,,,,,合格,国内监督抽查(江苏市场监管局),2021-06-30,/
