信息来源,搜索条件,物料名称,产品分类,生产商,供应商,生产日期,批号,项目分类,检测项目,单位,检测结果,限量值,判定,发布单位,发布日期,备注
食品伙伴网,,五香油香精D,食品添加剂-->食品添加剂,合肥芬莱生物科技有限公司 ,合肥长江批发市场恒泰食品添加剂商行 ,2022-05-30,,,,,,,合格,国内监督抽查(安徽市场监管局),2022-05-30,
食品伙伴网,,小核桃香精,食品添加剂-->食品添加剂,合肥芬莱生物科技有限公司 ,合肥长江批发市场恒泰食品添加剂商行 ,2022-05-30,,,,,,,合格,国内监督抽查(安徽市场监管局),2022-05-30,
食品伙伴网,,香兰素香精,食品添加剂-->食品添加剂,江苏新星食品添加剂有限公司 ,合肥长江批发市场恒泰食品添加剂商行 ,2022-05-30,,,,,,,合格,国内监督抽查(安徽市场监管局),2022-05-30,
食品伙伴网,,39019奶油香油香精,食品添加剂-->食品添加剂,江西省华宝孔雀食品科技发展有限公司 ,合肥长江批发市场恒泰食品添加剂商行 ,2022-05-30,,,,,,,合格,国内监督抽查(安徽市场监管局),2022-05-30,
食品伙伴网,,JK-1增香剂(食品用香精),食品添加剂-->食品添加剂,青岛腾原生物科技有限公司 ,合肥康庆威食品配料有限公司 ,2022-05-30,,,,,,,合格,国内监督抽查(安徽市场监管局),2022-05-30,
食品伙伴网,,鸡肉油香精,食品添加剂-->食品添加剂,南阳市天顺食品有限公司 ,合肥康庆威食品配料有限公司 ,2022-05-30,,,,,,,合格,国内监督抽查(安徽市场监管局),2022-05-30,
食品伙伴网,,食品氮,食品添加剂-->食品添加剂,普莱克斯（北京）半导体气体有限公司 ,普莱克斯（北京）半导体气体有限公司 ,2022-05-18,,,,,,,合格,国内监督抽查(北京市场监管局),2022-05-18,
食品伙伴网,,γ-氨基丁酸,食品添加剂-->食品添加剂,北京格力森酒业有限公司 ,北京格力森酒业有限公司 ,2022-05-18,,,,,,,合格,国内监督抽查(北京市场监管局),2022-05-18,
食品伙伴网,,胆巴（食用氯化镁）,食品添加剂-->食品添加剂,重庆市永兆食品有限责任公司 ,重庆市永兆食品有限责任公司 ,2022-05-19,,,,,,,合格,国内监督抽查(重庆市场监管局),2022-05-19,
食品伙伴网,,食用氯化镁,食品添加剂-->食品添加剂,重庆照青平食品添加剂有限责任公司 ,重庆照青平食品添加剂有限责任公司 ,2022-05-19,,,,,,,合格,国内监督抽查(重庆市场监管局),2022-05-19,
食品伙伴网,,食品添加剂明胶,食品添加剂-->食品添加剂,津榕（福建）明胶科技有限公司 ,津榕（福建）明胶科技有限公司 ,2022-05-20,,,,,,,合格,国内监督抽查(福建市场监管局),2022-05-20,
食品伙伴网,,食用小苏打（复配膨松剂）,食品添加剂-->食品添加剂,漳州市勇鑫食品有限公司 ,泉州新华都购物广场有限公司润华店 ,2022-05-20,,,,,,,合格,国内监督抽查(福建市场监管局),2022-05-20,
食品伙伴网,,索马甜（食品添加剂）,食品添加剂-->食品添加剂,和时君健（北京）科技发展有限公司 ,和时君健（北京）科技发展有限公司 ,2022-05-20,,,,,,,合格,国内监督抽查(北京市场监管局),2022-05-20,
食品伙伴网,,明胶粉,食品添加剂-->食品添加剂,亿威隆(厦门)生物科技有限公司 ,海口龙华金辉壹号食品商行 ,2022-05-24,,,,,,,合格,国内监督抽查(海南市场监管局),2022-05-24,
食品伙伴网,,复配酶制剂,食品添加剂-->食品添加剂,广州市味三代食品有限公司 ,海口龙华品之味商行 ,2022-05-24,,,,,,,合格,国内监督抽查(海南市场监管局),2022-05-24,
食品伙伴网,,栗油香膏(浆膏状食品用香精),食品添加剂-->食品添加剂,青岛香海盛食品配料有限公司 ,海口龙华品之味商行 ,2022-05-24,,,,,,,合格,国内监督抽查(海南市场监管局),2022-05-24,
食品伙伴网,,超浓缩鲜香回味粉,食品添加剂-->食品添加剂,青岛香巴尔食品配料有限公司 ,海口龙华品之味商行 ,2022-05-24,,,,,,,合格,国内监督抽查(海南市场监管局),2022-05-24,
食品伙伴网,,MG-8肉香乙基增香剂(拌和型粉末),食品添加剂-->食品添加剂,青岛神厨阿福食品科技有限公司 ,海口龙华品之味商行 ,2022-05-24,,,,,,,合格,国内监督抽查(海南市场监管局),2022-05-24,
食品伙伴网,,WL2192A草莓香精,食品添加剂-->食品添加剂,宁波威龙香精香料有限公司 ,合肥瑶海区诚之信化工经营部 ,2022-05-30,,,,,,,合格,国内监督抽查(安徽市场监管局),2022-05-30,
食品伙伴网,,纯真草莓味香精,食品添加剂-->食品添加剂,昆山园林香精香料有限公司 ,合肥瑶海区天之友食品商行 ,2022-05-30,,,,,,,合格,国内监督抽查(安徽市场监管局),2022-05-30,
食品伙伴网,,鸭肉粉末香精,食品添加剂-->食品添加剂,阳江市奥斯宝香化有限公司 ,合肥康庆威食品配料有限公司 ,2022-05-30,,,,,,,合格,国内监督抽查(安徽市场监管局),2022-05-30,
食品伙伴网,,烧腊香味素,食品添加剂-->食品添加剂,阳江市奥斯宝香化有限公司 ,合肥康庆威食品配料有限公司 ,2022-05-30,,,,,,,合格,国内监督抽查(安徽市场监管局),2022-05-30,
食品伙伴网,,吉士粉复配着色增稠剂,食品添加剂-->食品添加剂,东莞市永益食品有限公司 ,儋州那大惠源食用油商行 ,2022-06-10,,,,,,,合格,国内监督抽查(海南市场监管局),2022-06-10,
食品伙伴网,,狮宝牌吉士粉(复配着色剂),食品添加剂-->食品添加剂,普宁市狮宝食品有限公司 ,儋州那大惠源食用油商行 ,2022-06-10,,,,,,,合格,国内监督抽查(海南市场监管局),2022-06-10,
食品伙伴网,,(特)香料-AAAA,食品添加剂-->食品添加剂,青岛香巴尔食品配料有限公司 ,儋州那大惠源食用油商行 ,2022-06-10,,,,,,,合格,国内监督抽查(海南市场监管局),2022-06-10,
食品伙伴网,,食用纯碱,食品添加剂-->食品添加剂,武汉小丑调味食品有限公司 ,沙坪坝区联发便利店 ,2022-06-10,,,,,,,合格,国内监督抽查(重庆市场监管局),2022-06-10,
食品伙伴网,,食用小苏打,食品添加剂-->食品添加剂,济南宝硕食品科技有限公司 ,临沂九州连锁超市有限公司李公河店 ,2022-06-13,,,,,,,合格,国内监督抽查(山东市场监管局),2022-06-13,
食品伙伴网,,小苏打,食品添加剂-->食品添加剂,青岛建航味精有限公司 ,烟台振华量贩超市有限公司上曲家店 ,2022-06-13,,,,,,,合格,国内监督抽查(山东市场监管局),2022-06-13,
食品伙伴网,,甜玉米香精（液体）,食品添加剂-->食品添加剂,青岛钰鑫源食品有限公司 ,烟台新宏达食品添加剂有限公司 ,2022-06-13,,,,,,,合格,国内监督抽查(山东市场监管局),2022-06-13,
食品伙伴网,,食品添加剂复配酸度调节剂,食品添加剂-->食品添加剂,青州市恒宇食品厂 ,曹县红月生活超市 ,2022-06-13,,,,,,,合格,国内监督抽查(山东市场监管局),2022-06-13,
食品伙伴网,,辣椒精油（液体）,食品添加剂-->食品添加剂,青岛香海盛食品配料有限公司 ,邹平翔隆水产店 ,2022-06-13,,,,,,,合格,国内监督抽查(山东市场监管局),2022-06-13,
食品伙伴网,,食用小苏打,食品添加剂-->食品添加剂,青州市恒宇食品厂 ,沂水县万福祥购物中心店 ,2022-06-13,,,,,,,合格,国内监督抽查(山东市场监管局),2022-06-13,
食品伙伴网,,复配酸度调节剂,食品添加剂-->食品添加剂,山东圣琪生物有限公司 ,郯城县联众商贸有限公司团结路分公司 ,2022-06-13,,,,,,,合格,国内监督抽查(山东市场监管局),2022-06-13,
食品伙伴网,,乙基特香酚（食品用香精）,食品添加剂-->食品添加剂,青岛香巴尔食品配料有限公司 ,曹县磐石办事处千寻调味品商行 ,2022-06-13,,,,,,,合格,国内监督抽查(山东市场监管局),2022-06-13,
食品伙伴网,,食品添加剂明胶,食品添加剂-->食品添加剂,威海银河生物技术有限公司 ,临沂商城欣雪食品配料商行 ,2022-06-13,,,,,,,合格,国内监督抽查(山东市场监管局),2022-06-13,
食品伙伴网,,食用小苏打（复配酸度调节剂）,食品添加剂-->食品添加剂,青岛海丽祥食品有限公司 ,市北区鲁味宝商行 ,2022-06-13,,,,,,,合格,国内监督抽查(山东市场监管局),2022-06-13,
食品伙伴网,,食用碱面（复配酸度调节乳化剂）,食品添加剂-->食品添加剂,青岛海丽祥食品有限公司 ,市北区鲁味宝商行 ,2022-06-13,,,,,,,合格,国内监督抽查(山东市场监管局),2022-06-13,
食品伙伴网,,食品用香精（7637鸡肉香精）,食品添加剂-->食品添加剂,日照市大厨三宝餐饮配料有限公司 ,烟台市蓬莱区鑫达调味品经销处 ,2022-06-13,,,,,,,合格,国内监督抽查(山东市场监管局),2022-06-13,
食品伙伴网,,复配增稠乳化剂（配方一）,食品添加剂-->食品添加剂,天津裕邦生物科技发展有限公司 ,天津裕邦生物科技发展有限公司 ,2022-06-08,,,,,,,合格,国内监督抽查(天津市市场监管委员会),2022-06-08,/
食品伙伴网,,复配防腐剂（配方1）,食品添加剂-->食品添加剂,天津泰道科技发展有限公司 ,天津泰道科技发展有限公司 ,2022-06-08,,,,,,,合格,国内监督抽查(天津市市场监管委员会),2022-06-08,/
食品伙伴网,,复配抗氧化剂RBO-2001,食品添加剂-->食品添加剂,天津融信蓝海生物科技有限公司 ,天津融信蓝海生物科技有限公司 ,2022-06-08,,,,,,,合格,国内监督抽查(天津市市场监管委员会),2022-06-08,/
食品伙伴网,,食品用香精020增香剂,食品添加剂-->食品添加剂,天津融信蓝海生物科技有限公司 ,天津融信蓝海生物科技有限公司 ,2022-06-08,,,,,,,合格,国内监督抽查(天津市市场监管委员会),2022-06-08,/
食品伙伴网,,肉味液体香精,食品添加剂-->食品添加剂,天津源鹏生物科技有限公司 ,天津源鹏生物科技有限公司 ,2022-06-08,,,,,,,合格,国内监督抽查(天津市市场监管委员会),2022-06-08,/
食品伙伴网,,烤牛肉香精,食品添加剂-->食品添加剂,天津源鹏生物科技有限公司 ,天津源鹏生物科技有限公司 ,2022-06-08,,,,,,,合格,国内监督抽查(天津市市场监管委员会),2022-06-08,/
食品伙伴网,,肉精油1#,食品添加剂-->食品添加剂,天津源鹏生物科技有限公司 ,天津源鹏生物科技有限公司 ,2022-06-08,,,,,,,合格,国内监督抽查(天津市市场监管委员会),2022-06-08,/
食品伙伴网,,香菇香精0184,食品添加剂-->食品添加剂,天津市锦味轩食品有限公司 ,天津市锦味轩食品有限公司 ,2022-06-08,,,,,,,合格,国内监督抽查(天津市市场监管委员会),2022-06-08,/
食品伙伴网,,青苹果香精,食品添加剂-->食品添加剂,味觉莱恩食品工业（天津）有限公司 ,味觉莱恩食品工业（天津）有限公司 ,2022-06-08,,,,,,,合格,国内监督抽查(天津市市场监管委员会),2022-06-08,/
食品伙伴网,,高浓鲜奶精,食品添加剂-->食品添加剂,味觉莱恩食品工业（天津）有限公司 ,味觉莱恩食品工业（天津）有限公司 ,2022-06-08,,,,,,,合格,国内监督抽查(天津市市场监管委员会),2022-06-08,/
食品伙伴网,,大骨汤粉,食品添加剂-->食品添加剂,天津市锦味轩食品有限公司 ,天津市锦味轩食品有限公司 ,2022-06-08,,,,,,,合格,国内监督抽查(天津市市场监管委员会),2022-06-08,/
食品伙伴网,,肉味香精（9349）,食品添加剂-->食品添加剂,天津康宏盛代实业有限公司 ,天津康宏盛代实业有限公司 ,2022-06-08,,,,,,,合格,国内监督抽查(天津市市场监管委员会),2022-06-08,/
食品伙伴网,,肉味精油（9041）,食品添加剂-->食品添加剂,天津康宏盛代实业有限公司 ,天津康宏盛代实业有限公司 ,2022-06-08,,,,,,,合格,国内监督抽查(天津市市场监管委员会),2022-06-08,/
食品伙伴网,,肉味香精（9651）,食品添加剂-->食品添加剂,天津康宏盛代实业有限公司 ,天津康宏盛代实业有限公司 ,2022-06-08,,,,,,,合格,国内监督抽查(天津市市场监管委员会),2022-06-08,/
食品伙伴网,,味佳廚鱼胶粉,食品添加剂-->食品添加剂,广州市晨曦食品有限公司 ,安吉县文文调料商行 ,2022-06-10,,,,,,,合格,国内监督抽查(浙江市场监管局),2022-06-10,/
食品伙伴网,,狮宝牌吉士粉(复配着色剂),食品添加剂-->食品添加剂,普宁市狮宝食品有限公司 ,绍兴市柯桥区柯桥金隆食品批发部 ,2022-06-10,,,,,,,合格,国内监督抽查(浙江市场监管局),2022-06-10,/
食品伙伴网,,复配酸度调节剂1#,食品添加剂-->食品添加剂,福州鑫辉食品有限公司 ,福州市晋安区兴福兴超市有限公司 ,2022-06-02,,,,,,,合格,国内监督抽查(福建市场监管局),2022-06-02,
食品伙伴网,,调味油香精,食品添加剂-->食品添加剂,重庆雷檬香精香料有限公司 ,重庆雷檬香精香料有限公司 ,2022-06-02,,,,,,,合格,国内监督抽查(重庆市场监管局),2022-06-02,
食品伙伴网,,食品添加剂碳酸钠（食用碱）,食品添加剂-->食品添加剂,河南君发科技有限公司 ,重庆联佰汇商贸有限公司 ,2022-06-02,,,,,,,合格,国内监督抽查(重庆市场监管局),2022-06-02,
食品伙伴网,,食品添加剂(复配着色剂),食品添加剂-->食品添加剂,普宁市烹源食品有限公司 ,衢州农商城汪土根 ,2022-06-06,,,,,,,合格,国内监督抽查(浙江市场监管局),2022-06-06,/
食品伙伴网,,狮宝牌吉士粉(复配着色剂),食品添加剂-->食品添加剂,普宁市狮宝食品有限公司 ,青田县中心菜市场潘秀梅酱菜经营部 ,2022-06-06,,,,,,,合格,国内监督抽查(浙江市场监管局),2022-06-06,/
食品伙伴网,,食品添加剂（复配着色剂）,食品添加剂-->食品添加剂,普宁市烹源食品有限公司 ,温州市龙湾蒲州刘金明粮油店 ,2022-06-06,,,,,,,合格,国内监督抽查(浙江市场监管局),2022-06-06,/
食品伙伴网,,狮宝牌吉士粉（复配着色剂）,食品添加剂-->食品添加剂,普宁市狮宝食品有限公司 ,温州现代农贸城陈兴平调味品店 ,2022-06-06,,,,,,,合格,国内监督抽查(浙江市场监管局),2022-06-06,/
食品伙伴网,,复配甜味剂DZM-100（原蛋白糖）,食品添加剂-->食品添加剂,郑州大昌甜味剂有限公司 ,湖州吴兴阿明粮油商行 ,2022-06-06,,,,,,,合格,国内监督抽查(浙江市场监管局),2022-06-06,/
食品伙伴网,,高弹素(复配水分保持剂),食品添加剂-->食品添加剂,南通安馨特生物技术开发有限公司 ,宁波市鄞州宁东盛鑫食品经营部 ,2022-06-06,,,,,,,合格,国内监督抽查(浙江市场监管局),2022-06-06,/
食品伙伴网,,透骨增香酚-AAA,食品添加剂-->食品添加剂,青岛瑞可莱食品配料有限公司 ,宁波市鄞州宁东盛鑫食品经营部 ,2022-06-06,,,,,,,合格,国内监督抽查(浙江市场监管局),2022-06-06,/
食品伙伴网,,豆制品专用消泡剂,食品添加剂-->食品添加剂,常州市三蜂食品添加剂有限公司 ,桐乡市梧桐万成副食品商行 ,2022-06-06,,,,,,,合格,国内监督抽查(浙江市场监管局),2022-06-06,/
食品伙伴网,,嫩肉粉,食品添加剂-->食品添加剂,广州市福三和食品有限公司 ,长兴雉城金灿干鲜果商行 ,2022-06-06,,,,,,,合格,国内监督抽查(浙江市场监管局),2022-06-06,/
食品伙伴网,,蜀荣牌食品用香精,食品添加剂-->食品添加剂,成都市蜀荣雨辰食品配料有限公司 ,绍兴市泓发食品有限公司 ,2022-06-06,,,,,,,合格,国内监督抽查(浙江市场监管局),2022-06-06,/
食品伙伴网,,复配水分保持着色剂,食品添加剂-->食品添加剂,济南天骄食品添加剂有限公司 ,绍兴市越城区江记调味品商行 ,2022-06-06,,,,,,,合格,国内监督抽查(浙江市场监管局),2022-06-06,/
食品伙伴网,,俄罗斯奶油香精,食品添加剂-->食品添加剂,天津信诺森生物技术有限公司 ,天津信诺森生物技术有限公司 ,2022-06-08,,,,,,,合格,国内监督抽查(天津市市场监管委员会),2022-06-08,/
食品伙伴网,,复配增稠乳化稳定剂,食品添加剂-->食品添加剂,天津信诺森生物技术有限公司 ,天津信诺森生物技术有限公司 ,2022-06-08,,,,,,,合格,国内监督抽查(天津市市场监管委员会),2022-06-08,/
食品伙伴网,,复配乳化酶制剂梅山MIII改良剂,食品添加剂-->食品添加剂,英联马利食品（东莞）有限公司 ,郑州市管城回族区台昌食品商行 ,2022-06-29,,,,,,,合格,国内监督抽查(河南市场监管局),2022-06-29,
食品伙伴网,,馒头改良剂,食品添加剂-->食品添加剂,广州点榜食品有限公司 ,郑州市管城区豪威食化商行 ,2022-06-29,,,,,,,合格,国内监督抽查(河南市场监管局),2022-06-29,
食品伙伴网,,β-胡萝卜素,食品添加剂-->食品添加剂,河北昱华生物科技有限公司 ,郑州市管城区豪威食化商行 ,2022-06-29,,,,,,,合格,国内监督抽查(河南市场监管局),2022-06-29,
食品伙伴网,,复配防腐剂（蛋黄派用）,食品添加剂-->食品添加剂,广东广益科技实业有限公司 ,郑州泰华食品有限公司 ,2022-06-29,,,,,,,合格,国内监督抽查(河南市场监管局),2022-06-29,
食品伙伴网,,复配酶制剂面包•压面专用改良剂,食品添加剂-->食品添加剂,广州点榜食品有限公司 ,郑州市管城区豪威食化商行 ,2022-06-29,,,,,,,合格,国内监督抽查(河南市场监管局),2022-06-29,
食品伙伴网,,糕点莲蓉保鲜剂（水溶性）,食品添加剂-->食品添加剂,广东广益科技实业有限公司 ,郑州泰华食品有限公司 ,2022-06-29,,,,,,,合格,国内监督抽查(河南市场监管局),2022-06-29,
食品伙伴网,,复配甜味剂,食品添加剂-->食品添加剂,天津市科顿生物科技有限公司 ,郑州市管城区豪威食化商行 ,2022-06-29,,,,,,,合格,国内监督抽查(河南市场监管局),2022-06-29,
食品伙伴网,,食品添加剂明胶,食品添加剂-->食品添加剂,成都经典明胶有限公司 ,成都经典明胶有限公司 ,2022-06-29,,,,,,,合格,国内监督抽查(四川市场监管局),2022-06-29,
食品伙伴网,,"食品添加剂牛肉精粉Y
—8329",食品添加剂-->食品添加剂,四川蜀来宝食品有限公司 ,东坡区味汁源调味品经营部 ,2022-06-29,,,,,,,合格,国内监督抽查(四川市场监管局),2022-06-29,
食品伙伴网,,食品添加剂明胶,食品添加剂-->食品添加剂,四川瑞宝生物科技股份有限公司 ,四川瑞宝生物科技股份有限公司 ,2022-06-29,,,,,,,合格,国内监督抽查(四川市场监管局),2022-06-29,
食品伙伴网,,"食品添加剂
MSD120001
火锅増香剂",食品添加剂-->食品添加剂,"生产方：成都市味大师
食品有限公司；委托商：上海曼斯顿香精有
限公司 ",东坡区晓林调味品经营部 ,2022-06-29,,,,,,,合格,国内监督抽查(四川市场监管局),2022-06-29,
食品伙伴网,,复配腌渍红油小菜抗氧化剂,食品添加剂-->食品添加剂,四川成化食品科技有限公司 ,四川成化食品科技有限公司 ,2022-06-29,,,,,,,合格,国内监督抽查(四川市场监管局),2022-06-29,
食品伙伴网,,"食品添加剂大骨高汤
（膏状香精）Y—
8314",食品添加剂-->食品添加剂,四川蜀来宝食品有限公司 ,东坡区味汁源调味品经营部 ,2022-06-29,,,,,,,合格,国内监督抽查(四川市场监管局),2022-06-29,
食品伙伴网,,食品添加剂5047火锅飘香剂（油体）,食品添加剂-->食品添加剂,成都市蜀荣雨辰食品配料有限公司 ,德阳市区味香源食品配料经营部 ,2022-06-29,,,,,,,合格,国内监督抽查(四川市场监管局),2022-06-29,
食品伙伴网,,食品添加剂明胶,食品添加剂-->食品添加剂,四川汇宇生物技术有限公司 ,四川汇宇生物技术有限公司 ,2022-06-29,,,,,,,合格,国内监督抽查(四川市场监管局),2022-06-29,
食品伙伴网,,食品添加剂复配水产品水分保持剂KD-16,食品添加剂-->食品添加剂,四川金地亚美科技有限公司 ,四川金地亚美科技有限公司 ,2022-06-29,,,,,,,合格,国内监督抽查(四川市场监管局),2022-06-29,
食品伙伴网,,食品添加剂复配面粉处理剂（面包改良剂）,食品添加剂-->食品添加剂,广州谷琦生物技术有限公司 ,永城市东城区中山烘焙原料商行 ,2022-06-29,,,,,,,合格,国内监督抽查(河南市场监管局),2022-06-29,
食品伙伴网,,明胶,食品添加剂-->食品添加剂,河南亿康明胶有限公司 ,河南亿康明胶有限公司 ,2022-06-29,,,,,,,合格,国内监督抽查(河南市场监管局),2022-06-29,
食品伙伴网,,明胶,食品添加剂-->食品添加剂,河南亿康明胶有限公司 ,河南亿康明胶有限公司 ,2022-06-29,,,,,,,合格,国内监督抽查(河南市场监管局),2022-06-29,
食品伙伴网,,复配稳定乳化增稠剂,食品添加剂-->食品添加剂,上海昕宜食品辅料有限公司 ,郑州市管城区三本食化商行 ,2022-06-29,,,,,,,合格,国内监督抽查(河南市场监管局),2022-06-29,
食品伙伴网,,复配甜味剂,食品添加剂-->食品添加剂,郑州大昌甜味剂有限公司 ,焦作市解放区车站街味源食化商店 ,2022-06-29,,,,,,,合格,国内监督抽查(河南市场监管局),2022-06-29,
食品伙伴网,,亮典（大红色）,食品添加剂-->食品添加剂,广州市雪瑞食品有限公司 ,郑州市管城区三本食化商行 ,2022-06-29,,,,,,,合格,国内监督抽查(河南市场监管局),2022-06-29,
食品伙伴网,,复配乳化剂（超软面包改良剂）,食品添加剂-->食品添加剂,广州市富乐尔科技有限公司黄埔分公司 ,郑州市管城区三本食化商行 ,2022-06-29,,,,,,,合格,国内监督抽查(河南市场监管局),2022-06-29,
食品伙伴网,,复配水分保持剂,食品添加剂-->食品添加剂,济南天仙食品添加剂销售有限公司 ,焦作市解放区车站街味源食化商店 ,2022-06-29,,,,,,,合格,国内监督抽查(河南市场监管局),2022-06-29,
食品伙伴网,,食品添加剂复配稳定乳化增稠剂,食品添加剂-->食品添加剂,上海昕宜食品辅料有限公司 ,郑州同善德食品有限公司 ,2022-06-29,,,,,,,合格,国内监督抽查(河南市场监管局),2022-06-29,
食品伙伴网,,亮典（黑色）,食品添加剂-->食品添加剂,广州市雪瑞食品有限公司 ,郑州市管城区三本食化商行 ,2022-06-29,,,,,,,合格,国内监督抽查(河南市场监管局),2022-06-29,
食品伙伴网,,护色剂,食品添加剂-->食品添加剂,哈尔滨亿达食品原料有限公司 ,焦作市解放区车站街味源食化商店 ,2022-06-29,,,,,,,合格,国内监督抽查(河南市场监管局),2022-06-29,
食品伙伴网,,复配面包乳化剂酶制剂,食品添加剂-->食品添加剂,乐斯福(明光)有限公司 ,郑州市管城区万佳食化商行 ,2022-06-29,,,,,,,合格,国内监督抽查(河南市场监管局),2022-06-29,
食品伙伴网,,复配酸度调节剂(塔塔粉),食品添加剂-->食品添加剂,广州市联和食品加工有限公司 ,郑州市管城区音悦食化商行 ,2022-06-29,,,,,,,合格,国内监督抽查(河南市场监管局),2022-06-29,
食品伙伴网,,新意吉士粉末香精,食品添加剂-->食品添加剂,上海昕宜食品辅料有限公司 ,郑州市管城区音悦食化商行 ,2022-06-29,,,,,,,合格,国内监督抽查(河南市场监管局),2022-06-29,
食品伙伴网,,食品添加剂明胶片（又名吉利丁片）,食品添加剂-->食品添加剂,青海益洁生物工程有限公司 ,三门峡绿宝食品有限公司 ,2022-06-29,,,,,,,合格,国内监督抽查(河南市场监管局),2022-06-29,
食品伙伴网,,复配着色剂复配植物炭黑200,食品添加剂-->食品添加剂,江门高迪食品有限公司新会分公司 ,郑州市管城区雄鹰烘焙原料商行 ,2022-06-29,,,,,,,合格,国内监督抽查(河南市场监管局),2022-06-29,
食品伙伴网,,面制品增筋剂,食品添加剂-->食品添加剂,北京北方霞光食品添加剂有限公司房山分厂 ,漯河新捷食品配料有限公司 ,2022-06-29,,,,,,,合格,国内监督抽查(河南市场监管局),2022-06-29,
食品伙伴网,,烧饼搭档(烧饼改良剂),食品添加剂-->食品添加剂,郑州银海生物技术有限公司 ,郾城区沙北万达食化商行 ,2022-06-29,,,,,,,合格,国内监督抽查(河南市场监管局),2022-06-29,
食品伙伴网,,赛貂蝉无铝害油条膨松剂,食品添加剂-->食品添加剂,郑州银海生物技术有限公司 ,郾城区沙北万达食化商行 ,2022-06-29,,,,,,,合格,国内监督抽查(河南市场监管局),2022-06-29,
食品伙伴网,,复配面包酶制乳化剂,食品添加剂-->食品添加剂,北京北方霞光食品添加剂有限公司房山分厂 ,漯河新捷食品配料有限公司 ,2022-06-29,,,,,,,合格,国内监督抽查(河南市场监管局),2022-06-29,
食品伙伴网,,复配食品添加剂复配着色剂15,食品添加剂-->食品添加剂,上海染料研究所有限公司南通分公司 ,三门峡绿宝食品有限公司 ,2022-06-29,,,,,,,合格,国内监督抽查(河南市场监管局),2022-06-29,
食品伙伴网,,复配小麦粉制品稳定剂,食品添加剂-->食品添加剂,郑州海韦力食品工业有限公司 ,新郑市惠发食品配料商行 ,2022-06-29,,,,,,,合格,国内监督抽查(河南市场监管局),2022-06-29,
