信息来源,搜索条件,物料名称,产品分类,生产商,供应商,生产日期,批号,项目分类,检测项目,单位,检测结果,限量值,判定,发布单位,发布日期,备注
食品伙伴网,,香甜泡打粉,食品添加剂-->食品添加剂,沧州市华海顺达粮油调料有限公司 ,沧州市华海顺达粮油调料有限公司 ,2022-03-29,,,,,,,合格,国内监督抽查(河北市场监管局),2022-03-29,
食品伙伴网,,食用小苏打,食品添加剂-->食品添加剂,河北耀隆商贸有限公司 ,河北耀隆商贸有限公司 ,2022-03-29,,,,,,,合格,国内监督抽查(河北市场监管局),2022-03-29,
食品伙伴网,,食用碱面,食品添加剂-->食品添加剂,河北耀隆商贸有限公司 ,河北耀隆商贸有限公司 ,2022-03-29,,,,,,,合格,国内监督抽查(河北市场监管局),2022-03-29,
食品伙伴网,,3-巯基-2-丁酮,食品添加剂-->食品添加剂,石家庄和中科技有限公司 ,石家庄和中科技有限公司 ,2022-03-29,,,,,,,合格,国内监督抽查(河北市场监管局),2022-03-29,
食品伙伴网,,复配水分保持剂DW-01,食品添加剂-->食品添加剂,霸州市钧聪生物科技有限公司 ,霸州市钧聪生物科技有限公司 ,2022-03-29,,,,,,,合格,国内监督抽查(河北市场监管局),2022-03-29,
食品伙伴网,,复配水分保持剂DW-01,食品添加剂-->食品添加剂,霸州市钧聪生物科技有限公司 ,霸州市钧聪生物科技有限公司 ,2022-03-29,,,,,,,合格,国内监督抽查(河北市场监管局),2022-03-29,
食品伙伴网,,食用纯碱（分装）,食品添加剂-->食品添加剂,大城县不老松食品有限公司 ,大城县不老松食品有限公司 ,2022-03-29,,,,,,,合格,国内监督抽查(河北市场监管局),2022-03-29,
食品伙伴网,,食用小苏打（分装）,食品添加剂-->食品添加剂,大城县不老松食品有限公司 ,大城县不老松食品有限公司 ,2022-03-29,,,,,,,合格,国内监督抽查(河北市场监管局),2022-03-29,
食品伙伴网,,复配消泡剂,食品添加剂-->食品添加剂,常州豆晶食品科技有限公司 ,廊坊市广阳区爱民东道陈智酱菜调料经销部 ,2022-03-29,,,,,,,合格,国内监督抽查(河北市场监管局),2022-03-29,
食品伙伴网,,5262荔枝汁味香精,食品添加剂-->食品添加剂,杭州西湖香精香料有限公司 ,桥西区品恒食品经营部 ,2022-03-29,,,,,,,合格,国内监督抽查(河北市场监管局),2022-03-29,
食品伙伴网,,复配食品添加剂复配着色剂配方3,食品添加剂-->食品添加剂,天津多福源实业有限公司 ,廊坊市广阳区爱民东道百变食品添加剂经销部 ,2022-03-29,,,,,,,合格,国内监督抽查(河北市场监管局),2022-03-29,
食品伙伴网,,大骨白汤膏体状,食品添加剂-->食品添加剂,青岛百香泉食品配料有限公司 ,桥东区盛芳调料门市 ,2022-03-29,,,,,,,合格,国内监督抽查(河北市场监管局),2022-03-29,
食品伙伴网,,柒龙烤鱼香膏（膏体状）（食品用香精）,食品添加剂-->食品添加剂,青岛香海盛食品配料有限公司 ,贵阳市南明区渝黔食品经营部 ,2022-03-29,,,,,,,合格,国内监督抽查(贵州市场监管局),2022-03-29,
食品伙伴网,,肉类腌制剂,食品添加剂-->食品添加剂,烟台佳晶食品工业有限公司 ,西安市莲湖区肠衣食品配料商行 ,2022-03-25,,,,,,,合格,国内监督抽查(陕西市场监管局),2022-03-25,
食品伙伴网,,复配豆制品消泡剂,食品添加剂-->食品添加剂,江苏卓云豆宝食品有限公司 ,西安市莲湖区肠衣食品配料商行 ,2022-03-25,,,,,,,合格,国内监督抽查(陕西市场监管局),2022-03-25,
食品伙伴网,,复配着色剂（红色素003）,食品添加剂-->食品添加剂,河北昱华生物科技有限公司 ,河北昱华生物科技有限公司 ,2022-03-29,,,,,,,合格,国内监督抽查(河北市场监管局),2022-03-29,
食品伙伴网,,食品添加剂复配乳化剂,食品添加剂-->食品添加剂,长春市昌运食品添加剂有限公司 ,秦皇岛市荣升食品添加剂有限公司 ,2022-03-29,,,,,,,合格,国内监督抽查(河北市场监管局),2022-03-29,
食品伙伴网,,食品添加剂复配凝固剂,食品添加剂-->食品添加剂,临沂银豆食品科技有限公司 ,秦皇岛市荣升食品添加剂有限公司 ,2022-03-29,,,,,,,合格,国内监督抽查(河北市场监管局),2022-03-29,
食品伙伴网,,透骨增香剂-AAA（拌合型粉末）,食品添加剂-->食品添加剂,青岛瑞香源食品有限公司 ,邯郸市肥乡区东海调料门市 ,2022-03-29,,,,,,,合格,国内监督抽查(河北市场监管局),2022-03-29,
食品伙伴网,,复配甜味乳化剂,食品添加剂-->食品添加剂,哈尔滨顺达实业发展有限公司 ,秦皇岛市荣升食品添加剂有限公司 ,2022-03-29,,,,,,,合格,国内监督抽查(河北市场监管局),2022-03-29,
食品伙伴网,,湘桂包子馒头改良剂X-200复配发酵面制品酶制剂抗氧化剂,食品添加剂-->食品添加剂,乐斯福（明光）有限公司 ,秦皇岛市荣升食品添加剂有限公司 ,2022-03-29,,,,,,,合格,国内监督抽查(河北市场监管局),2022-03-29,
食品伙伴网,,碳酸钠(食用纯碱),食品添加剂-->食品添加剂,唐山三友化工股份有限公司 ,唐山三友化工股份有限公司 ,2022-03-29,,,,,,,合格,国内监督抽查(河北市场监管局),2022-03-29,
食品伙伴网,,复配增稠剂(型号:JLBW-112),食品添加剂-->食品添加剂,河北兄弟伊兰食品科技股份有限公司 ,河北兄弟伊兰食品科技股份有限公司 ,2022-03-29,,,,,,,合格,国内监督抽查(河北市场监管局),2022-03-29,
食品伙伴网,,焦香香精,食品添加剂-->食品添加剂,河北省天利海香精香料有限公司 ,河北省天利海香精香料有限公司 ,2022-03-29,,,,,,,合格,国内监督抽查(河北市场监管局),2022-03-29,
食品伙伴网,,复配水分保持乳化剂,食品添加剂-->食品添加剂,河北伊唐生物技术有限公司 ,河北伊唐生物技术有限公司 ,2022-03-29,,,,,,,合格,国内监督抽查(河北市场监管局),2022-03-29,
食品伙伴网,,辣椒红(食品添加剂),食品添加剂-->食品添加剂,晨光生物科技集团股份有限公司 ,晨光生物科技集团股份有限公司 ,2022-03-29,,,,,,,合格,国内监督抽查(河北市场监管局),2022-03-29,
食品伙伴网,,柠檬酸亚锡二钠,食品添加剂-->食品添加剂,博野县邦恩食品辅料有限公司 ,博野县邦恩食品辅料有限公司 ,2022-03-29,,,,,,,合格,国内监督抽查(河北市场监管局),2022-03-29,
食品伙伴网,,姜黄素,食品添加剂-->食品添加剂,邢台红日生物科技有限公司 ,邢台红日生物科技有限公司 ,2022-03-29,,,,,,,合格,国内监督抽查(河北市场监管局),2022-03-29,
食品伙伴网,,食品用香精[浆（膏）状香精]（3401鸡肉味）,食品添加剂-->食品添加剂,石家庄市顶极香精香料有限公司 ,石家庄市顶极香精香料有限公司 ,2022-03-29,,,,,,,合格,国内监督抽查(河北市场监管局),2022-03-29,
食品伙伴网,,"食品添加剂特纯乙基麦芽酚
（食品用香精）",食品添加剂-->食品添加剂,四川香典食品有限公司 ,四川香典食品有限公司 ,2022-03-18,,,,,,,合格,国内监督抽查(四川市场监管局),2022-03-18,
食品伙伴网,,食品添加剂斧头牌食粉,食品添加剂-->食品添加剂,广东金泰食品股份有限公司 ,成都宇柒商贸有限公司 ,2022-03-18,,,,,,,合格,国内监督抽查(四川市场监管局),2022-03-18,
食品伙伴网,,食品添加剂氮气,食品添加剂-->食品添加剂,四川梅塞尔气体产品有限公司 ,四川梅塞尔气体产品有限公司 ,2022-03-18,,,,,,,合格,国内监督抽查(四川市场监管局),2022-03-18,
食品伙伴网,,食品添加剂氮气,食品添加剂-->食品添加剂,阿坝汶川侨源气体有限公司 ,阿坝汶川侨源气体有限公司 ,2022-03-18,,,,,,,合格,国内监督抽查(四川市场监管局),2022-03-18,
食品伙伴网,,食品添加剂焦糖色,食品添加剂-->食品添加剂,丰城恒泰食品有限公司 ,双流区西航港加御食品添加剂经营部 ,2022-03-18,,,,,,,合格,国内监督抽查(四川市场监管局),2022-03-18,
食品伙伴网,,食品添加剂黄原胶,食品添加剂-->食品添加剂,鄂尔多斯市中轩生化股份有限公司 ,双流区西航港加御食品添加剂经营部 ,2022-03-18,,,,,,,合格,国内监督抽查(四川市场监管局),2022-03-18,
食品伙伴网,,猪肉味香精(浆膏状),食品添加剂-->食品添加剂,青岛千泉食品配料有限公司 ,西安市莲湖区鸿坤食品经销部 ,2022-03-25,,,,,,,合格,国内监督抽查(陕西市场监管局),2022-03-25,
食品伙伴网,,肉类增香粉(拌和型粉末),食品添加剂-->食品添加剂,青岛千泉食品配料有限公司 ,西安市莲湖区鸿坤食品经销部 ,2022-03-25,,,,,,,合格,国内监督抽查(陕西市场监管局),2022-03-25,
食品伙伴网,,辣椒油树脂,食品添加剂-->食品添加剂,邯郸市朝霞生物科技有限公司 ,西安市莲湖区鸿坤食品经销部 ,2022-03-25,,,,,,,合格,国内监督抽查(陕西市场监管局),2022-03-25,
食品伙伴网,,鸡肉粉精(拌和型粉末香精),食品添加剂-->食品添加剂,阳江市星光食品配料有限公司 ,西安市莲湖区星光食品配料商行 ,2022-03-25,,,,,,,合格,国内监督抽查(陕西市场监管局),2022-03-25,
食品伙伴网,,复配着色剂,食品添加剂-->食品添加剂,齐齐哈尔市鹤润食品原料有限公司 ,西安市莲湖区星光食品配料商行 ,2022-03-25,,,,,,,合格,国内监督抽查(陕西市场监管局),2022-03-25,
食品伙伴网,,复配肉制品防腐剂Ι号,食品添加剂-->食品添加剂,齐齐哈尔市鹤润食品原料有限公司 ,陕西味美斋食品科技有限公司 ,2022-03-25,,,,,,,合格,国内监督抽查(陕西市场监管局),2022-03-25,
食品伙伴网,,食品添加剂复配着色剂,食品添加剂-->食品添加剂,广东科隆生物科技有限公司 ,陕西味美斋食品科技有限公司 ,2022-03-25,,,,,,,合格,国内监督抽查(陕西市场监管局),2022-03-25,
食品伙伴网,,复配水分保持剂Ⅱ(复合磷酸盐),食品添加剂-->食品添加剂,徐州海成食品添加剂有限公司 ,西安秉新食品有限公司 ,2022-03-25,,,,,,,合格,国内监督抽查(陕西市场监管局),2022-03-25,
食品伙伴网,,复配水分保持Ⅲ（强面精）,食品添加剂-->食品添加剂,徐州海成食品添加剂有限公司 ,西安秉新食品有限公司 ,2022-03-25,,,,,,,合格,国内监督抽查(陕西市场监管局),2022-03-25,
食品伙伴网,,甜源糖复配甜味剂,食品添加剂-->食品添加剂,重庆市田野生物工程有限公司 ,西安市莲湖区华盛食品添加剂经销部 ,2022-03-25,,,,,,,合格,国内监督抽查(陕西市场监管局),2022-03-25,
食品伙伴网,,肉馅宝,食品添加剂-->食品添加剂,平度市高泰克食品配料厂 ,漯河市召陵区恒昌食品添加剂商行 ,2022-04-13,,,,,,,合格,国内监督抽查(河南市场监管局),2022-04-13,
食品伙伴网,,透骨增香粉,食品添加剂-->食品添加剂,平度市高泰克食品配料厂 ,漯河市召陵区恒昌食品添加剂商行 ,2022-04-13,,,,,,,合格,国内监督抽查(河南市场监管局),2022-04-13,
食品伙伴网,,猪肉香膏,食品添加剂-->食品添加剂,平度市高泰克食品配料厂 ,漯河市召陵区恒昌食品添加剂商行 ,2022-04-13,,,,,,,合格,国内监督抽查(河南市场监管局),2022-04-13,
食品伙伴网,,复配酸度调节剂（塔塔粉）,食品添加剂-->食品添加剂,广州市顶源食品有限公司 ,郑州市管城区多源食化商行 ,2022-04-13,,,,,,,合格,国内监督抽查(河南市场监管局),2022-04-13,
食品伙伴网,,复配膨松剂（双效泡打粉）,食品添加剂-->食品添加剂,广州市顶源食品有限公司 ,郑州市管城区多源食化商行 ,2022-04-13,,,,,,,合格,国内监督抽查(河南市场监管局),2022-04-13,
食品伙伴网,,肉类保水护色剂,食品添加剂-->食品添加剂,济南天骄食品添加剂有限公司 ,漯河市召陵区恒昌食品添加剂商行 ,2022-04-13,,,,,,,合格,国内监督抽查(河南市场监管局),2022-04-13,
食品伙伴网,,食用消泡剂,食品添加剂-->食品添加剂,广州美晨科技实业有限公司 ,漯河市召陵区恒昌食品添加剂商行 ,2022-04-13,,,,,,,合格,国内监督抽查(河南市场监管局),2022-04-13,
食品伙伴网,,特级牛肉精粉,食品添加剂-->食品添加剂,青岛鸿鑫源食品配料有限公司 ,新郑市龙湖镇道明食化商行 ,2022-04-13,,,,,,,合格,国内监督抽查(河南市场监管局),2022-04-13,
食品伙伴网,,复配乳化剂,食品添加剂-->食品添加剂,河南四维生物技术有限公司 ,新郑市龙湖镇道明食化商行 ,2022-04-13,,,,,,,合格,国内监督抽查(河南市场监管局),2022-04-13,
食品伙伴网,,牛肉香精,食品添加剂-->食品添加剂,上海鑫迪食品有限公司 ,平顶山市卫东区百味杰食化商行 ,2022-04-13,,,,,,,合格,国内监督抽查(河南市场监管局),2022-04-13,
食品伙伴网,,超浓缩鲜香粉（粉末）,食品添加剂-->食品添加剂,青岛屏祥源餐饮配料有限公司 ,新郑市惠发食品配料商行 ,2022-04-13,,,,,,,合格,国内监督抽查(河南市场监管局),2022-04-13,
食品伙伴网,,肉香乙基增香剂,食品添加剂-->食品添加剂,青岛豪坤食品配料有限公司 ,新郑市惠发食品配料商行 ,2022-04-13,,,,,,,合格,国内监督抽查(河南市场监管局),2022-04-13,
食品伙伴网,,肉脆香精,食品添加剂-->食品添加剂,厦门市味宝调味品有限公司 ,漯河市召陵区恒昌食品添加剂商行 ,2022-04-13,,,,,,,合格,国内监督抽查(河南市场监管局),2022-04-13,
食品伙伴网,,增筋王,食品添加剂-->食品添加剂,河南双城食品有限公司 ,漯河市召陵区恒昌食品添加剂商行 ,2022-04-13,,,,,,,合格,国内监督抽查(河南市场监管局),2022-04-13,
食品伙伴网,,食品用香精（粉末香精拌和型）,食品添加剂-->食品添加剂,石家庄市顶极香精香料有限公司 ,郑州市管城区焕芳食化商行 ,2022-04-13,,,,,,,合格,国内监督抽查(河南市场监管局),2022-04-13,
食品伙伴网,,浓缩鲜香粉,食品添加剂-->食品添加剂,青岛香巴尔食品配料有限公司 ,郑州市管城区焕芳食化商行 ,2022-04-13,,,,,,,合格,国内监督抽查(河南市场监管局),2022-04-13,
食品伙伴网,,JX-乙基增香剂,食品添加剂-->食品添加剂,青岛瑞可莱食品配料有限公司 ,三门峡绿宝食品有限公司 ,2022-04-13,,,,,,,合格,国内监督抽查(河南市场监管局),2022-04-13,
食品伙伴网,,食品添加剂复配膨松剂,食品添加剂-->食品添加剂,上海早苗食品有限公司 ,新乡市一统商贸有限公司 ,2022-04-13,,,,,,,合格,国内监督抽查(河南市场监管局),2022-04-13,
食品伙伴网,,牛肉香精,食品添加剂-->食品添加剂,青岛奥一奇顿食品配料有限公司 ,新乡市一统商贸有限公司 ,2022-04-13,,,,,,,合格,国内监督抽查(河南市场监管局),2022-04-13,
食品伙伴网,,牛奶香粉,食品添加剂-->食品添加剂,连云港惠源食品配料有限公司 ,新乡市一统商贸有限公司 ,2022-04-13,,,,,,,合格,国内监督抽查(河南市场监管局),2022-04-13,
食品伙伴网,,复配稳定乳化增稠剂,食品添加剂-->食品添加剂,上海昕宜食品辅料有限公司 ,郑州市管城区三本食化商行 ,2022-04-13,,,,,,,合格,国内监督抽查(河南市场监管局),2022-04-13,
食品伙伴网,,复配增稠剂（浓香吉士粉）,食品添加剂-->食品添加剂,广州市富乐尔科技有限公司黄浦分公司 ,郑州市管城区三本食化商行 ,2022-04-13,,,,,,,合格,国内监督抽查(河南市场监管局),2022-04-13,
食品伙伴网,,牛奶香粉,食品添加剂-->食品添加剂,广东奇乐趣食品科技有限公司（美晨集团下属公司） ,郑州市管城区三本食化商行 ,2022-04-13,,,,,,,合格,国内监督抽查(河南市场监管局),2022-04-13,
食品伙伴网,,牛骨白汤（膏体状）,食品添加剂-->食品添加剂,青岛金百合调味香料有限公司 ,封丘县永胜食化门市部 ,2022-04-13,,,,,,,合格,国内监督抽查(河南市场监管局),2022-04-13,
食品伙伴网,,盐焗鸡料粉（拌合型粉末）,食品添加剂-->食品添加剂,青岛金百合调味香料有限公司 ,封丘县永胜食化门市部 ,2022-04-13,,,,,,,合格,国内监督抽查(河南市场监管局),2022-04-13,
食品伙伴网,,肉馅王（拌合型粉末）,食品添加剂-->食品添加剂,青岛金百合调味香料有限公司 ,封丘县永胜食化门市部 ,2022-04-13,,,,,,,合格,国内监督抽查(河南市场监管局),2022-04-13,
食品伙伴网,,特级羊肉精粉,食品添加剂-->食品添加剂,青岛华玉食品添加剂有限公司 ,新郑市龙湖镇道明食化商行 ,2022-04-13,,,,,,,合格,国内监督抽查(河南市场监管局),2022-04-13,
食品伙伴网,,火锅增香膏,食品添加剂-->食品添加剂,青岛华玉食品添加剂有限公司 ,新郑市龙湖镇道明食化商行 ,2022-04-13,,,,,,,合格,国内监督抽查(河南市场监管局),2022-04-13,
食品伙伴网,,麻辣烫专用香膏,食品添加剂-->食品添加剂,青岛华玉食品添加剂有限公司 ,新郑市龙湖镇道明食化商行 ,2022-04-13,,,,,,,合格,国内监督抽查(河南市场监管局),2022-04-13,
食品伙伴网,,金牌回味王,食品添加剂-->食品添加剂,青岛香海盛食品配料有限公司 ,漯河市召陵区华康食品添加剂商行 ,2022-04-13,,,,,,,合格,国内监督抽查(河南市场监管局),2022-04-13,
食品伙伴网,,鸡肉味油状香精,食品添加剂-->食品添加剂,聊城市新恒基生物科技有限公司 ,漯河市召陵区华康食品添加剂商行 ,2022-04-13,,,,,,,合格,国内监督抽查(河南市场监管局),2022-04-13,
食品伙伴网,,晨馨蛋白糖,食品添加剂-->食品添加剂,深圳市晨馨香精香料有限公司 ,漯河市召陵区华康食品添加剂商行 ,2022-04-13,,,,,,,合格,国内监督抽查(河南市场监管局),2022-04-13,
食品伙伴网,,食品添加剂复配着色剂大红,食品添加剂-->食品添加剂,广州市御品香食品有限公司 ,郑州市管城回族区鑫佰味食化商行 ,2022-04-13,,,,,,,合格,国内监督抽查(河南市场监管局),2022-04-13,
食品伙伴网,,食品添加剂复配着色剂绿色,食品添加剂-->食品添加剂,广州市御品香食品有限公司 ,郑州市管城回族区鑫佰味食化商行 ,2022-04-13,,,,,,,合格,国内监督抽查(河南市场监管局),2022-04-13,
食品伙伴网,,复配着色剂黑色,食品添加剂-->食品添加剂,广州市雪瑞食品有限公司 ,郑州市管城区欧利食化商行 ,2022-04-13,,,,,,,合格,国内监督抽查(河南市场监管局),2022-04-13,
食品伙伴网,,复配着色剂大红色,食品添加剂-->食品添加剂,广州市雪瑞食品有限公司 ,郑州市管城区欧利食化商行 ,2022-04-13,,,,,,,合格,国内监督抽查(河南市场监管局),2022-04-13,
食品伙伴网,,复配着色剂（大红色）,食品添加剂-->食品添加剂,广州陈氏龙山食品有限公司 ,三门峡绿宝食品有限公司 ,2022-04-13,,,,,,,合格,国内监督抽查(河南市场监管局),2022-04-13,
食品伙伴网,,复配着色剂（黑色）,食品添加剂-->食品添加剂,广州陈氏龙山食品有限公司 ,三门峡绿宝食品有限公司 ,2022-04-13,,,,,,,合格,国内监督抽查(河南市场监管局),2022-04-13,
食品伙伴网,,复配着色剂（粉红色）,食品添加剂-->食品添加剂,广州陈氏龙山食品有限公司 ,三门峡绿宝食品有限公司 ,2022-04-13,,,,,,,合格,国内监督抽查(河南市场监管局),2022-04-13,
食品伙伴网,,复配着色剂,食品添加剂-->食品添加剂,广州谷琦生物技术有限公司 ,新乡市一统商贸有限公司 ,2022-04-13,,,,,,,合格,国内监督抽查(河南市场监管局),2022-04-13,
食品伙伴网,,复配着色剂,食品添加剂-->食品添加剂,广州谷琦生物技术有限公司 ,新乡市一统商贸有限公司 ,2022-04-13,,,,,,,合格,国内监督抽查(河南市场监管局),2022-04-13,
食品伙伴网,,吉利丁粉（复配增稠剂）,食品添加剂-->食品添加剂,广州市锐力发展有限公司 ,新乡市一统商贸有限公司 ,2022-04-13,,,,,,,合格,国内监督抽查(河南市场监管局),2022-04-13,
食品伙伴网,,强面筋,食品添加剂-->食品添加剂,杭州聚和生物科技有限公司 ,新郑市龙湖镇金源祥食化商行 ,2022-04-13,,,,,,,合格,国内监督抽查(河南市场监管局),2022-04-13,
食品伙伴网,,猪肉味香精,食品添加剂-->食品添加剂,青岛千泉食品配料有限公司 ,新郑市龙湖镇金源祥食化商行 ,2022-04-13,,,,,,,合格,国内监督抽查(河南市场监管局),2022-04-13,
食品伙伴网,,复配增稠剂,食品添加剂-->食品添加剂,滕州市香凝生物工程有限责任公司 ,新郑市龙湖镇创新食化商行 ,2022-04-13,,,,,,,合格,国内监督抽查(河南市场监管局),2022-04-13,
食品伙伴网,,复配着色剂绿色,食品添加剂-->食品添加剂,广州市雪瑞食品有限公司 ,郑州市管城区欧利食化商行 ,2022-04-13,,,,,,,合格,国内监督抽查(河南市场监管局),2022-04-13,
食品伙伴网,,复配面包乳化剂酶制剂,食品添加剂-->食品添加剂,乐斯福(明光)有限公司 ,郑州市管城区万佳食化商行 ,2022-04-13,,,,,,,合格,国内监督抽查(河南市场监管局),2022-04-13,
食品伙伴网,,复配酸度调节剂(塔塔粉),食品添加剂-->食品添加剂,广州市联和食品加工有限公司 ,郑州市管城区音悦食化商行 ,2022-04-13,,,,,,,合格,国内监督抽查(河南市场监管局),2022-04-13,
食品伙伴网,,酸度调节剂,食品添加剂-->食品添加剂,阳江市阳东食品香料公司 ,新郑市龙湖镇金源祥食化商行 ,2022-04-13,,,,,,,合格,国内监督抽查(河南市场监管局),2022-04-13,
食品伙伴网,,复配消泡剂食用消泡剂,食品添加剂-->食品添加剂,广州美晨科技实业有限公司 ,三门峡绿宝食品有限公司 ,2022-04-13,,,,,,,合格,国内监督抽查(河南市场监管局),2022-04-13,
食品伙伴网,,复配消泡剂,食品添加剂-->食品添加剂,河南祥和消泡剂有限公司 ,三门峡绿宝食品有限公司 ,2022-04-13,,,,,,,合格,国内监督抽查(河南市场监管局),2022-04-13,
食品伙伴网,,复配乳化酶制剂梅山MIII改良剂,食品添加剂-->食品添加剂,英联马利食品(东莞)有限公司 ,三门峡绿宝食品有限公司 ,2022-04-13,,,,,,,合格,国内监督抽查(河南市场监管局),2022-04-13,
食品伙伴网,,复配甜味剂H,食品添加剂-->食品添加剂,济南泉康食品配料有限公司章丘分公司 ,三门峡绿宝食品有限公司 ,2022-04-13,,,,,,,合格,国内监督抽查(河南市场监管局),2022-04-13,
食品伙伴网,,复配甜味乳化剂,食品添加剂-->食品添加剂,哈尔滨顺达实业发展有限公司 ,新乡市一统商贸有限公司 ,2022-04-13,,,,,,,合格,国内监督抽查(河南市场监管局),2022-04-13,
食品伙伴网,,复配糕点酸度调节剂,食品添加剂-->食品添加剂,上海早苗食品有限公司 ,新乡市一统商贸有限公司 ,2022-04-13,,,,,,,合格,国内监督抽查(河南市场监管局),2022-04-13,
食品伙伴网,,129康佳鲜奶粉末香精,食品添加剂-->食品添加剂,浙江杭曼食品科技有限公司 ,新郑市龙湖镇道明食化商行 ,2022-04-13,,,,,,,合格,国内监督抽查(河南市场监管局),2022-04-13,
食品伙伴网,,复配稳定剂,食品添加剂-->食品添加剂,山东五丰生物科技有限公司 ,新郑市龙湖镇兆华食化商行 ,2022-04-13,,,,,,,合格,国内监督抽查(河南市场监管局),2022-04-13,
食品伙伴网,,复配酶制剂抗氧化剂,食品添加剂-->食品添加剂,山东五丰生物科技有限公司 ,新郑市龙湖镇兆华食化商行 ,2022-04-13,,,,,,,合格,国内监督抽查(河南市场监管局),2022-04-13,
食品伙伴网,,大厨房肉宝（拌和型粉末）,食品添加剂-->食品添加剂,青岛新联康食品配料有限公司 ,新郑市龙湖镇腾龙食化商行 ,2022-04-13,,,,,,,合格,国内监督抽查(河南市场监管局),2022-04-13,
食品伙伴网,,食用色素绿色,食品添加剂-->食品添加剂,广州市诚为先食品有限公司 ,郑州市管城回族区鑫佰味食化商行 ,2022-04-13,,,,,,,合格,国内监督抽查(河南市场监管局),2022-04-13,
食品伙伴网,,食用色素紫色,食品添加剂-->食品添加剂,广州市诚为先食品有限公司 ,郑州市管城回族区鑫佰味食化商行 ,2022-04-13,,,,,,,合格,国内监督抽查(河南市场监管局),2022-04-13,
食品伙伴网,,食品添加剂复配着色剂粉红,食品添加剂-->食品添加剂,广州市御品香食品有限公司 ,郑州市管城回族区鑫佰味食化商行 ,2022-04-13,,,,,,,合格,国内监督抽查(河南市场监管局),2022-04-13,
食品伙伴网,,复配生湿面制品稳定剂,食品添加剂-->食品添加剂,商丘市三得利食品有限公司 ,新郑市龙湖镇天地食化商行 ,2022-04-13,,,,,,,合格,国内监督抽查(河南市场监管局),2022-04-13,
食品伙伴网,,2018-B芝麻香精(油体),食品添加剂-->食品添加剂,成都市蜀荣雨辰食品配料有限公司 ,新郑市龙湖镇创新食化商行 ,2022-04-13,,,,,,,合格,国内监督抽查(河南市场监管局),2022-04-13,
