信息来源,搜索条件,物料名称,产品分类,生产商,供应商,生产日期,批号,项目分类,检测项目,单位,检测结果,限量值,判定,发布单位,发布日期,备注
食品伙伴网,,食品添加剂增香粉（粉状）食品用香精,食品添加剂-->食品添加剂,济宁大元食品有限公司 ,崇川区存红食品经营部 ,2021-08-27,,,,,,,合格,国内监督抽查(江苏市场监管局),2021-08-27,
食品伙伴网,,复配冷冻饮品乳化增稠剂,食品添加剂-->食品添加剂,上海永杰食品配料有限公司 ,上海永杰食品配料有限公司 ,2021-08-18,,,,,,,合格,国内监督抽查(上海市场监管局),2021-08-18,
食品伙伴网,,复配冷冻米面制品增稠剂,食品添加剂-->食品添加剂,上海永杰食品配料有限公司 ,上海永杰食品配料有限公司 ,2021-08-18,,,,,,,合格,国内监督抽查(上海市场监管局),2021-08-18,
食品伙伴网,,STU1603704金橘香精,食品添加剂-->食品添加剂,上海高砂•鉴臣香料有限公司 ,上海高砂•鉴臣香料有限公司 ,2021-08-18,,,,,,,合格,国内监督抽查(上海市场监管局),2021-08-18,
食品伙伴网,,STU1202443咖啡香精,食品添加剂-->食品添加剂,上海高砂•鉴臣香料有限公司 ,上海高砂•鉴臣香料有限公司 ,2021-08-18,,,,,,,合格,国内监督抽查(上海市场监管局),2021-08-18,
食品伙伴网,,190A27A梨香精,食品添加剂-->食品添加剂,上海百润投资控股集团股份有限公司 ,上海百润投资控股集团股份有限公司 ,2021-08-18,,,,,,,合格,国内监督抽查(上海市场监管局),2021-08-18,
食品伙伴网,,174P29A芒果香精,食品添加剂-->食品添加剂,上海百润投资控股集团股份有限公司 ,上海百润投资控股集团股份有限公司 ,2021-08-18,,,,,,,合格,国内监督抽查(上海市场监管局),2021-08-18,
食品伙伴网,,225P83C牛奶香精,食品添加剂-->食品添加剂,上海百润投资控股集团股份有限公司 ,上海百润投资控股集团股份有限公司 ,2021-08-18,,,,,,,合格,国内监督抽查(上海市场监管局),2021-08-18,
食品伙伴网,,复配糕点增稠乳化剂,食品添加剂-->食品添加剂,帕斯嘉（上海）食品添加剂有限公司 ,帕斯嘉（上海）食品添加剂有限公司 ,2021-08-18,,,,,,,合格,国内监督抽查(上海市场监管局),2021-08-18,
食品伙伴网,,复配糕点乳化增稠剂,食品添加剂-->食品添加剂,帕斯嘉（上海）食品添加剂有限公司 ,帕斯嘉（上海）食品添加剂有限公司 ,2021-08-18,,,,,,,合格,国内监督抽查(上海市场监管局),2021-08-18,
食品伙伴网,,复配糕点乳化增稠剂,食品添加剂-->食品添加剂,帕斯嘉（上海）食品添加剂有限公司 ,帕斯嘉（上海）食品添加剂有限公司 ,2021-08-18,,,,,,,合格,国内监督抽查(上海市场监管局),2021-08-18,
食品伙伴网,,复配水分保持剂,食品添加剂-->食品添加剂,上海润创食品科技发展有限公司浦东分公司 ,上海润创食品科技发展有限公司浦东分公司 ,2021-08-18,,,,,,,合格,国内监督抽查(上海市场监管局),2021-08-18,
食品伙伴网,,复配增稠稳定剂,食品添加剂-->食品添加剂,上海润创食品科技发展有限公司浦东分公司 ,上海润创食品科技发展有限公司浦东分公司 ,2021-08-18,,,,,,,合格,国内监督抽查(上海市场监管局),2021-08-18,
食品伙伴网,,复配增稠剂,食品添加剂-->食品添加剂,上海润创食品科技发展有限公司浦东分公司 ,上海润创食品科技发展有限公司浦东分公司 ,2021-08-18,,,,,,,合格,国内监督抽查(上海市场监管局),2021-08-18,
食品伙伴网,,复配糕点乳化剂,食品添加剂-->食品添加剂,上海早苗食品有限公司 ,上海早苗食品有限公司 ,2021-08-18,,,,,,,合格,国内监督抽查(上海市场监管局),2021-08-18,
食品伙伴网,,复配糕点酸度调节剂,食品添加剂-->食品添加剂,上海早苗食品有限公司 ,上海早苗食品有限公司 ,2021-08-18,,,,,,,合格,国内监督抽查(上海市场监管局),2021-08-18,
食品伙伴网,,复配饮料酸度调节剂,食品添加剂-->食品添加剂,上海申美饮料食品有限公司闵行分厂 ,上海申美饮料食品有限公司闵行分厂 ,2021-08-18,,,,,,,合格,国内监督抽查(上海市场监管局),2021-08-18,
食品伙伴网,,泡椒膏香精（膏状）,食品添加剂-->食品添加剂,欧劳福林（上海）生物科技有限公司 ,欧劳福林（上海）生物科技有限公司 ,2021-08-18,,,,,,,合格,国内监督抽查(上海市场监管局),2021-08-18,
食品伙伴网,,复配增稠剂,食品添加剂-->食品添加剂,上海和一食品科技有限公司 ,上海和一食品科技有限公司 ,2021-08-18,,,,,,,合格,国内监督抽查(上海市场监管局),2021-08-18,
食品伙伴网,,复配增稠剂,食品添加剂-->食品添加剂,上海和一食品科技有限公司 ,上海和一食品科技有限公司 ,2021-08-18,,,,,,,合格,国内监督抽查(上海市场监管局),2021-08-18,
食品伙伴网,,复配增稠乳化剂,食品添加剂-->食品添加剂,上海和一食品科技有限公司 ,上海和一食品科技有限公司 ,2021-08-18,,,,,,,合格,国内监督抽查(上海市场监管局),2021-08-18,
食品伙伴网,,301042322酸奶香精（XL-VD-02）,食品添加剂-->食品添加剂,味易威德香精香料（上海）有限公司 ,味易威德香精香料（上海）有限公司 ,2021-08-18,,,,,,,合格,国内监督抽查(上海市场监管局),2021-08-18,
食品伙伴网,,YBW1216百香果香精,食品添加剂-->食品添加剂,味易威德香精香料（上海）有限公司 ,味易威德香精香料（上海）有限公司 ,2021-08-18,,,,,,,合格,国内监督抽查(上海市场监管局),2021-08-18,
食品伙伴网,,H6384清炖鸡香精,食品添加剂-->食品添加剂,味易威德香精香料（上海）有限公司 ,味易威德香精香料（上海）有限公司 ,2021-08-18,,,,,,,合格,国内监督抽查(上海市场监管局),2021-08-18,
食品伙伴网,,维维特鲜奶香精,食品添加剂-->食品添加剂,上海泰斯麦香精香料有限公司 ,上海泰斯麦香精香料有限公司 ,2021-08-18,,,,,,,合格,国内监督抽查(上海市场监管局),2021-08-18,
食品伙伴网,,蓝莓香精,食品添加剂-->食品添加剂,上海泰斯麦香精香料有限公司 ,上海泰斯麦香精香料有限公司 ,2021-08-18,,,,,,,合格,国内监督抽查(上海市场监管局),2021-08-18,
食品伙伴网,,达莎卡草莓香精,食品添加剂-->食品添加剂,上海泰斯麦香精香料有限公司 ,上海泰斯麦香精香料有限公司 ,2021-08-18,,,,,,,合格,国内监督抽查(上海市场监管局),2021-08-18,
食品伙伴网,,GX01水蜜桃香精,食品添加剂-->食品添加剂,上海乡叶香料科技有限公司 ,上海乡叶香料科技有限公司 ,2021-08-18,,,,,,,合格,国内监督抽查(上海市场监管局),2021-08-18,
食品伙伴网,,复配稳定乳化增稠剂（新意卡思达即用吉士粉）,食品添加剂-->食品添加剂,上海昕宜食品辅料有限公司 ,上海昕宜食品辅料有限公司 ,2021-08-18,,,,,,,合格,国内监督抽查(上海市场监管局),2021-08-18,
食品伙伴网,,复配焙烤食品酸度调节剂（新意塔塔粉）,食品添加剂-->食品添加剂,上海昕宜食品辅料有限公司 ,上海昕宜食品辅料有限公司 ,2021-08-18,,,,,,,合格,国内监督抽查(上海市场监管局),2021-08-18,
食品伙伴网,,复配稳定乳化增稠剂（新意晶亮果膏粉）,食品添加剂-->食品添加剂,上海昕宜食品辅料有限公司 ,上海昕宜食品辅料有限公司 ,2021-08-18,,,,,,,合格,国内监督抽查(上海市场监管局),2021-08-18,
食品伙伴网,,复配饮料增稠剂,食品添加剂-->食品添加剂,上海科盛食品有限公司 ,上海科盛食品有限公司 ,2021-08-18,,,,,,,合格,国内监督抽查(上海市场监管局),2021-08-18,
食品伙伴网,,复配调制乳和饮料增稠乳化剂,食品添加剂-->食品添加剂,上海科盛食品有限公司 ,上海科盛食品有限公司 ,2021-08-18,,,,,,,合格,国内监督抽查(上海市场监管局),2021-08-18,
食品伙伴网,,复配冷冻饮品增稠剂DS-3,食品添加剂-->食品添加剂,上海凯惠食品添加剂有限公司 ,上海凯惠食品添加剂有限公司 ,2021-08-18,,,,,,,合格,国内监督抽查(上海市场监管局),2021-08-18,
食品伙伴网,,复配冷冻饮品增稠剂SF-1291B,食品添加剂-->食品添加剂,上海凯惠食品添加剂有限公司 ,上海凯惠食品添加剂有限公司 ,2021-08-18,,,,,,,合格,国内监督抽查(上海市场监管局),2021-08-18,
食品伙伴网,,YFW-F2食用香精,食品添加剂-->食品添加剂,上海普若味可生物科技有限公司 ,上海普若味可生物科技有限公司 ,2021-08-18,,,,,,,合格,国内监督抽查(上海市场监管局),2021-08-18,
食品伙伴网,,TPMC18777芝麻香精,食品添加剂-->食品添加剂,上海普若味可生物科技有限公司 ,上海普若味可生物科技有限公司 ,2021-08-18,,,,,,,合格,国内监督抽查(上海市场监管局),2021-08-18,
食品伙伴网,,复配糕点增稠乳化剂,食品添加剂-->食品添加剂,帕斯嘉(上海)食品添加剂有限公司 ,帕斯嘉(上海)食品添加剂有限公司 ,2021-08-18,,,,,,,合格,国内监督抽查(上海市场监管局),2021-08-18,
食品伙伴网,,复配糕点乳化增稠剂,食品添加剂-->食品添加剂,帕斯嘉(上海)食品添加剂有限公司 ,帕斯嘉(上海)食品添加剂有限公司 ,2021-08-18,,,,,,,合格,国内监督抽查(上海市场监管局),2021-08-18,
食品伙伴网,,复配固体饮料类营养强化剂,食品添加剂-->食品添加剂,上海诺成药业股份有限公司 ,上海诺成药业股份有限公司 ,2021-08-18,,,,,,,合格,国内监督抽查(上海市场监管局),2021-08-18,
食品伙伴网,,复配增稠剂,食品添加剂-->食品添加剂,富泽新记生化技术（上海）有限公司 ,富泽新记生化技术（上海）有限公司 ,2021-08-18,,,,,,,合格,国内监督抽查(上海市场监管局),2021-08-18,
食品伙伴网,,复配其他饮用水口味调节剂（1301）,食品添加剂-->食品添加剂,可口可乐饮料（上海）有限公司 ,可口可乐饮料（上海）有限公司 ,2021-08-18,,,,,,,合格,国内监督抽查(上海市场监管局),2021-08-18,
食品伙伴网,,饮料主剂（橙通用型）C料,食品添加剂-->食品添加剂,上海申美饮料食品有限公司闵行分厂 ,上海申美饮料食品有限公司闵行分厂 ,2021-08-18,,,,,,,合格,国内监督抽查(上海市场监管局),2021-08-18,
食品伙伴网,,饮料主剂（柠檬04型）C料,食品添加剂-->食品添加剂,上海申美饮料食品有限公司闵行分厂 ,上海申美饮料食品有限公司闵行分厂 ,2021-08-18,,,,,,,合格,国内监督抽查(上海市场监管局),2021-08-18,
食品伙伴网,,饮料主剂（苹果01型）C料,食品添加剂-->食品添加剂,上海申美饮料食品有限公司闵行分厂 ,上海申美饮料食品有限公司闵行分厂 ,2021-08-18,,,,,,,合格,国内监督抽查(上海市场监管局),2021-08-18,
食品伙伴网,,葡萄味香精F-1450,食品添加剂-->食品添加剂,上海芳精香料有限公司 ,上海芳精香料有限公司 ,2021-08-18,,,,,,,合格,国内监督抽查(上海市场监管局),2021-08-18,
食品伙伴网,,梨味香精F-3656,食品添加剂-->食品添加剂,上海芳精香料有限公司 ,上海芳精香料有限公司 ,2021-08-18,,,,,,,合格,国内监督抽查(上海市场监管局),2021-08-18,
食品伙伴网,,综合水果味香精F-1049,食品添加剂-->食品添加剂,上海芳精香料有限公司 ,上海芳精香料有限公司 ,2021-08-18,,,,,,,合格,国内监督抽查(上海市场监管局),2021-08-18,
食品伙伴网,,RBL0107蓝莓香精,食品添加剂-->食品添加剂,上海融芳香精香料有限公司 ,上海融芳香精香料有限公司 ,2021-08-18,,,,,,,合格,国内监督抽查(上海市场监管局),2021-08-18,
食品伙伴网,,复配水分保持剂HK-800,食品添加剂-->食品添加剂,杭州临安海科食品配料有限公司 ,杭州临安海科食品配料有限公司 ,2021-09-03,,,,,,,合格,国内监督抽查(浙江市场监管局),2021-09-03,
食品伙伴网,,食品添加剂碳酸氢钠,食品添加剂-->食品添加剂,桐柏博源新型化工有限公司 ,江北区正金食品店 ,2021-09-03,,,,,,,合格,国内监督抽查(重庆市场监管局),2021-09-03,
食品伙伴网,,食品添加剂碳酸钠,食品添加剂-->食品添加剂,郑州君发科技有限公司 ,南岸区凤文食品超市 ,2021-09-03,,,,,,,合格,国内监督抽查(重庆市场监管局),2021-09-03,
食品伙伴网,,AXE食粉（食品化学品）,食品添加剂-->食品添加剂,广州市金牌厨师食品有限公司 ,江津区赵正强副食店 ,2021-09-03,,,,,,,合格,国内监督抽查(重庆市场监管局),2021-09-03,
食品伙伴网,,复配酸度调节剂,食品添加剂-->食品添加剂,山东圣琪生物有限公司 ,重庆市荣昌区客来福百货经营部 ,2021-09-03,,,,,,,合格,国内监督抽查(重庆市场监管局),2021-09-03,
食品伙伴网,,明胶片（食品添加剂）,食品添加剂-->食品添加剂,青海益洁生物工程有限公司 ,嘉兴欧尚超市有限公司南湖店 ,2021-09-10,,,,,,,合格,国内监督抽查(浙江市场监管局),2021-09-10,
食品伙伴网,,复配发酵面制品面粉处理剂,食品添加剂-->食品添加剂,郑州海韦力食品工业有限公司 ,绍兴市上虞区恒瑞食品原辅料商行 ,2021-09-10,,,,,,,合格,国内监督抽查(浙江市场监管局),2021-09-10,
食品伙伴网,,复配酸度调节剂,食品添加剂-->食品添加剂,山东圣琪生物有限公司 ,杭州联华华商集团有限公司龙游世纪联华超市 ,2021-09-10,,,,,,,合格,国内监督抽查(浙江市场监管局),2021-09-10,
食品伙伴网,,越元烤魚香膏,食品添加剂-->食品添加剂,青岛越元食品添加剂有限公司 ,杭州滨江区东冠农贸市场萄英食品店 ,2021-09-10,,,,,,,合格,国内监督抽查(浙江市场监管局),2021-09-10,
食品伙伴网,,复配酸度调节剂,食品添加剂-->食品添加剂,上海裕秀工贸有限公司 ,华润万家生活超市（浙江）有限公司桐乡分公司 ,2021-09-10,,,,,,,合格,国内监督抽查(浙江市场监管局),2021-09-10,
食品伙伴网,,复配酸度调节剂,食品添加剂-->食品添加剂,山东圣琪生物有限公司 ,绍兴市忠哥粮油有限公司 ,2021-09-10,,,,,,,合格,国内监督抽查(浙江市场监管局),2021-09-10,
食品伙伴网,,馒头改良剂,食品添加剂-->食品添加剂,安琪酵母股份有限公司 ,特易购商业（浙江）有限公司温岭九龙大道分公司 ,2021-09-10,,,,,,,合格,国内监督抽查(浙江市场监管局),2021-09-10,
食品伙伴网,,复配酸度调节剂,食品添加剂-->食品添加剂,山东圣琪生物有限公司 ,义乌市世纪联华超市有限公司城中中路店 ,2021-09-10,,,,,,,合格,国内监督抽查(浙江市场监管局),2021-09-10,
食品伙伴网,,卤味香精（浆膏状香精）,食品添加剂-->食品添加剂,山东天博食品配料有限公司 ,温州寸金贸易有限公司 ,2021-09-10,,,,,,,合格,国内监督抽查(浙江市场监管局),2021-09-10,
食品伙伴网,,牛肉香精,食品添加剂-->食品添加剂,阳江市阳东食品香料公司 ,温州市星宏贸易有限公司 ,2021-09-10,,,,,,,合格,国内监督抽查(浙江市场监管局),2021-09-10,
食品伙伴网,,花晨®食品用香精乙基麦芽粉肉香型,食品添加剂-->食品添加剂,青岛百香泉食品配料有限公司 ,温州市霞飞调味品有限公司 ,2021-09-10,,,,,,,合格,国内监督抽查(浙江市场监管局),2021-09-10,
食品伙伴网,,复配乳化剂(SY-KW01),食品添加剂-->食品添加剂,杭州康味生物科技有限公司 ,杭州康味生物科技有限公司 ,2021-09-03,,,,,,,合格,国内监督抽查(浙江市场监管局),2021-09-03,
食品伙伴网,,粒粒橙香精,食品添加剂-->食品添加剂,杭州骑士香精香料有限公司 ,杭州骑士香精香料有限公司 ,2021-09-03,,,,,,,合格,国内监督抽查(浙江市场监管局),2021-09-03,
食品伙伴网,,复配乳化增稠剂(DZ809),食品添加剂-->食品添加剂,杭州傅迪食品有限公司 ,杭州傅迪食品有限公司 ,2021-09-03,,,,,,,合格,国内监督抽查(浙江市场监管局),2021-09-03,
食品伙伴网,,乳酸菌风味酱B5012,食品添加剂-->食品添加剂,杭州时盛科技有限公司 ,杭州时盛科技有限公司 ,2021-09-03,,,,,,,合格,国内监督抽查(浙江市场监管局),2021-09-03,
食品伙伴网,,58016乳浊剂,食品添加剂-->食品添加剂,杭州天韵食品生物科技有限公司 ,杭州天韵食品生物科技有限公司 ,2021-09-03,,,,,,,合格,国内监督抽查(浙江市场监管局),2021-09-03,
食品伙伴网,,复配抗氧化剂JWKH,食品添加剂-->食品添加剂,金微克食品配料（杭州）有限公司 ,金微克食品配料(杭州)有限公司 ,2021-09-03,,,,,,,合格,国内监督抽查(浙江市场监管局),2021-09-03,
食品伙伴网,,食用明胶,食品添加剂-->食品添加剂,杭州群利明胶化工有限公司 ,杭州群利明胶化工有限公司 ,2021-09-03,,,,,,,合格,国内监督抽查(浙江市场监管局),2021-09-03,
食品伙伴网,,SD2117乳酸菌香精,食品添加剂-->食品添加剂,杭州韦博香精有限公司 ,杭州韦博香精有限公司 ,2021-09-03,,,,,,,合格,国内监督抽查(浙江市场监管局),2021-09-03,
食品伙伴网,,复配乳化增稠剂,食品添加剂-->食品添加剂,杭州恒旺食品科技有限公司 ,杭州恒旺食品科技有限公司 ,2021-09-03,,,,,,,合格,国内监督抽查(浙江市场监管局),2021-09-03,
食品伙伴网,,复配食品添加剂（复配着色剂）高分散白色素,食品添加剂-->食品添加剂,浙江京海新材料有限公司 ,浙江京海新材料有限公司 ,2021-09-03,,,,,,,合格,国内监督抽查(浙江市场监管局),2021-09-03,
食品伙伴网,,水味士TK-516,食品添加剂-->食品添加剂,杭州众香科技有限公司 ,杭州众香科技有限公司 ,2021-09-03,,,,,,,合格,国内监督抽查(浙江市场监管局),2021-09-03,
食品伙伴网,,康远专用甜橙味粉末香精14011-2,食品添加剂-->食品添加剂,浙江巨邦高新技术有限公司 ,浙江巨邦高新技术有限公司 ,2021-09-03,,,,,,,合格,国内监督抽查(浙江市场监管局),2021-09-03,
食品伙伴网,,口味改良食品用香精Zolesse™ GB02,食品添加剂-->食品添加剂,浙江绿世界制药有限公司 ,浙江绿世界制药有限公司 ,2021-09-03,,,,,,,合格,国内监督抽查(浙江市场监管局),2021-09-03,
食品伙伴网,,香蕉(食用香精),食品添加剂-->食品添加剂,温州市龙威果品香料厂 ,温州市龙威果品香料厂 ,2021-09-03,,,,,,,合格,国内监督抽查(浙江市场监管局),2021-09-03,
食品伙伴网,,复配稳定剂(食品添加剂),食品添加剂-->食品添加剂,诸暨市凯诺食品添加剂厂 ,诸暨市凯诺食品添加剂厂 ,2021-09-03,,,,,,,合格,国内监督抽查(浙江市场监管局),2021-09-03,
食品伙伴网,,牛奶味香精,食品添加剂-->食品添加剂,嘉兴威逊生物科技有限公司 ,嘉兴威逊生物科技有限公司 ,2021-09-03,,,,,,,合格,国内监督抽查(浙江市场监管局),2021-09-03,
食品伙伴网,,"鸡粉C-2099A(食
品用香精)",食品添加剂-->食品添加剂,湖南味香源生物科技有限公司 ,"湖南味香源生物科技有限公
司 ",2021-08-31,,,,,,,合格,国内监督抽查(湖南市场监管局),2021-08-31,
食品伙伴网,,肉味王LY-8833(食品添加剂）,食品添加剂-->食品添加剂,湖南味香源生物科技有限公司 ,"湖南味香源生物科技有限公
司 ",2021-08-31,,,,,,,合格,国内监督抽查(湖南市场监管局),2021-08-31,
食品伙伴网,,甜蜜素,食品添加剂-->食品添加剂,互惠（江门）食用添加剂有限公司 ,万州区赵星干副食批发经营部 ,2021-09-01,,,,,,,合格,国内监督抽查(重庆市场监管局),2021-09-01,
食品伙伴网,,百钻无铝害双效泡打粉复配膨松剂,食品添加剂-->食品添加剂,安琪酵母股份有限公司 ,渝洲交易城罗晓桃 ,2021-09-01,,,,,,,合格,国内监督抽查(重庆市场监管局),2021-09-01,
食品伙伴网,,食品添加剂复配膨松剂,食品添加剂-->食品添加剂,佛山市禾夫食品有限公司 ,江津区小刘食品店 ,2021-09-01,,,,,,,合格,国内监督抽查(重庆市场监管局),2021-09-01,
食品伙伴网,,吉士粉（复配着色剂）,食品添加剂-->食品添加剂,普宁市狮宝食品有限公司 ,伊宁边境经济合作区韦晨晨超市 ,2021-09-02,,,,,,,合格,国内监督抽查(新疆市场监管局),2021-09-02,
食品伙伴网,,佑康专用0112202(复配食品添加剂),食品添加剂-->食品添加剂,杭州恒宇食品原料有限公司 ,杭州恒宇食品原料有限公司 ,2021-09-03,,,,,,,合格,国内监督抽查(浙江市场监管局),2021-09-03,
食品伙伴网,,复配抗氧化剂1,食品添加剂-->食品添加剂,杭州南宇生物科技有限公司 ,杭州南宇生物科技有限公司 ,2021-09-03,,,,,,,合格,国内监督抽查(浙江市场监管局),2021-09-03,
食品伙伴网,,复配甜味剂,食品添加剂-->食品添加剂,浙江李子园食品股份有限公司 ,浙江李子园食品股份有限公司 ,2021-09-03,,,,,,,合格,国内监督抽查(浙江市场监管局),2021-09-03,
食品伙伴网,,2623甜玉米香精,食品添加剂-->食品添加剂,杭州晶泉香精香料有限公司 ,杭州晶泉香精香料有限公司 ,2021-09-03,,,,,,,合格,国内监督抽查(浙江市场监管局),2021-09-03,
食品伙伴网,,五香王香精,食品添加剂-->食品添加剂,杭州天使香精香料有限公司 ,杭州天使香精香料有限公司 ,2021-09-03,,,,,,,合格,国内监督抽查(浙江市场监管局),2021-09-03,
食品伙伴网,,XY2007风味飘香剂,食品添加剂-->食品添加剂,杭州创轶食品有限公司 ,杭州创轶食品有限公司 ,2021-09-03,,,,,,,合格,国内监督抽查(浙江市场监管局),2021-09-03,
食品伙伴网,,复配着色剂（柠檬黄、日落黄）,食品添加剂-->食品添加剂,浙江吉高德色素科技有限公司 ,杭州萧山欣利食品添加剂经营部 ,2021-09-10,,,,,,,合格,国内监督抽查(浙江市场监管局),2021-09-10,
食品伙伴网,,肉味粉末香精,食品添加剂-->食品添加剂,福建兴味正生物科技有限公司 ,福建兴味正生物科技有限公司 ,2021-09-10,,,,,,,合格,国内监督抽查(福建市场监管局),2021-09-10,
食品伙伴网,,肉味膏状香精,食品添加剂-->食品添加剂,福建兴味正生物科技有限公司 ,福建兴味正生物科技有限公司 ,2021-09-10,,,,,,,合格,国内监督抽查(福建市场监管局),2021-09-10,
食品伙伴网,,肉味液体香精,食品添加剂-->食品添加剂,福建兴味正生物科技有限公司 ,福建兴味正生物科技有限公司 ,2021-09-10,,,,,,,合格,国内监督抽查(福建市场监管局),2021-09-10,
食品伙伴网,,食用碱食品添加剂复配酸度调节乳化剂,食品添加剂-->食品添加剂,青岛建航味精有限公司 ,青岛维客商业连锁有限公司奥克斯店 ,2021-09-27,,,,,,,合格,国内监督抽查(山东市场监管局),2021-09-27,
食品伙伴网,,金品摩油,食品添加剂-->食品添加剂,青岛六禾谷食品配料有限公司 ,桓台索镇宏远化工经销部 ,2021-09-27,,,,,,,合格,国内监督抽查(山东市场监管局),2021-09-27,
食品伙伴网,,辣椒精霸,食品添加剂-->食品添加剂,青岛瑞潽旺食品配料有限公司 ,桓台索镇宏远化工经销部 ,2021-09-27,,,,,,,合格,国内监督抽查(山东市场监管局),2021-09-27,
食品伙伴网,,食用小苏打（食品添加剂复配酸度调节剂）,食品添加剂-->食品添加剂,青州市恒宇食品厂 ,潍坊市坊子区佳丽琪超市 ,2021-09-27,,,,,,,合格,国内监督抽查(山东市场监管局),2021-09-27,
食品伙伴网,,复配酸度调节剂（食用纯碱）,食品添加剂-->食品添加剂,青岛灵鸟食品有限公司 ,济宁九龙贵和商贸集团有限公司贵和购物赛宝店 ,2021-09-27,,,,,,,合格,国内监督抽查(山东市场监管局),2021-09-27,
食品伙伴网,,鸡肉味香精,食品添加剂-->食品添加剂,青岛千泉食品配料有限公司 ,无棣乐鑫源食品添加剂经营部 ,2021-09-27,,,,,,,合格,国内监督抽查(山东市场监管局),2021-09-27,
食品伙伴网,,复配酸度调节剂,食品添加剂-->食品添加剂,山东圣琪生物有限公司 ,山东金孚隆股份有限公司金孚隆超市人民大街店 ,2021-09-27,,,,,,,合格,国内监督抽查(山东市场监管局),2021-09-27,
食品伙伴网,,鸡肉香精粉末拌和型,食品添加剂-->食品添加剂,日照市大厨三宝餐饮配料有限公司 ,高密市味泉调味品经营部 ,2021-09-27,,,,,,,合格,国内监督抽查(山东市场监管局),2021-09-27,
食品伙伴网,,双效泡打粉(复配酸度调节膨松剂（L）),食品添加剂-->食品添加剂,青岛海丽祥食品有限公司 ,泰安高新区荣和百货商行 ,2021-09-27,,,,,,,合格,国内监督抽查(山东市场监管局),2021-09-27,
食品伙伴网,,复配酸度调节剂（食用纯碱）,食品添加剂-->食品添加剂,青岛灵鸟食品有限公司 ,平邑县大润民购物中心 ,2021-09-27,,,,,,,合格,国内监督抽查(山东市场监管局),2021-09-27,
