信息来源,搜索条件,物料名称,产品分类,生产商,供应商,生产日期,批号,项目分类,检测项目,单位,检测结果,限量值,判定,发布单位,发布日期,备注
食品伙伴网,,复配小麦粉稳定剂,食品添加剂-->食品添加剂,河南瑞之琪食品有限公司 ,平度市毛三妹食品添加剂店 ,2021-12-06,,,,,,,合格,国内监督抽查(山东市场监管局),2021-12-06,
食品伙伴网,,复配水分保持剂01,食品添加剂-->食品添加剂,烟台通世食品添加剂有限公司 ,平度市毛三妹食品添加剂店 ,2021-12-06,,,,,,,合格,国内监督抽查(山东市场监管局),2021-12-06,
食品伙伴网,,水性辣椒精（液体）,食品添加剂-->食品添加剂,青岛腾原生物科技有限公司 ,平度市毛三妹食品添加剂店 ,2021-12-06,,,,,,,合格,国内监督抽查(山东市场监管局),2021-12-06,
食品伙伴网,,复配酶制剂乳化剂,食品添加剂-->食品添加剂,山东五丰生物科技有限公司 ,平度市伟艺顺调味料店 ,2021-12-06,,,,,,,合格,国内监督抽查(山东市场监管局),2021-12-06,
食品伙伴网,,复配乳化酶制剂梅山MIII改良剂,食品添加剂-->食品添加剂,英联马利食品(东莞)有限公司 ,平度市鸿晟泰达食品原料商店 ,2021-12-06,,,,,,,合格,国内监督抽查(山东市场监管局),2021-12-06,
食品伙伴网,,新奥尔良F570（食品用香精）（食品添加剂）,食品添加剂-->食品添加剂,青岛香海盛食品配料有限公司 ,平度市鸿晟泰达食品原料商店 ,2021-12-06,,,,,,,合格,国内监督抽查(山东市场监管局),2021-12-06,
食品伙伴网,,肉类嫩化剂,食品添加剂-->食品添加剂,烟台佳晶食品工业有限公司 ,平度市鸿晟泰达食品原料商店 ,2021-12-06,,,,,,,合格,国内监督抽查(山东市场监管局),2021-12-06,
食品伙伴网,,馒头改良剂（复配发酵面制品酶制剂抗氧化剂）,食品添加剂-->食品添加剂,安琪酵母股份有限公司 ,平度市伟艺顺调味料店 ,2021-12-06,,,,,,,合格,国内监督抽查(山东市场监管局),2021-12-06,
食品伙伴网,,食品添加剂复配酸度调节剂食用碱面,食品添加剂-->食品添加剂,济南宝硕食品科技有限公司 ,禹城市万家福副食百货商行 ,2021-12-06,,,,,,,合格,国内监督抽查(山东市场监管局),2021-12-06,
食品伙伴网,,复配肉制品WL-900护色剂,食品添加剂-->食品添加剂,哈尔滨亿达食品原料有限公司 ,平度市旭诺调料批发部 ,2021-12-06,,,,,,,合格,国内监督抽查(山东市场监管局),2021-12-06,
食品伙伴网,,花帝HD-6增香剂粉末食品用香精,食品添加剂-->食品添加剂,青岛花帝食品配料有限公司 ,平度市旭诺调料批发部 ,2021-12-06,,,,,,,合格,国内监督抽查(山东市场监管局),2021-12-06,
食品伙伴网,,复配酸度调节剂（食用纯碱）,食品添加剂-->食品添加剂,青岛灵鸟食品有限公司 ,泰安市岱岳区亿家坐标购物广场 ,2021-12-06,,,,,,,合格,国内监督抽查(山东市场监管局),2021-12-06,
食品伙伴网,,鸡肉精粉,食品添加剂-->食品添加剂,平度市高泰克食品配料厂 ,陵县爱青食品门市部 ,2021-12-06,,,,,,,合格,国内监督抽查(山东市场监管局),2021-12-06,
食品伙伴网,,食用小苏打（复配酸度调节剂）,食品添加剂-->食品添加剂,青岛海丽祥食品有限公司 ,泰安易初莲花连锁超市有限公司 ,2021-12-06,,,,,,,合格,国内监督抽查(山东市场监管局),2021-12-06,
食品伙伴网,,芝麻精油(液体),食品添加剂-->食品添加剂,青岛香海盛食品配料有限公司 ,泰安市科宇商贸有限公司 ,2021-12-06,,,,,,,合格,国内监督抽查(山东市场监管局),2021-12-06,
食品伙伴网,,明胶（吉利丁粉）,食品添加剂-->食品添加剂,甘肃阿敏生物清真明胶有限公司 ,甘肃阿敏生物清真明胶有限公司 ,2021-12-07,,,,,,,合格,国内监督抽查(甘肃市场监管局),2021-12-07,
食品伙伴网,,蛋奶香粉,食品添加剂-->食品添加剂,广州市雅禾生物科技有限公司 ,漳州市芗城区朱南成食品添加剂商行 ,2021-12-24,,,,,,,合格,国内监督抽查(福建市场监管局),2021-12-24,
食品伙伴网,,食品用香精椰子香粉,食品添加剂-->食品添加剂,广州市雅禾生物科技有限公司 ,漳州市芗城区朱南成食品添加剂商行 ,2021-12-24,,,,,,,合格,国内监督抽查(福建市场监管局),2021-12-24,
食品伙伴网,,食品用香精牛奶香粉,食品添加剂-->食品添加剂,广州市雅禾生物科技有限公司 ,漳州市芗城区朱南成食品添加剂商行 ,2021-12-24,,,,,,,合格,国内监督抽查(福建市场监管局),2021-12-24,
食品伙伴网,,复配SP蛋糕乳化剂-001,食品添加剂-->食品添加剂,泉州亚太高邦食品配料有限公司 ,泉州亚太高邦食品配料有限公司 ,2021-12-24,,,,,,,合格,国内监督抽查(福建市场监管局),2021-12-24,
食品伙伴网,,依地®铁（乙二胺四乙酸铁钠）,食品添加剂-->食品添加剂,北京维他科技有限公司 ,北京维他科技有限公司 ,2021-12-24,,,,,,,合格,国内监督抽查(北京市场监管局),2021-12-24,
食品伙伴网,,食品添加剂-氮气,食品添加剂-->食品添加剂,法美高新气体(北京)有限公司 ,法美高新气体(北京)有限公司 ,2021-12-24,,,,,,,合格,国内监督抽查(北京市场监管局),2021-12-24,
食品伙伴网,,乳酸菌复配粉HCTJZ-001-A200DCU,食品添加剂-->食品添加剂,杜邦营养食品配料(北京)有限公司 ,杜邦营养食品配料(北京)有限公司 ,2021-12-24,,,,,,,合格,国内监督抽查(北京市场监管局),2021-12-24,
食品伙伴网,,复配面包乳化剂,食品添加剂-->食品添加剂,广州市华健生物科技有限公司 ,光复路四通食品添加剂商店 ,2021-12-27,,,,,,,合格,国内监督抽查(吉林市场监管厅),2021-12-27,
食品伙伴网,,肉灌肠类乳化剂,食品添加剂-->食品添加剂,烟台佳晶食品工业有限公司 ,光复路四通食品添加剂商店 ,2021-12-27,,,,,,,合格,国内监督抽查(吉林市场监管厅),2021-12-27,
食品伙伴网,,得劲甜味剂,食品添加剂-->食品添加剂,郑州君发科技有限公司 ,光复路四通食品添加剂商店 ,2021-12-27,,,,,,,合格,国内监督抽查(吉林市场监管厅),2021-12-27,
食品伙伴网,,TSE灌肠乳化腌制剂,食品添加剂-->食品添加剂,哈尔滨亿人食品技术研究所 ,宽城区亿人食品添加剂商店 ,2021-12-27,,,,,,,合格,国内监督抽查(吉林市场监管厅),2021-12-27,
食品伙伴网,,复配面包酶制剂,食品添加剂-->食品添加剂,乐斯福（明光）有限公司 ,高新园区优厨烘焙馆 ,2021-12-27,,,,,,,合格,国内监督抽查(吉林市场监管厅),2021-12-27,
食品伙伴网,,SP蛋糕油（复配乳化水份保持剂）,食品添加剂-->食品添加剂,广州市宝桃食品有限公司 ,高新园区优厨烘焙馆 ,2021-12-27,,,,,,,合格,国内监督抽查(吉林市场监管厅),2021-12-27,
食品伙伴网,,食用纯碱（碳酸钠食品添加剂）,食品添加剂-->食品添加剂,南京甘汁园糖业有限公司 ,重庆永辉超市有限公司合川区金世纪广场分公司 ,2021-12-27,,,,,,,合格,国内监督抽查(重庆市场监管局),2021-12-27,
食品伙伴网,,碳酸钠（食品添加剂）,食品添加剂-->食品添加剂,河南博欣调味品有限公司 ,重庆花滩联合一百商贸有限公司 ,2021-12-27,,,,,,,合格,国内监督抽查(重庆市场监管局),2021-12-27,
食品伙伴网,,复配酸度调节剂,食品添加剂-->食品添加剂,山东圣琪生物有限公司 ,巫溪县大京都文峰购物中心 ,2021-12-27,,,,,,,合格,国内监督抽查(重庆市场监管局),2021-12-27,
食品伙伴网,,猪肉呈味料,食品添加剂-->食品添加剂,广东汇香源生物科技股份有限公司黄埔分公司 ,漳州市芗城区千味食品添加剂经营部 ,2021-12-24,,,,,,,合格,国内监督抽查(福建市场监管局),2021-12-24,
食品伙伴网,,复配水分保持剂（富丽磷1#）,食品添加剂-->食品添加剂,厦门市顶味兴业香料发展有限公司 ,漳州市芗城区千味食品添加剂经营部 ,2021-12-24,,,,,,,合格,国内监督抽查(福建市场监管局),2021-12-24,
食品伙伴网,,高倍肉香膏,食品添加剂-->食品添加剂,东莞市盛永莱香精香料有限公司 ,漳州市芗城区苏和团食品添加剂商行 ,2021-12-24,,,,,,,合格,国内监督抽查(福建市场监管局),2021-12-24,
食品伙伴网,,鸡肉精膏8601,食品添加剂-->食品添加剂,开封慧中慧食品配料有限公司（原开封市天天香食品调料厂） ,漳州市芗城区苏和团食品添加剂商行 ,2021-12-24,,,,,,,合格,国内监督抽查(福建市场监管局),2021-12-24,
食品伙伴网,,热反应牛肉粉TTX-02,食品添加剂-->食品添加剂,开封慧中慧食品配料有限公司 ,漳州市芗城区苏和团食品添加剂商行 ,2021-12-24,,,,,,,合格,国内监督抽查(福建市场监管局),2021-12-24,
食品伙伴网,,烤鸭满街香,食品添加剂-->食品添加剂,东莞市盛永莱香精香料有限公司 ,漳州市芗城区苏和团食品添加剂商行 ,2021-12-24,,,,,,,合格,国内监督抽查(福建市场监管局),2021-12-24,
食品伙伴网,,牛腩香膏,食品添加剂-->食品添加剂,东莞市盛永莱香精香料有限公司 ,漳州市芗城区苏和团食品添加剂商行 ,2021-12-24,,,,,,,合格,国内监督抽查(福建市场监管局),2021-12-24,
食品伙伴网,,100173香芋香精,食品添加剂-->食品添加剂,深圳市唐正生物科技有限公司 ,漳州市芗城区苏和团食品添加剂商行 ,2021-12-24,,,,,,,合格,国内监督抽查(福建市场监管局),2021-12-24,
食品伙伴网,,100095草莓香精,食品添加剂-->食品添加剂,深圳市唐正生物科技有限公司 ,漳州市芗城区苏和团食品添加剂商行 ,2021-12-24,,,,,,,合格,国内监督抽查(福建市场监管局),2021-12-24,
食品伙伴网,,300423糖炒板栗香精,食品添加剂-->食品添加剂,深圳市唐正生物科技有限公司 ,漳州市芗城区苏和团食品添加剂商行 ,2021-12-24,,,,,,,合格,国内监督抽查(福建市场监管局),2021-12-24,
食品伙伴网,,甜玉米香精,食品添加剂-->食品添加剂,江门市蓬江区天荣食品有限公司 ,漳州市芗城区苏和团食品添加剂商行 ,2021-12-24,,,,,,,合格,国内监督抽查(福建市场监管局),2021-12-24,
食品伙伴网,,肉味粉末香精原名浓缩鲜香粉,食品添加剂-->食品添加剂,阳江市华锋实业有限公司 ,漳州市芗城区苏和团食品添加剂商行 ,2021-12-24,,,,,,,合格,国内监督抽查(福建市场监管局),2021-12-24,
食品伙伴网,,27049菠萝香精,食品添加剂-->食品添加剂,江西省华宝孔雀食品科技发展有限公司 ,漳州新华东五交化有限公司 ,2021-12-24,,,,,,,合格,国内监督抽查(福建市场监管局),2021-12-24,
食品伙伴网,,肉精油,食品添加剂-->食品添加剂,厦门市味宝调味品有限公司 ,漳州新华东五交化有限公司 ,2021-12-24,,,,,,,合格,国内监督抽查(福建市场监管局),2021-12-24,
食品伙伴网,,高倍肉精膏,食品添加剂-->食品添加剂,厦门市味宝调味品有限公司 ,漳州新华东五交化有限公司 ,2021-12-24,,,,,,,合格,国内监督抽查(福建市场监管局),2021-12-24,
食品伙伴网,,803牛肉膏状香精,食品添加剂-->食品添加剂,石家庄市太行香精有限公司 ,兴辉食品（漳州）有限公司 ,2021-12-24,,,,,,,合格,国内监督抽查(福建市场监管局),2021-12-24,
食品伙伴网,,食用碱面,食品添加剂-->食品添加剂,郑州君发科技有限公司 ,厦门市集美区方福来超市 ,2021-12-24,,,,,,,合格,国内监督抽查(福建市场监管局),2021-12-24,
食品伙伴网,,猪肉粉精,食品添加剂-->食品添加剂,阳江市港阳香化企业有限公司 ,漳州市芗城区香辣辣调味品店 ,2021-12-24,,,,,,,合格,国内监督抽查(福建市场监管局),2021-12-24,
食品伙伴网,,猪肉精油YJ021006,食品添加剂-->食品添加剂,广州市华琪生物科技有限公司 ,金阳光（福建）商贸有限公司 ,2021-12-24,,,,,,,合格,国内监督抽查(福建市场监管局),2021-12-24,
食品伙伴网,,厨神,食品添加剂-->食品添加剂,江西味元食品有限公司 ,漳州市芗城区诚泓食品添加剂商行 ,2021-12-24,,,,,,,合格,国内监督抽查(福建市场监管局),2021-12-24,
食品伙伴网,,DY908高倍肉精油,食品添加剂-->食品添加剂,江西味元食品有限公司 ,漳州市芗城区诚泓食品添加剂商行 ,2021-12-24,,,,,,,合格,国内监督抽查(福建市场监管局),2021-12-24,
食品伙伴网,,肉味风味料,食品添加剂-->食品添加剂,开封永盛食品配料有限公司 ,漳州市芗城区诚泓食品添加剂商行 ,2021-12-24,,,,,,,合格,国内监督抽查(福建市场监管局),2021-12-24,
食品伙伴网,,9307猪肉香精,食品添加剂-->食品添加剂,河北隆泰食品科技有限公司 ,漳州市芗城区诚泓食品添加剂商行 ,2021-12-24,,,,,,,合格,国内监督抽查(福建市场监管局),2021-12-24,
食品伙伴网,,BB006166肉精油食品用香精,食品添加剂-->食品添加剂,厦门市顶味兴业香料发展有限公司 ,漳州市芗城区诚泓食品添加剂商行 ,2021-12-24,,,,,,,合格,国内监督抽查(福建市场监管局),2021-12-24,
食品伙伴网,,芝麻油香精,食品添加剂-->食品添加剂,南京宁远食品科技有限公司 ,漳州市芗城区诚泓食品添加剂商行 ,2021-12-24,,,,,,,合格,国内监督抽查(福建市场监管局),2021-12-24,
食品伙伴网,,芝麻风味香精,食品添加剂-->食品添加剂,南京宁远食品科技有限公司 ,漳州市芗城区诚泓食品添加剂商行 ,2021-12-24,,,,,,,合格,国内监督抽查(福建市场监管局),2021-12-24,
食品伙伴网,,肉精油,食品添加剂-->食品添加剂,山东凤湖食品开发有限公司 ,漳州市芗城区诚泓食品添加剂商行 ,2021-12-24,,,,,,,合格,国内监督抽查(福建市场监管局),2021-12-24,
食品伙伴网,,肉弹素复配肉制品水分保持剂,食品添加剂-->食品添加剂,徐州科隆磷酸盐有限公司 ,漳州市芗城区诚泓食品添加剂商行 ,2021-12-24,,,,,,,合格,国内监督抽查(福建市场监管局),2021-12-24,
食品伙伴网,,牛肉精膏（肉味膏状香精）,食品添加剂-->食品添加剂,福建兴味正生物科技有限公司 ,漳州市芗城区千味食品添加剂经营部 ,2021-12-24,,,,,,,合格,国内监督抽查(福建市场监管局),2021-12-24,
食品伙伴网,,鸡肉精膏,食品添加剂-->食品添加剂,开封永盛食品配料有限公司 ,漳州市芗城区千味食品添加剂经营部 ,2021-12-24,,,,,,,合格,国内监督抽查(福建市场监管局),2021-12-24,
食品伙伴网,,大蒜精油,食品添加剂-->食品添加剂,美迪鲜江苏食品配料有限公司 ,漳州市芗城区千味食品添加剂经营部 ,2021-12-24,,,,,,,合格,国内监督抽查(福建市场监管局),2021-12-24,
食品伙伴网,,芝麻精油,食品添加剂-->食品添加剂,美迪鲜江苏食品配料有限公司 ,漳州市芗城区千味食品添加剂经营部 ,2021-12-24,,,,,,,合格,国内监督抽查(福建市场监管局),2021-12-24,
食品伙伴网,,液体香精型号：9346,食品添加剂-->食品添加剂,天津康宏盛代实业有限公司 ,漯河市纳福商贸有限公司 ,2021-12-24,,,,,,,合格,国内监督抽查(河南市场监管局),2021-12-24,
食品伙伴网,,鸡膏香精,食品添加剂-->食品添加剂,北京汇华东泽生物有限公司 ,漯河市纳福商贸有限公司 ,2021-12-24,,,,,,,合格,国内监督抽查(河南市场监管局),2021-12-24,
食品伙伴网,,面粉亮白酶,食品添加剂-->食品添加剂,焦作市怀地生物科技有限公司 ,焦作市怀地生物科技有限公司 ,2021-12-24,,,,,,,合格,国内监督抽查(河南市场监管局),2021-12-24,
食品伙伴网,,面粉亮白酶,食品添加剂-->食品添加剂,焦作市怀地生物科技有限公司 ,焦作市怀地生物科技有限公司 ,2021-12-24,,,,,,,合格,国内监督抽查(河南市场监管局),2021-12-24,
食品伙伴网,,面粉亮白酶,食品添加剂-->食品添加剂,焦作市怀地生物科技有限公司 ,焦作市怀地生物科技有限公司 ,2021-12-24,,,,,,,合格,国内监督抽查(河南市场监管局),2021-12-24,
食品伙伴网,,牛肉香精,食品添加剂-->食品添加剂,北京北方霞光食品添加剂有限公司房山分厂 ,漯河新捷食品配料有限公司 ,2021-12-24,,,,,,,合格,国内监督抽查(河南市场监管局),2021-12-24,
食品伙伴网,,芝麻风味香精,食品添加剂-->食品添加剂,浙江杭曼食品科技有限公司 ,商丘市梁园区宏远食品化工商店 ,2021-12-24,,,,,,,合格,国内监督抽查(河南市场监管局),2021-12-24,
食品伙伴网,,MF-102(复配乳化稳定剂),食品添加剂-->食品添加剂,河南鼎元食品科技有限公司 ,河南鼎元食品科技有限公司 ,2021-12-24,,,,,,,合格,国内监督抽查(河南市场监管局),2021-12-24,
食品伙伴网,,面条粉、饺子粉、拉面粉、烩面粉专用改良剂,食品添加剂-->食品添加剂,郑州天下仓食品有限公司 ,漯河市召陵区绿源食化经营部 ,2021-12-24,,,,,,,合格,国内监督抽查(河南市场监管局),2021-12-24,
食品伙伴网,,复合磷酸盐,食品添加剂-->食品添加剂,徐州添安食品添加剂有限公司 ,漯河市召陵区绿源食化经营部 ,2021-12-24,,,,,,,合格,国内监督抽查(河南市场监管局),2021-12-24,
食品伙伴网,,北方馒头改良剂,食品添加剂-->食品添加剂,安琪酵母股份有限公司 ,泌阳县庆东食品添加剂门市 ,2021-12-24,,,,,,,合格,国内监督抽查(河南市场监管局),2021-12-24,
食品伙伴网,,馒头改良剂[增白型],食品添加剂-->食品添加剂,安琪酵母股份有限公司 ,泌阳县庆东食品添加剂门市 ,2021-12-24,,,,,,,合格,国内监督抽查(河南市场监管局),2021-12-24,
食品伙伴网,,好搭档馒头改良剂,食品添加剂-->食品添加剂,安琪酵母股份有限公司 ,泌阳县庆东食品添加剂门市 ,2021-12-24,,,,,,,合格,国内监督抽查(河南市场监管局),2021-12-24,
食品伙伴网,,复配水分保持剂2(复合磷酸盐),食品添加剂-->食品添加剂,徐州添安食品添加剂有限公司 ,漯河市召陵区金源食化经营部 ,2021-12-24,,,,,,,合格,国内监督抽查(河南市场监管局),2021-12-24,
食品伙伴网,,肉制品护色剂,食品添加剂-->食品添加剂,大连国太食品有限责任公司 ,漯河市召陵区金源食化经营部 ,2021-12-24,,,,,,,合格,国内监督抽查(河南市场监管局),2021-12-24,
食品伙伴网,,牛奶香粉,食品添加剂-->食品添加剂,连云港惠源食品配料有限公司 ,漯河市召陵区海铭商品添加剂经销部 ,2021-12-24,,,,,,,合格,国内监督抽查(河南市场监管局),2021-12-24,
食品伙伴网,,复配小麦粉面粉处理剂烩面,食品添加剂-->食品添加剂,郑州银海生物技术有限公司 ,郑州银海生物技术有限公司 ,2021-12-24,,,,,,,合格,国内监督抽查(河南市场监管局),2021-12-24,
食品伙伴网,,复配乳化稳定剂,食品添加剂-->食品添加剂,郑州市锐隆食品科技有限公司 ,郑州市锐隆食品科技有限公司 ,2021-12-24,,,,,,,合格,国内监督抽查(河南市场监管局),2021-12-24,
食品伙伴网,,复配冷冻面制品增稠乳化剂饺子皮用(KTJ-123),食品添加剂-->食品添加剂,河南科拓生物科技有限公司 ,河南科拓生物科技有限公司 ,2021-12-24,,,,,,,合格,国内监督抽查(河南市场监管局),2021-12-24,
食品伙伴网,,复配冷冻米面制品增稠乳化剂饺子皮用(KTJ-1025A),食品添加剂-->食品添加剂,河南科拓生物科技有限公司 ,河南科拓生物科技有限公司 ,2021-12-24,,,,,,,合格,国内监督抽查(河南市场监管局),2021-12-24,
食品伙伴网,,复配增稠剂,食品添加剂-->食品添加剂,河南科拓生物科技有限公司 ,河南科拓生物科技有限公司 ,2021-12-24,,,,,,,合格,国内监督抽查(河南市场监管局),2021-12-24,
食品伙伴网,,复配膨松酸度调节剂,食品添加剂-->食品添加剂,郑州君发科技有限公司 ,郑州君发科技有限公司 ,2021-12-24,,,,,,,合格,国内监督抽查(河南市场监管局),2021-12-24,
食品伙伴网,,素馅保水剂(复配增稠剂）,食品添加剂-->食品添加剂,河南鼎元食品科技有限公司 ,河南鼎元食品科技有限公司 ,2021-12-24,,,,,,,合格,国内监督抽查(河南市场监管局),2021-12-24,
食品伙伴网,,大芝麻球改良剂(复配增稠剂）,食品添加剂-->食品添加剂,河南鼎元食品科技有限公司 ,河南鼎元食品科技有限公司 ,2021-12-24,,,,,,,合格,国内监督抽查(河南市场监管局),2021-12-24,
食品伙伴网,,特醇鲜香王,食品添加剂-->食品添加剂,肇庆易和生物科技有限公司 ,郑州市管城区众人食化商行 ,2021-12-24,,,,,,,合格,国内监督抽查(河南市场监管局),2021-12-24,
食品伙伴网,,百肉香膏,食品添加剂-->食品添加剂,肇庆易和生物科技有限公司 ,郑州市管城区众人食化商行 ,2021-12-24,,,,,,,合格,国内监督抽查(河南市场监管局),2021-12-24,
食品伙伴网,,猪肉精粉,食品添加剂-->食品添加剂,河南丙盛生物科技有限公司 ,郑州市管城区众人食化商行 ,2021-12-24,,,,,,,合格,国内监督抽查(河南市场监管局),2021-12-24,
食品伙伴网,,馒头粉品质改良剂(复配专用小麦粉乳化剂),食品添加剂-->食品添加剂,郑州天下仓食品有限公司 ,郑州天下仓食品有限公司 ,2021-12-24,,,,,,,合格,国内监督抽查(河南市场监管局),2021-12-24,
食品伙伴网,,烩面粉品质改良剂(复配小麦粉面粉处理剂),食品添加剂-->食品添加剂,郑州天下仓食品有限公司 ,郑州天下仓食品有限公司 ,2021-12-24,,,,,,,合格,国内监督抽查(河南市场监管局),2021-12-24,
食品伙伴网,,面条、饺子粉品质改良剂(复配小麦粉面粉处理剂),食品添加剂-->食品添加剂,郑州天下仓食品有限公司 ,郑州天下仓食品有限公司 ,2021-12-24,,,,,,,合格,国内监督抽查(河南市场监管局),2021-12-24,
食品伙伴网,,复配小麦粉面粉处理剂,食品添加剂-->食品添加剂,郑州海韦力食品工业有限公司 ,郑州海韦力食品工业有限公司 ,2021-12-24,,,,,,,合格,国内监督抽查(河南市场监管局),2021-12-24,
食品伙伴网,,复配面粉处理剂,食品添加剂-->食品添加剂,郑州海韦力食品工业有限公司 ,郑州海韦力食品工业有限公司 ,2021-12-24,,,,,,,合格,国内监督抽查(河南市场监管局),2021-12-24,
食品伙伴网,,复配乳化增稠剂GM-3757,食品添加剂-->食品添加剂,广东广美生化科技有限公司 ,广东广美生化科技有限公司 ,2022-01-11,,,,,,,合格,国内监督抽查(广东市场监管局),2022-01-11,
食品伙伴网,,复配乳化增稠剂GM-3811S,食品添加剂-->食品添加剂,广东广美生化科技有限公司 ,广东广美生化科技有限公司 ,2022-01-11,,,,,,,合格,国内监督抽查(广东市场监管局),2022-01-11,
食品伙伴网,,复配乳化增稠剂(糖浆皮改良剂),食品添加剂-->食品添加剂,广东广益科技实业有限公司 ,广东广益科技实业有限公司 ,2022-01-11,,,,,,,合格,国内监督抽查(广东市场监管局),2022-01-11,
食品伙伴网,,复配糕点防腐剂(RH-14),食品添加剂-->食品添加剂,广东广益科技实业有限公司 ,广东广益科技实业有限公司 ,2022-01-11,,,,,,,合格,国内监督抽查(广东市场监管局),2022-01-11,
食品伙伴网,,复配防腐剂(Ⅰ型),食品添加剂-->食品添加剂,广东广益科技实业有限公司 ,广东广益科技实业有限公司 ,2022-01-11,,,,,,,合格,国内监督抽查(广东市场监管局),2022-01-11,
食品伙伴网,,复配酶制剂面包改良剂(超软型),食品添加剂-->食品添加剂,广东佳焙食品股份有限公司 ,广东佳焙食品股份有限公司 ,2022-01-11,,,,,,,合格,国内监督抽查(广东市场监管局),2022-01-11,
食品伙伴网,,复配酶制剂面包改良剂,食品添加剂-->食品添加剂,广东佳焙食品股份有限公司 ,广东佳焙食品股份有限公司 ,2022-01-11,,,,,,,合格,国内监督抽查(广东市场监管局),2022-01-11,
食品伙伴网,,复配酶制剂面包改良剂,食品添加剂-->食品添加剂,广东佳焙食品股份有限公司 ,广东佳焙食品股份有限公司 ,2022-01-11,,,,,,,合格,国内监督抽查(广东市场监管局),2022-01-11,
食品伙伴网,,复配稳定剂(馅料稳定型),食品添加剂-->食品添加剂,东莞市焙芝友食品科技有限公司 ,东莞市焙芝友食品科技有限公司 ,2022-01-11,,,,,,,合格,国内监督抽查(广东市场监管局),2022-01-11,
食品伙伴网,,复配酶制剂日式多功能面包助剂BK-200,食品添加剂-->食品添加剂,东莞市焙芝友食品科技有限公司 ,东莞市焙芝友食品科技有限公司 ,2022-01-11,,,,,,,合格,国内监督抽查(广东市场监管局),2022-01-11,
食品伙伴网,,复配酶制剂超级面包浓缩酶,食品添加剂-->食品添加剂,广东省东莞市焙芝友食品科技有限公司 ,东莞市焙芝友食品科技有限公司 ,2022-01-11,,,,,,,合格,国内监督抽查(广东市场监管局),2022-01-11,
食品伙伴网,,BEEFFOODPOWDERPB06019牛肉味粉食品用香精,食品添加剂-->食品添加剂,东莞市保利德食品添加剂有限公司 ,东莞市保利德食品添加剂有限公司 ,2022-01-11,,,,,,,合格,国内监督抽查(广东市场监管局),2022-01-11,
